Date_Time_PH,Latitude,Longitude,Depth_In_Km,Magnitude,Location,Specific_Location,General_Location,datetime,date,time,hours_since_start,cluster
02/10/2025 10:54,11.02,124.24,24,2.1,028 km S 85° E of City Of Bogo (Cebu), City Of Bogo ,Cebu,2025-10-02 10:54:00,2025-10-02,10:54:00,34.88333333333333,1
03/10/2025 18:48,10.9,124.11,31,2.7,022 km S 41° E of City Of Bogo (Cebu), City Of Bogo ,Cebu,2025-10-03 18:48:00,2025-10-03,18:48:00,66.78333333333333,3
02/10/2025 17:03,11.18,124.04,28,2.3,017 km N 24° E of City Of Bogo (Cebu), City Of Bogo ,Cebu,2025-10-02 17:03:00,2025-10-02,17:03:00,41.03333333333333,3
09/10/2025 5:00,11.15,123.96,10,1.6,011 km N 13° W of City Of Bogo (Cebu), City Of Bogo ,Cebu,2025-10-09 05:00:00,2025-10-09,05:00:00,196.98333333333332,1
06/10/2025 22:28,11.08,124.11,22,2.6,015 km N 78° E of City Of Bogo (Cebu), City Of Bogo ,Cebu,2025-10-06 22:28:00,2025-10-06,22:28:00,142.45,1
24/10/2025 22:12,10.99,124.02,7,2.8,008 km S 31° E of City Of Bogo (Cebu), City Of Bogo ,Cebu,2025-10-24 22:12:00,2025-10-24,22:12:00,574.1833333333333,2
10/10/2025 8:41,11.04,124.08,32,1.7,011 km S 84° E of City Of Bogo (Cebu), City Of Bogo ,Cebu,2025-10-10 08:41:00,2025-10-10,08:41:00,224.66666666666666,3
14/10/2025 7:11,10.89,123.87,1,1.8,021 km S 35° W of City Of Bogo (Cebu), City Of Bogo ,Cebu,2025-10-14 07:11:00,2025-10-14,07:11:00,319.1666666666667,0
13/10/2025 7:29,10.98,123.93,7,2.7,009 km S 35° W of City Of Bogo (Cebu), City Of Bogo ,Cebu,2025-10-13 07:29:00,2025-10-13,07:29:00,295.46666666666664,0
01/10/2025 3:18,11.09,123.84,22,1.5,016 km N 72° W of City Of Bogo (Cebu), City Of Bogo ,Cebu,2025-10-01 03:18:00,2025-10-01,03:18:00,3.283333333333333,3
24/10/2025 8:06,11.14,124.17,33,1.8,024 km N 64° E of City Of Bogo (Cebu), City Of Bogo ,Cebu,2025-10-24 08:06:00,2025-10-24,08:06:00,560.0833333333334,3
25/10/2025 13:43,11.06,124.04,6,3.2,006 km N 80° E of City Of Bogo (Cebu), City Of Bogo ,Cebu,2025-10-25 13:43:00,2025-10-25,13:43:00,589.7,2
30/10/2025 2:25,11.17,124.13,8,2.2,021 km N 50° E of City Of Bogo (Cebu), City Of Bogo ,Cebu,2025-10-30 02:25:00,2025-10-30,02:25:00,698.4,2
01/10/2025 0:47,10.86,124.09,31,1.5,024 km S 29° E of City Of Bogo (Cebu), City Of Bogo ,Cebu,2025-10-01 00:47:00,2025-10-01,00:47:00,0.7666666666666667,3
02/10/2025 21:14,11.32,124.05,35,1.4,032 km N 15° E of City Of Bogo (Cebu), City Of Bogo ,Cebu,2025-10-02 21:14:00,2025-10-02,21:14:00,45.21666666666667,3
16/10/2025 7:58,11.14,124.06,26,1.7,013 km N 41° E of City Of Bogo (Cebu), City Of Bogo ,Cebu,2025-10-16 07:58:00,2025-10-16,07:58:00,367.95,3
05/10/2025 17:40,11.16,124.13,34,2.1,021 km N 53° E of City Of Bogo (Cebu), City Of Bogo ,Cebu,2025-10-05 17:40:00,2025-10-05,17:40:00,113.65,3
01/10/2025 8:52,11.2,124.14,19,1.7,024 km N 46° E of City Of Bogo (Cebu), City Of Bogo ,Cebu,2025-10-01 08:52:00,2025-10-01,08:52:00,8.85,1
12/10/2025 23:43,11.17,124.08,24,2.4,017 km N 38° E of City Of Bogo (Cebu), City Of Bogo ,Cebu,2025-10-12 23:43:00,2025-10-12,23:43:00,287.7,3
27/10/2025 0:50,10.98,124.12,36,1.8,017 km S 66° E of City Of Bogo (Cebu), City Of Bogo ,Cebu,2025-10-27 00:50:00,2025-10-27,00:50:00,624.8166666666667,2
10/10/2025 18:52,11.09,124.13,33,1.7,017 km N 72° E of City Of Bogo (Cebu), City Of Bogo ,Cebu,2025-10-10 18:52:00,2025-10-10,18:52:00,234.85,3
02/10/2025 2:45,10.92,123.95,10,3.0,014 km S 13° W of City Of Bogo (Cebu), City Of Bogo ,Cebu,2025-10-02 02:45:00,2025-10-02,02:45:00,26.733333333333334,0
02/10/2025 20:18,10.91,123.89,5,3.4,018 km S 35° W of City Of Bogo (Cebu), City Of Bogo ,Cebu,2025-10-02 20:18:00,2025-10-02,20:18:00,44.28333333333333,0
01/10/2025 8:15,11.16,124.05,32,2.0,015 km N 32° E of City Of Bogo (Cebu), City Of Bogo ,Cebu,2025-10-01 08:15:00,2025-10-01,08:15:00,8.233333333333333,3
02/10/2025 3:03,10.96,124.14,20,1.2,020 km S 61° E of City Of Bogo (Cebu), City Of Bogo ,Cebu,2025-10-02 03:03:00,2025-10-02,03:03:00,27.033333333333335,3
04/10/2025 3:18,11.13,124.1,32,1.7,017 km N 54° E of City Of Bogo (Cebu), City Of Bogo ,Cebu,2025-10-04 03:18:00,2025-10-04,03:18:00,75.28333333333333,3
03/10/2025 19:39,11.25,123.96,8,2.4,023 km N 05° W of City Of Bogo (Cebu), City Of Bogo ,Cebu,2025-10-03 19:39:00,2025-10-03,19:39:00,67.63333333333334,1
13/10/2025 2:55,11.03,123.99,7,2.3,002 km S 27° E of City Of Bogo (Cebu), City Of Bogo ,Cebu,2025-10-13 02:55:00,2025-10-13,02:55:00,290.9,0
26/10/2025 3:43,10.9,123.95,1,2.4,017 km S 11° W of City Of Bogo (Cebu), City Of Bogo ,Cebu,2025-10-26 03:43:00,2025-10-26,03:43:00,603.7,2
05/10/2025 6:45,11.16,124.19,5,2.6,026 km N 61° E of City Of Bogo (Cebu), City Of Bogo ,Cebu,2025-10-05 06:45:00,2025-10-05,06:45:00,102.73333333333333,1
07/10/2025 3:29,11.17,124.18,12,1.5,026 km N 58° E of City Of Bogo (Cebu), City Of Bogo ,Cebu,2025-10-07 03:29:00,2025-10-07,03:29:00,147.46666666666667,1
25/10/2025 20:29,11.02,124.03,8,2.7,007 km S 63° E of City Of Bogo (Cebu), City Of Bogo ,Cebu,2025-10-25 20:29:00,2025-10-25,20:29:00,596.4666666666667,2
08/10/2025 21:27,11.11,123.94,3,1.9,008 km N 31° W of City Of Bogo (Cebu), City Of Bogo ,Cebu,2025-10-08 21:27:00,2025-10-08,21:27:00,189.43333333333334,1
04/10/2025 23:42,11.14,124.08,6,2.0,015 km N 46° E of City Of Bogo (Cebu), City Of Bogo ,Cebu,2025-10-04 23:42:00,2025-10-04,23:42:00,95.68333333333334,1
12/10/2025 23:18,11.09,124.04,5,2.8,008 km N 54° E of City Of Bogo (Cebu), City Of Bogo ,Cebu,2025-10-12 23:18:00,2025-10-12,23:18:00,287.28333333333336,1
08/10/2025 4:28,11.1,124.3,34,1.6,036 km N 80° E of City Of Bogo (Cebu), City Of Bogo ,Cebu,2025-10-08 04:28:00,2025-10-08,04:28:00,172.45,3
04/10/2025 16:50,11.04,123.99,1,2.3,002 km S 79° E of City Of Bogo (Cebu), City Of Bogo ,Cebu,2025-10-04 16:50:00,2025-10-04,16:50:00,88.81666666666666,0
13/10/2025 9:03,11.02,123.91,4,3.1,009 km S 71° W of City Of Bogo (Cebu), City Of Bogo ,Cebu,2025-10-13 09:03:00,2025-10-13,09:03:00,297.03333333333336,0
06/10/2025 21:52,11.11,123.98,33,2.2,007 km N 03° W of City Of Bogo (Cebu), City Of Bogo ,Cebu,2025-10-06 21:52:00,2025-10-06,21:52:00,141.85,3
17/10/2025 20:23,11.48,123.86,39,1.2,049 km N 14° W of City Of Bogo (Cebu), City Of Bogo ,Cebu,2025-10-17 20:23:00,2025-10-17,20:23:00,404.3666666666667,3
01/10/2025 1:27,10.93,124.07,15,1.6,016 km S 38° E of City Of Bogo (Cebu), City Of Bogo ,Cebu,2025-10-01 01:27:00,2025-10-01,01:27:00,1.4333333333333333,3
24/10/2025 2:09,10.88,123.94,8,2.0,018 km S 14° W of City Of Bogo (Cebu), City Of Bogo ,Cebu,2025-10-24 02:09:00,2025-10-24,02:09:00,554.1333333333333,2
05/10/2025 14:52,11.18,124.07,8,2.2,018 km N 36° E of City Of Bogo (Cebu), City Of Bogo ,Cebu,2025-10-05 14:52:00,2025-10-05,14:52:00,110.85,1
04/10/2025 2:06,11.07,123.97,4,2.2,003 km N 14° W of City Of Bogo (Cebu), City Of Bogo ,Cebu,2025-10-04 02:06:00,2025-10-04,02:06:00,74.08333333333333,0
22/10/2025 6:29,11.2,123.91,2,3.3,018 km N 25° W of City Of Bogo (Cebu), City Of Bogo ,Cebu,2025-10-22 06:29:00,2025-10-22,06:29:00,510.46666666666664,2
09/10/2025 1:31,11.15,123.95,7,1.7,012 km N 14° W of City Of Bogo (Cebu), City Of Bogo ,Cebu,2025-10-09 01:31:00,2025-10-09,01:31:00,193.5,1
08/10/2025 21:10,11.14,124.12,5,2.3,019 km N 57° E of City Of Bogo (Cebu), City Of Bogo ,Cebu,2025-10-08 21:10:00,2025-10-08,21:10:00,189.15,1
03/10/2025 22:51,11.17,123.94,10,2.3,015 km N 18° W of City Of Bogo (Cebu), City Of Bogo ,Cebu,2025-10-03 22:51:00,2025-10-03,22:51:00,70.83333333333333,1
18/10/2025 11:01,11.05,124.11,1,2.3,015 km N 89° E of City Of Bogo (Cebu), City Of Bogo ,Cebu,2025-10-18 11:01:00,2025-10-18,11:01:00,419.0,2
20/10/2025 11:26,10.96,123.86,8,2.9,016 km S 53° W of City Of Bogo (Cebu), City Of Bogo ,Cebu,2025-10-20 11:26:00,2025-10-20,11:26:00,467.4166666666667,0
03/10/2025 21:44,11.03,124.04,1,2.0,007 km S 74° E of City Of Bogo (Cebu), City Of Bogo ,Cebu,2025-10-03 21:44:00,2025-10-03,21:44:00,69.71666666666667,1
04/10/2025 22:29,10.97,123.93,8,2.3,010 km S 30° W of City Of Bogo (Cebu), City Of Bogo ,Cebu,2025-10-04 22:29:00,2025-10-04,22:29:00,94.46666666666667,0
04/10/2025 18:43,10.91,123.89,1,2.0,018 km S 34° W of City Of Bogo (Cebu), City Of Bogo ,Cebu,2025-10-04 18:43:00,2025-10-04,18:43:00,90.7,0
08/10/2025 1:55,11.08,123.93,30,1.9,007 km N 55° W of City Of Bogo (Cebu), City Of Bogo ,Cebu,2025-10-08 01:55:00,2025-10-08,01:55:00,169.9,3
04/10/2025 1:38,11.16,124.16,4,2.8,024 km N 58° E of City Of Bogo (Cebu), City Of Bogo ,Cebu,2025-10-04 01:38:00,2025-10-04,01:38:00,73.61666666666666,1
11/10/2025 4:14,11.26,124.03,25,1.9,024 km N 12° E of City Of Bogo (Cebu), City Of Bogo ,Cebu,2025-10-11 04:14:00,2025-10-11,04:14:00,244.21666666666667,3
04/10/2025 3:05,11.1,124.14,32,1.6,019 km N 72° E of City Of Bogo (Cebu), City Of Bogo ,Cebu,2025-10-04 03:05:00,2025-10-04,03:05:00,75.06666666666666,3
30/10/2025 23:04,11.02,124.13,1,1.7,016 km S 81° E of City Of Bogo (Cebu), City Of Bogo ,Cebu,2025-10-30 23:04:00,2025-10-30,23:04:00,719.05,2
03/10/2025 17:56,11.34,124.16,5,1.9,015 km N 55° E of City Of Bogo (Cebu), City Of Bogo ,Cebu,2025-10-03 17:56:00,2025-10-03,17:56:00,65.91666666666667,1
25/10/2025 2:28,11.11,124.14,5,3.1,019 km N 67° E of City Of Bogo (Cebu), City Of Bogo ,Cebu,2025-10-25 02:28:00,2025-10-25,02:28:00,578.45,2
01/10/2025 20:42,11.2,124.07,33,2.2,020 km N 29° E of City Of Bogo (Cebu), City Of Bogo ,Cebu,2025-10-01 20:42:00,2025-10-01,20:42:00,20.683333333333334,3
04/10/2025 21:35,11.02,123.98,31,1.3,003 km South of City Of Bogo (Cebu), City Of Bogo ,Cebu,2025-10-04 21:35:00,2025-10-04,21:35:00,93.56666666666666,3
17/10/2025 1:31,11.25,124.18,8,3.2,031 km N 45° E of City Of Bogo (Cebu), City Of Bogo ,Cebu,2025-10-17 01:31:00,2025-10-17,01:31:00,385.5,1
01/10/2025 7:24,11.02,123.89,22,2.0,011 km S 71° W of City Of Bogo (Cebu), City Of Bogo ,Cebu,2025-10-01 07:24:00,2025-10-01,07:24:00,7.383333333333334,0
15/10/2025 23:25,11.04,123.89,24,3.7,010 km S 84° W of City Of Bogo (Cebu), City Of Bogo ,Cebu,2025-10-15 23:25:00,2025-10-15,23:25:00,359.4,0
30/10/2025 12:04,11.03,124.0,28,1.9,003 km S 46° E of City Of Bogo (Cebu), City Of Bogo ,Cebu,2025-10-30 12:04:00,2025-10-30,12:04:00,708.05,2
01/10/2025 8:51,11.12,123.96,24,2.0,009 km N 14° W of City Of Bogo (Cebu), City Of Bogo ,Cebu,2025-10-01 08:51:00,2025-10-01,08:51:00,8.833333333333334,3
13/10/2025 3:18,11.04,124.02,1,4.3,004 km S 81° E of City Of Bogo (Cebu), City Of Bogo ,Cebu,2025-10-13 03:18:00,2025-10-13,03:18:00,291.28333333333336,0
29/10/2025 20:52,11.0,124.03,27,1.9,008 km S 43° E of City Of Bogo (Cebu), City Of Bogo ,Cebu,2025-10-29 20:52:00,2025-10-29,20:52:00,692.85,2
03/10/2025 20:12,11.1,124.07,7,2.4,011 km N 60° E of City Of Bogo (Cebu), City Of Bogo ,Cebu,2025-10-03 20:12:00,2025-10-03,20:12:00,68.18333333333334,1
01/10/2025 0:28,11.03,123.92,2,3.1,006 km S 72° W of City Of Bogo (Cebu), City Of Bogo ,Cebu,2025-10-01 00:28:00,2025-10-01,00:28:00,0.45,0
04/10/2025 22:09,10.98,123.99,34,1.5,007 km S 08° E of City Of Bogo (Cebu), City Of Bogo ,Cebu,2025-10-04 22:09:00,2025-10-04,22:09:00,94.13333333333334,3
11/10/2025 16:38,11.13,124.11,2,2.0,018 km N 56° E of City Of Bogo (Cebu), City Of Bogo ,Cebu,2025-10-11 16:38:00,2025-10-11,16:38:00,256.6166666666667,1
15/10/2025 0:54,11.19,123.98,29,1.8,016 km N 01° W of City Of Bogo (Cebu), City Of Bogo ,Cebu,2025-10-15 00:54:00,2025-10-15,00:54:00,336.8833333333333,3
24/10/2025 23:18,10.98,123.99,6,2.1,008 km S 10° E of City Of Bogo (Cebu), City Of Bogo ,Cebu,2025-10-24 23:18:00,2025-10-24,23:18:00,575.2833333333333,2
08/10/2025 12:01,10.99,123.98,1,1.4,006 km S 01° W of City Of Bogo (Cebu), City Of Bogo ,Cebu,2025-10-08 12:01:00,2025-10-08,12:01:00,180.0,0
04/10/2025 12:26,11.15,124.15,34,1.8,022 km N 58° E of City Of Bogo (Cebu), City Of Bogo ,Cebu,2025-10-04 12:26:00,2025-10-04,12:26:00,84.41666666666667,3
01/10/2025 4:36,11.14,123.87,20,2.6,016 km N 49° W of City Of Bogo (Cebu), City Of Bogo ,Cebu,2025-10-01 04:36:00,2025-10-01,04:36:00,4.583333333333333,0
11/10/2025 1:43,10.86,123.84,13,2.6,025 km S 37° W of City Of Bogo (Cebu), City Of Bogo ,Cebu,2025-10-11 01:43:00,2025-10-11,01:43:00,241.7,0
03/10/2025 16:13,11.19,124.16,33,1.8,026 km N 52° E of City Of Bogo (Cebu), City Of Bogo ,Cebu,2025-10-03 16:13:00,2025-10-03,16:13:00,64.2,3
06/10/2025 3:21,11.17,124.12,33,1.4,020 km N 49° E of City Of Bogo (Cebu), City Of Bogo ,Cebu,2025-10-06 03:21:00,2025-10-06,03:21:00,123.33333333333333,3
02/10/2025 0:24,10.88,124.02,32,1.5,019 km S 14° E of City Of Bogo (Cebu), City Of Bogo ,Cebu,2025-10-02 00:24:00,2025-10-02,00:24:00,24.383333333333333,3
21/10/2025 23:56,11.13,123.83,32,2.1,018 km N 61° W of City Of Bogo (Cebu), City Of Bogo ,Cebu,2025-10-21 23:56:00,2025-10-21,23:56:00,503.9166666666667,2
30/10/2025 2:43,11.12,124.12,6,2.0,018 km N 61° E of City Of Bogo (Cebu), City Of Bogo ,Cebu,2025-10-30 02:43:00,2025-10-30,02:43:00,698.7,2
06/10/2025 8:17,11.16,124.19,7,1.9,026 km N 61° E of City Of Bogo (Cebu), City Of Bogo ,Cebu,2025-10-06 08:17:00,2025-10-06,08:17:00,128.26666666666668,1
03/10/2025 20:28,10.96,123.94,2,3.4,010 km S 27° W of City Of Bogo (Cebu), City Of Bogo ,Cebu,2025-10-03 20:28:00,2025-10-03,20:28:00,68.45,0
04/10/2025 8:58,11.01,123.95,3,2.4,005 km S 35° W of City Of Bogo (Cebu), City Of Bogo ,Cebu,2025-10-04 08:58:00,2025-10-04,08:58:00,80.95,0
20/10/2025 4:42,11.07,124.14,5,2.0,018 km N 82° E of City Of Bogo (Cebu), City Of Bogo ,Cebu,2025-10-20 04:42:00,2025-10-20,04:42:00,460.68333333333334,2
06/10/2025 5:06,11.18,124.04,32,1.6,016 km N 22° E of City Of Bogo (Cebu), City Of Bogo ,Cebu,2025-10-06 05:06:00,2025-10-06,05:06:00,125.08333333333333,3
06/10/2025 10:19,10.98,123.81,3,1.6,020 km S 67° W of City Of Bogo (Cebu), City Of Bogo ,Cebu,2025-10-06 10:19:00,2025-10-06,10:19:00,130.3,0
13/10/2025 3:03,11.0,123.97,7,2.3,006 km S 12° W of City Of Bogo (Cebu), City Of Bogo ,Cebu,2025-10-13 03:03:00,2025-10-13,03:03:00,291.03333333333336,0
18/10/2025 7:28,11.03,124.02,2,2.4,004 km S 71° E of City Of Bogo (Cebu), City Of Bogo ,Cebu,2025-10-18 07:28:00,2025-10-18,07:28:00,415.45,2
25/10/2025 16:49,11.09,124.09,3,3.2,013 km N 69° E of City Of Bogo (Cebu), City Of Bogo ,Cebu,2025-10-25 16:49:00,2025-10-25,16:49:00,592.8,2
14/10/2025 23:21,10.94,123.92,18,2.1,013 km S 30° W of City Of Bogo (Cebu), City Of Bogo ,Cebu,2025-10-14 23:21:00,2025-10-14,23:21:00,335.3333333333333,0
16/10/2025 15:32,11.09,124.06,33,2.4,010 km N 60° E of City Of Bogo (Cebu), City Of Bogo ,Cebu,2025-10-16 15:32:00,2025-10-16,15:32:00,375.51666666666665,3
13/10/2025 2:28,11.02,124.0,13,2.3,003 km S 40° E of City Of Bogo (Cebu), City Of Bogo ,Cebu,2025-10-13 02:28:00,2025-10-13,02:28:00,290.45,0
02/10/2025 12:28,11.18,124.13,11,2.1,022 km N 47° E of City Of Bogo (Cebu), City Of Bogo ,Cebu,2025-10-02 12:28:00,2025-10-02,12:28:00,36.45,1
30/10/2025 19:16,10.9,123.91,6,2.1,018 km S 26° W of City Of Bogo (Cebu), City Of Bogo ,Cebu,2025-10-30 19:16:00,2025-10-30,19:16:00,715.25,2
02/10/2025 15:46,11.07,124.25,6,2.2,029 km N 85° E of City Of Bogo (Cebu), City Of Bogo ,Cebu,2025-10-02 15:46:00,2025-10-02,15:46:00,39.75,1
28/10/2025 3:55,11.21,124.22,4,1.8,032 km N 55° E of City Of Bogo (Cebu), City Of Bogo ,Cebu,2025-10-28 03:55:00,2025-10-28,03:55:00,651.9,2
20/10/2025 17:43,11.18,124.13,33,1.7,022 km N 48° E of City Of Bogo (Cebu), City Of Bogo ,Cebu,2025-10-20 17:43:00,2025-10-20,17:43:00,473.7,3
01/10/2025 6:11,11.15,124.0,24,2.0,012 km N 13° E of City Of Bogo (Cebu), City Of Bogo ,Cebu,2025-10-01 06:11:00,2025-10-01,06:11:00,6.166666666666667,3
07/10/2025 20:30,11.24,124.18,9,1.6,031 km N 45° E of City Of Bogo (Cebu), City Of Bogo ,Cebu,2025-10-07 20:30:00,2025-10-07,20:30:00,164.48333333333332,1
29/10/2025 3:47,11.02,124.03,6,3.4,007 km S 58° E of City Of Bogo (Cebu), City Of Bogo ,Cebu,2025-10-29 03:47:00,2025-10-29,03:47:00,675.7666666666667,2
01/10/2025 5:10,11.08,124.05,23,2.5,008 km N 64° E of City Of Bogo (Cebu), City Of Bogo ,Cebu,2025-10-01 05:10:00,2025-10-01,05:10:00,5.15,3
16/10/2025 4:09,11.1,124.01,32,2.2,007 km N 29° E of City Of Bogo (Cebu), City Of Bogo ,Cebu,2025-10-16 04:09:00,2025-10-16,04:09:00,364.1333333333333,3
01/10/2025 15:43,11.17,123.99,27,1.3,014 km N 06° E of City Of Bogo (Cebu), City Of Bogo ,Cebu,2025-10-01 15:43:00,2025-10-01,15:43:00,15.7,3
02/10/2025 7:20,11.11,124.01,29,2.7,008 km N 22° E of City Of Bogo (Cebu), City Of Bogo ,Cebu,2025-10-02 07:20:00,2025-10-02,07:20:00,31.316666666666666,3
11/10/2025 13:39,10.99,123.97,26,1.3,006 km S 11° W of City Of Bogo (Cebu), City Of Bogo ,Cebu,2025-10-11 13:39:00,2025-10-11,13:39:00,253.63333333333333,3
03/10/2025 3:17,11.16,123.95,8,1.2,013 km N 14° W of City Of Bogo (Cebu), City Of Bogo ,Cebu,2025-10-03 03:17:00,2025-10-03,03:17:00,51.266666666666666,1
04/10/2025 0:09,10.98,123.97,21,2.0,008 km S 10° W of City Of Bogo (Cebu), City Of Bogo ,Cebu,2025-10-04 00:09:00,2025-10-04,00:09:00,72.13333333333334,3
01/10/2025 6:48,10.98,123.97,19,2.0,007 km S 11° W of City Of Bogo (Cebu), City Of Bogo ,Cebu,2025-10-01 06:48:00,2025-10-01,06:48:00,6.783333333333333,0
18/10/2025 1:16,11.09,124.09,32,1.5,013 km N 70° E of City Of Bogo (Cebu), City Of Bogo ,Cebu,2025-10-18 01:16:00,2025-10-18,01:16:00,409.25,3
02/10/2025 10:31,11.09,123.99,33,1.9,005 km N 17° E of City Of Bogo (Cebu), City Of Bogo ,Cebu,2025-10-02 10:31:00,2025-10-02,10:31:00,34.5,3
02/10/2025 2:03,11.13,124.14,4,1.4,020 km N 63° E of City Of Bogo (Cebu), City Of Bogo ,Cebu,2025-10-02 02:03:00,2025-10-02,02:03:00,26.033333333333335,1
29/10/2025 16:01,10.89,123.93,2,2.6,018 km S 18° W of City Of Bogo (Cebu), City Of Bogo ,Cebu,2025-10-29 16:01:00,2025-10-29,16:01:00,688.0,2
07/10/2025 17:37,11.02,123.94,7,3.0,006 km S 55° W of City Of Bogo (Cebu), City Of Bogo ,Cebu,2025-10-07 17:37:00,2025-10-07,17:37:00,161.6,0
23/10/2025 23:38,11.14,124.02,7,2.2,011 km N 24° E of City Of Bogo (Cebu), City Of Bogo ,Cebu,2025-10-23 23:38:00,2025-10-23,23:38:00,551.6166666666667,2
07/10/2025 3:25,11.14,124.01,32,1.4,011 km N 17° E of City Of Bogo (Cebu), City Of Bogo ,Cebu,2025-10-07 03:25:00,2025-10-07,03:25:00,147.4,3
06/10/2025 9:01,11.17,124.08,6,1.7,017 km N 41° E of City Of Bogo (Cebu), City Of Bogo ,Cebu,2025-10-06 09:01:00,2025-10-06,09:01:00,129.0,1
02/10/2025 20:20,10.96,123.89,10,2.1,013 km S 44° W of City Of Bogo (Cebu), City Of Bogo ,Cebu,2025-10-02 20:20:00,2025-10-02,20:20:00,44.31666666666667,0
29/10/2025 22:01,10.91,123.97,4,2.7,015 km S 03° W of City Of Bogo (Cebu), City Of Bogo ,Cebu,2025-10-29 22:01:00,2025-10-29,22:01:00,694.0,2
05/10/2025 8:58,11.13,123.94,4,4.1,010 km N 27° W of City Of Bogo (Cebu), City Of Bogo ,Cebu,2025-10-05 08:58:00,2025-10-05,08:58:00,104.95,0
12/10/2025 15:48,11.19,124.14,34,1.5,024 km N 48° E of City Of Bogo (Cebu), City Of Bogo ,Cebu,2025-10-12 15:48:00,2025-10-12,15:48:00,279.78333333333336,3
11/10/2025 19:48,11.07,123.96,3,2.6,003 km N 31° W of City Of Bogo (Cebu), City Of Bogo ,Cebu,2025-10-11 19:48:00,2025-10-11,19:48:00,259.78333333333336,0
28/10/2025 3:55,11.22,124.21,10,1.9,031 km N 52° E of City Of Bogo (Cebu), City Of Bogo ,Cebu,2025-10-28 03:55:00,2025-10-28,03:55:00,651.9,2
02/10/2025 0:08,11.12,123.95,10,1.8,009 km N 23° W of City Of Bogo (Cebu), City Of Bogo ,Cebu,2025-10-02 00:08:00,2025-10-02,00:08:00,24.116666666666667,1
06/10/2025 22:54,11.2,124.13,4,1.8,023 km N 43° E of City Of Bogo (Cebu), City Of Bogo ,Cebu,2025-10-06 22:54:00,2025-10-06,22:54:00,142.88333333333333,1
14/10/2025 17:57,10.98,123.85,18,2.4,016 km S 65° W of City Of Bogo (Cebu), City Of Bogo ,Cebu,2025-10-14 17:57:00,2025-10-14,17:57:00,329.93333333333334,0
16/10/2025 23:47,10.87,123.92,8,1.7,021 km S 19° W of City Of Bogo (Cebu), City Of Bogo ,Cebu,2025-10-16 23:47:00,2025-10-16,23:47:00,383.76666666666665,0
01/10/2025 15:47,11.0,123.93,26,1.6,007 km S 48° W of City Of Bogo (Cebu), City Of Bogo ,Cebu,2025-10-01 15:47:00,2025-10-01,15:47:00,15.766666666666667,3
01/10/2025 9:19,11.12,124.05,33,2.0,011 km N 43° E of City Of Bogo (Cebu), City Of Bogo ,Cebu,2025-10-01 09:19:00,2025-10-01,09:19:00,9.3,3
18/10/2025 11:02,11.26,124.09,41,2.6,027 km N 26° E of City Of Bogo (Cebu), City Of Bogo ,Cebu,2025-10-18 11:02:00,2025-10-18,11:02:00,419.01666666666665,3
16/10/2025 1:20,11.1,124.03,22,1.6,008 km N 41° E of City Of Bogo (Cebu), City Of Bogo ,Cebu,2025-10-16 01:20:00,2025-10-16,01:20:00,361.31666666666666,3
02/10/2025 1:05,10.89,123.92,5,2.5,019 km S 21° W of City Of Bogo (Cebu), City Of Bogo ,Cebu,2025-10-02 01:05:00,2025-10-02,01:05:00,25.066666666666666,0
01/10/2025 9:35,11.09,124.06,2,3.2,010 km N 59° E of City Of Bogo (Cebu), City Of Bogo ,Cebu,2025-10-01 09:35:00,2025-10-01,09:35:00,9.566666666666666,1
03/10/2025 11:26,11.14,124.04,32,1.8,012 km N 36° E of City Of Bogo (Cebu), City Of Bogo ,Cebu,2025-10-03 11:26:00,2025-10-03,11:26:00,59.416666666666664,3
05/10/2025 1:17,11.11,124.05,20,1.5,011 km N 46° E of City Of Bogo (Cebu), City Of Bogo ,Cebu,2025-10-05 01:17:00,2025-10-05,01:17:00,97.26666666666667,3
12/10/2025 22:06,11.15,124.04,30,1.8,013 km N 30° E of City Of Bogo (Cebu), City Of Bogo ,Cebu,2025-10-12 22:06:00,2025-10-12,22:06:00,286.0833333333333,3
24/10/2025 2:50,11.11,124.1,7,1.8,015 km N 62° E of City Of Bogo (Cebu), City Of Bogo ,Cebu,2025-10-24 02:50:00,2025-10-24,02:50:00,554.8166666666667,2
30/10/2025 17:26,11.2,124.14,3,3.3,024 km N 48° E of City Of Bogo (Cebu), City Of Bogo ,Cebu,2025-10-30 17:26:00,2025-10-30,17:26:00,713.4166666666666,2
30/10/2025 6:01,11.09,123.96,13,2.0,006 km N 23° W of City Of Bogo (Cebu), City Of Bogo ,Cebu,2025-10-30 06:01:00,2025-10-30,06:01:00,702.0,2
22/10/2025 21:31,10.99,123.95,21,2.1,007 km S 27° W of City Of Bogo (Cebu), City Of Bogo ,Cebu,2025-10-22 21:31:00,2025-10-22,21:31:00,525.5,2
15/10/2025 0:25,11.04,124.05,18,2.1,008 km S 88° E of City Of Bogo (Cebu), City Of Bogo ,Cebu,2025-10-15 00:25:00,2025-10-15,00:25:00,336.4,2
02/10/2025 10:05,11.05,124.0,13,2.2,002 km N 76° E of City Of Bogo (Cebu), City Of Bogo ,Cebu,2025-10-02 10:05:00,2025-10-02,10:05:00,34.06666666666667,1
12/10/2025 8:59,11.12,124.07,11,2.2,013 km N 52° E of City Of Bogo (Cebu), City Of Bogo ,Cebu,2025-10-12 08:59:00,2025-10-12,08:59:00,272.96666666666664,1
26/10/2025 11:23,10.88,123.95,6,3.0,019 km S 11° W of City Of Bogo (Cebu), City Of Bogo ,Cebu,2025-10-26 11:23:00,2025-10-26,11:23:00,611.3666666666667,2
05/10/2025 19:11,11.02,124.11,4,1.9,014 km S 79° E of City Of Bogo (Cebu), City Of Bogo ,Cebu,2025-10-05 19:11:00,2025-10-05,19:11:00,115.16666666666667,1
02/10/2025 13:11,10.95,123.91,7,3.0,013 km S 33° W of City Of Bogo (Cebu), City Of Bogo ,Cebu,2025-10-02 13:11:00,2025-10-02,13:11:00,37.166666666666664,0
24/10/2025 18:01,11.24,124.21,13,1.7,033 km N 49° E of City Of Bogo (Cebu), City Of Bogo ,Cebu,2025-10-24 18:01:00,2025-10-24,18:01:00,570.0,2
02/10/2025 20:25,10.96,124.12,34,2.4,019 km S 58° E of City Of Bogo (Cebu), City Of Bogo ,Cebu,2025-10-02 20:25:00,2025-10-02,20:25:00,44.4,3
28/10/2025 3:02,10.91,123.92,7,2.5,016 km S 26° W of City Of Bogo (Cebu), City Of Bogo ,Cebu,2025-10-28 03:02:00,2025-10-28,03:02:00,651.0166666666667,2
30/10/2025 18:01,11.12,124.18,6,2.5,023 km N 69° E of City Of Bogo (Cebu), City Of Bogo ,Cebu,2025-10-30 18:01:00,2025-10-30,18:01:00,714.0,2
30/10/2025 2:02,11.11,124.02,27,2.3,008 km N 35° E of City Of Bogo (Cebu), City Of Bogo ,Cebu,2025-10-30 02:02:00,2025-10-30,02:02:00,698.0166666666667,2
20/10/2025 6:57,10.95,123.92,2,2.6,013 km S 32° W of City Of Bogo (Cebu), City Of Bogo ,Cebu,2025-10-20 06:57:00,2025-10-20,06:57:00,462.93333333333334,0
21/10/2025 0:06,11.14,124.03,26,2.1,012 km N 30° E of City Of Bogo (Cebu), City Of Bogo ,Cebu,2025-10-21 00:06:00,2025-10-21,00:06:00,480.0833333333333,2
01/10/2025 12:19,11.01,123.94,4,3.3,006 km S 50° W of City Of Bogo (Cebu), City Of Bogo ,Cebu,2025-10-01 12:19:00,2025-10-01,12:19:00,12.3,0
09/10/2025 2:54,11.14,123.97,11,1.6,010 km N 06° W of City Of Bogo (Cebu), City Of Bogo ,Cebu,2025-10-09 02:54:00,2025-10-09,02:54:00,194.88333333333333,1
02/10/2025 0:21,10.91,123.91,13,1.5,017 km S 39° W of City Of Bogo (Cebu), City Of Bogo ,Cebu,2025-10-02 00:21:00,2025-10-02,00:21:00,24.333333333333332,0
29/10/2025 17:48,10.9,123.96,1,2.1,016 km S 09° W of City Of Bogo (Cebu), City Of Bogo ,Cebu,2025-10-29 17:48:00,2025-10-29,17:48:00,689.7833333333333,2
01/10/2025 21:46,11.04,124.07,3,2.7,010 km S 83° E of City Of Bogo (Cebu), City Of Bogo ,Cebu,2025-10-01 21:46:00,2025-10-01,21:46:00,21.75,1
03/10/2025 10:37,11.13,124.11,6,2.2,017 km N 59° E of City Of Bogo (Cebu), City Of Bogo ,Cebu,2025-10-03 10:37:00,2025-10-03,10:37:00,58.6,1
11/10/2025 15:21,11.24,124.03,30,1.9,022 km N 16° E of City Of Bogo (Cebu), City Of Bogo ,Cebu,2025-10-11 15:21:00,2025-10-11,15:21:00,255.33333333333334,3
06/10/2025 19:48,10.98,123.97,28,1.7,007 km S 05° W of City Of Bogo (Cebu), City Of Bogo ,Cebu,2025-10-06 19:48:00,2025-10-06,19:48:00,139.78333333333333,3
02/10/2025 0:15,10.86,123.95,1,2.3,021 km S 08° W of City Of Bogo (Cebu), City Of Bogo ,Cebu,2025-10-02 00:15:00,2025-10-02,00:15:00,24.233333333333334,0
15/10/2025 8:03,10.89,123.92,5,3.0,018 km S 20° W of City Of Bogo (Cebu), City Of Bogo ,Cebu,2025-10-15 08:03:00,2025-10-15,08:03:00,344.03333333333336,0
07/10/2025 10:19,11.12,123.93,2,2.2,009 km N 35° W of City Of Bogo (Cebu), City Of Bogo ,Cebu,2025-10-07 10:19:00,2025-10-07,10:19:00,154.3,0
05/10/2025 7:52,10.98,124.15,35,1.3,020 km S 69° E of City Of Bogo (Cebu), City Of Bogo ,Cebu,2025-10-05 07:52:00,2025-10-05,07:52:00,103.85,3
01/10/2025 7:14,10.83,123.89,8,2.1,026 km S 21° W of City Of Bogo (Cebu), City Of Bogo ,Cebu,2025-10-01 07:14:00,2025-10-01,07:14:00,7.216666666666667,0
14/10/2025 1:23,11.32,123.98,6,2.2,030 km N 01° E of City Of Bogo (Cebu), City Of Bogo ,Cebu,2025-10-14 01:23:00,2025-10-14,01:23:00,313.3666666666667,1
05/10/2025 2:22,11.07,124.04,24,1.6,007 km N 68° E of City Of Bogo (Cebu), City Of Bogo ,Cebu,2025-10-05 02:22:00,2025-10-05,02:22:00,98.35,3
03/10/2025 1:13,10.89,123.94,1,1.8,017 km S 13° W of City Of Bogo (Cebu), City Of Bogo ,Cebu,2025-10-03 01:13:00,2025-10-03,01:13:00,49.2,0
02/10/2025 0:38,11.04,124.01,2,2.7,004 km S 70° E of City Of Bogo (Cebu), City Of Bogo ,Cebu,2025-10-02 00:38:00,2025-10-02,00:38:00,24.616666666666667,0
30/10/2025 18:37,11.01,124.1,32,1.8,013 km S 74° E of City Of Bogo (Cebu), City Of Bogo ,Cebu,2025-10-30 18:37:00,2025-10-30,18:37:00,714.6,2
04/10/2025 3:57,11.07,123.96,21,2.6,003 km N 46° W of City Of Bogo (Cebu), City Of Bogo ,Cebu,2025-10-04 03:57:00,2025-10-04,03:57:00,75.93333333333334,0
02/10/2025 20:15,11.14,124.11,27,2.0,018 km N 53° E of City Of Bogo (Cebu), City Of Bogo ,Cebu,2025-10-02 20:15:00,2025-10-02,20:15:00,44.233333333333334,3
14/10/2025 6:34,11.22,124.07,32,1.6,021 km N 27° E of City Of Bogo (Cebu), City Of Bogo ,Cebu,2025-10-14 06:34:00,2025-10-14,06:34:00,318.55,3
28/10/2025 19:08,11.1,124.01,30,1.7,012 km N 25° E of City Of Bogo (Cebu), City Of Bogo ,Cebu,2025-10-28 19:08:00,2025-10-28,19:08:00,667.1166666666667,2
01/10/2025 11:23,10.96,123.94,1,2.5,011 km S 24° W of City Of Bogo (Cebu), City Of Bogo ,Cebu,2025-10-01 11:23:00,2025-10-01,11:23:00,11.366666666666667,0
16/10/2025 18:17,11.28,124.06,30,1.3,027 km N 18° E of City Of Bogo (Cebu), City Of Bogo ,Cebu,2025-10-16 18:17:00,2025-10-16,18:17:00,378.26666666666665,3
03/10/2025 11:29,11.0,123.92,7,1.7,008 km S 53° W of City Of Bogo (Cebu), City Of Bogo ,Cebu,2025-10-03 11:29:00,2025-10-03,11:29:00,59.46666666666667,0
04/10/2025 18:11,11.05,124.06,6,1.5,009 km N 85° E of City Of Bogo (Cebu), City Of Bogo ,Cebu,2025-10-04 18:11:00,2025-10-04,18:11:00,90.16666666666667,1
26/10/2025 11:58,11.12,123.96,4,2.8,008 km N 16° W of City Of Bogo (Cebu), City Of Bogo ,Cebu,2025-10-26 11:58:00,2025-10-26,11:58:00,611.95,2
06/10/2025 9:35,11.11,123.92,7,2.9,010 km N 44° W of City Of Bogo (Cebu), City Of Bogo ,Cebu,2025-10-06 09:35:00,2025-10-06,09:35:00,129.56666666666666,0
27/10/2025 5:50,11.03,124.03,17,2.2,006 km S 75° E of City Of Bogo (Cebu), City Of Bogo ,Cebu,2025-10-27 05:50:00,2025-10-27,05:50:00,629.8166666666667,2
07/10/2025 0:46,11.1,123.98,39,1.8,006 km N 02° E of City Of Bogo (Cebu), City Of Bogo ,Cebu,2025-10-07 00:46:00,2025-10-07,00:46:00,144.75,3
04/10/2025 14:01,11.15,124.0,33,1.7,012 km N 11° E of City Of Bogo (Cebu), City Of Bogo ,Cebu,2025-10-04 14:01:00,2025-10-04,14:01:00,86.0,3
02/10/2025 10:40,11.14,124.03,21,2.2,012 km N 25° E of City Of Bogo (Cebu), City Of Bogo ,Cebu,2025-10-02 10:40:00,2025-10-02,10:40:00,34.65,3
27/10/2025 6:24,10.98,124.06,34,1.5,011 km S 49° E of City Of Bogo (Cebu), City Of Bogo ,Cebu,2025-10-27 06:24:00,2025-10-27,06:24:00,630.3833333333333,2
29/10/2025 21:30,11.16,124.13,8,1.9,021 km N 53° E of City Of Bogo (Cebu), City Of Bogo ,Cebu,2025-10-29 21:30:00,2025-10-29,21:30:00,693.4833333333333,2
16/10/2025 19:42,11.1,123.95,9,1.6,006 km N 29° W of City Of Bogo (Cebu), City Of Bogo ,Cebu,2025-10-16 19:42:00,2025-10-16,19:42:00,379.68333333333334,2
04/10/2025 17:41,10.9,123.88,5,4.6,019 km S 34° W of City Of Bogo (Cebu), City Of Bogo ,Cebu,2025-10-04 17:41:00,2025-10-04,17:41:00,89.66666666666667,0
24/10/2025 0:32,10.96,123.96,22,2.3,010 km S 12° W of City Of Bogo (Cebu), City Of Bogo ,Cebu,2025-10-24 00:32:00,2025-10-24,00:32:00,552.5166666666667,2
01/10/2025 12:16,11.06,124.05,36,1.3,008 km N 80° E of City Of Bogo (Cebu), City Of Bogo ,Cebu,2025-10-01 12:16:00,2025-10-01,12:16:00,12.25,3
02/10/2025 13:50,10.92,123.88,4,3.3,018 km S 38° W of City Of Bogo (Cebu), City Of Bogo ,Cebu,2025-10-02 13:50:00,2025-10-02,13:50:00,37.81666666666667,0
04/10/2025 10:38,11.17,123.86,6,1.9,019 km N 43° W of City Of Bogo (Cebu), City Of Bogo ,Cebu,2025-10-04 10:38:00,2025-10-04,10:38:00,82.61666666666666,0
24/10/2025 22:23,11.03,123.98,33,1.8,002 km S 19° E of City Of Bogo (Cebu), City Of Bogo ,Cebu,2025-10-24 22:23:00,2025-10-24,22:23:00,574.3666666666667,2
22/10/2025 19:00,10.83,123.97,11,1.9,024 km S 04° W of City Of Bogo (Cebu), City Of Bogo ,Cebu,2025-10-22 19:00:00,2025-10-22,19:00:00,522.9833333333333,2
08/10/2025 0:09,11.08,124.08,8,3.4,011 km N 73° E of City Of Bogo (Cebu), City Of Bogo ,Cebu,2025-10-08 00:09:00,2025-10-08,00:09:00,168.13333333333333,1
29/10/2025 5:57,11.03,124.06,4,2.4,009 km S 79° E of City Of Bogo (Cebu), City Of Bogo ,Cebu,2025-10-29 05:57:00,2025-10-29,05:57:00,677.9333333333333,2
01/10/2025 5:09,10.85,123.99,36,1.8,022 km S 02° E of City Of Bogo (Cebu), City Of Bogo ,Cebu,2025-10-01 05:09:00,2025-10-01,05:09:00,5.133333333333334,3
05/10/2025 15:09,11.18,123.94,12,2.4,015 km N 17° W of City Of Bogo (Cebu), City Of Bogo ,Cebu,2025-10-05 15:09:00,2025-10-05,15:09:00,111.13333333333334,1
04/10/2025 4:11,11.1,124.2,25,2.1,024 km N 76° E of City Of Bogo (Cebu), City Of Bogo ,Cebu,2025-10-04 04:11:00,2025-10-04,04:11:00,76.16666666666667,3
03/10/2025 6:04,11.1,123.94,5,2.3,007 km N 41° W of City Of Bogo (Cebu), City Of Bogo ,Cebu,2025-10-03 06:04:00,2025-10-03,06:04:00,54.05,0
19/10/2025 7:54,11.1,124.05,5,2.9,009 km N 50° E of City Of Bogo (Cebu), City Of Bogo ,Cebu,2025-10-19 07:54:00,2025-10-19,07:54:00,439.8833333333333,2
08/10/2025 22:42,10.91,124.05,4,1.8,020 km S 18° E of City Of Bogo (Cebu), City Of Bogo ,Cebu,2025-10-08 22:42:00,2025-10-08,22:42:00,190.68333333333334,0
01/10/2025 18:42,11.14,124.21,5,2.1,027 km N 69° E of City Of Bogo (Cebu), City Of Bogo ,Cebu,2025-10-01 18:42:00,2025-10-01,18:42:00,18.683333333333334,1
13/10/2025 0:44,11.01,124.0,5,1.9,004 km S 35° E of City Of Bogo (Cebu), City Of Bogo ,Cebu,2025-10-13 00:44:00,2025-10-13,00:44:00,288.71666666666664,0
04/10/2025 5:46,10.92,123.89,5,2.1,018 km S 34° W of City Of Bogo (Cebu), City Of Bogo ,Cebu,2025-10-04 05:46:00,2025-10-04,05:46:00,77.75,0
25/10/2025 21:45,11.06,123.85,17,2.6,015 km N 86° W of City Of Bogo (Cebu), City Of Bogo ,Cebu,2025-10-25 21:45:00,2025-10-25,21:45:00,597.7333333333333,2
07/10/2025 19:50,11.16,123.97,29,1.7,012 km N 03° W of City Of Bogo (Cebu), City Of Bogo ,Cebu,2025-10-07 19:50:00,2025-10-07,19:50:00,163.81666666666666,3
14/10/2025 8:36,11.07,124.06,40,2.3,009 km N 74° E of City Of Bogo (Cebu), City Of Bogo ,Cebu,2025-10-14 08:36:00,2025-10-14,08:36:00,320.5833333333333,3
02/10/2025 8:06,11.12,124.17,4,3.4,023 km N 69° E of City Of Bogo (Cebu), City Of Bogo ,Cebu,2025-10-02 08:06:00,2025-10-02,08:06:00,32.083333333333336,1
19/10/2025 23:50,11.19,124.05,31,2.0,018 km N 27° E of City Of Bogo (Cebu), City Of Bogo ,Cebu,2025-10-19 23:50:00,2025-10-19,23:50:00,455.81666666666666,3
02/10/2025 5:42,10.83,123.87,10,3.7,026 km S 26° W of City Of Bogo (Cebu), City Of Bogo ,Cebu,2025-10-02 05:42:00,2025-10-02,05:42:00,29.683333333333334,0
01/10/2025 4:44,10.9,123.96,4,3.7,016 km S 09° W of City Of Bogo (Cebu), City Of Bogo ,Cebu,2025-10-01 04:44:00,2025-10-01,04:44:00,4.716666666666667,0
24/10/2025 9:00,10.98,123.78,5,3.1,023 km S 71° W of City Of Bogo (Cebu), City Of Bogo ,Cebu,2025-10-24 09:00:00,2025-10-24,09:00:00,560.9833333333333,0
01/10/2025 16:59,11.14,124.12,6,2.3,018 km N 56° E of City Of Bogo (Cebu), City Of Bogo ,Cebu,2025-10-01 16:59:00,2025-10-01,16:59:00,16.966666666666665,1
02/10/2025 0:50,11.02,123.98,4,1.6,003 km S 07° E of City Of Bogo (Cebu), City Of Bogo ,Cebu,2025-10-02 00:50:00,2025-10-02,00:50:00,24.816666666666666,0
01/10/2025 15:42,11.12,123.98,27,1.6,008 km N 02° W of City Of Bogo (Cebu), City Of Bogo ,Cebu,2025-10-01 15:42:00,2025-10-01,15:42:00,15.683333333333334,3
04/10/2025 10:12,11.21,123.91,5,2.9,019 km N 25° W of City Of Bogo (Cebu), City Of Bogo ,Cebu,2025-10-04 10:12:00,2025-10-04,10:12:00,82.18333333333334,1
25/10/2025 21:18,11.22,124.14,2,2.3,026 km N 43° E of City Of Bogo (Cebu), City Of Bogo ,Cebu,2025-10-25 21:18:00,2025-10-25,21:18:00,597.2833333333333,2
09/10/2025 4:14,11.34,123.96,4,2.2,033 km N 05° W of City Of Bogo (Cebu), City Of Bogo ,Cebu,2025-10-09 04:14:00,2025-10-09,04:14:00,196.21666666666667,1
07/10/2025 0:38,10.99,124.01,38,1.9,007 km S 24° E of City Of Bogo (Cebu), City Of Bogo ,Cebu,2025-10-07 00:38:00,2025-10-07,00:38:00,144.61666666666667,3
01/10/2025 0:48,11.14,123.89,6,2.9,014 km N 43° W of City Of Bogo (Cebu), City Of Bogo ,Cebu,2025-10-01 00:48:00,2025-10-01,00:48:00,0.7833333333333333,0
24/10/2025 7:24,10.94,123.95,4,3.0,012 km S 15° W of City Of Bogo (Cebu), City Of Bogo ,Cebu,2025-10-24 07:24:00,2025-10-24,07:24:00,559.3833333333333,2
01/10/2025 0:04,11.05,123.97,8,3.6,001 km N 49° W of City Of Bogo (Cebu), City Of Bogo ,Cebu,2025-10-01 00:04:00,2025-10-01,00:04:00,0.05,0
07/10/2025 17:55,11.01,124.06,32,2.3,010 km S 65° E of City Of Bogo (Cebu), City Of Bogo ,Cebu,2025-10-07 17:55:00,2025-10-07,17:55:00,161.9,3
02/10/2025 11:50,10.92,123.95,4,3.4,015 km S 16° W of City Of Bogo (Cebu), City Of Bogo ,Cebu,2025-10-02 11:50:00,2025-10-02,11:50:00,35.81666666666667,0
04/10/2025 15:07,10.98,123.75,5,2.4,026 km S 74° W of City Of Bogo (Cebu), City Of Bogo ,Cebu,2025-10-04 15:07:00,2025-10-04,15:07:00,87.1,0
02/10/2025 16:15,10.91,123.87,7,3.0,019 km S 40° W of City Of Bogo (Cebu), City Of Bogo ,Cebu,2025-10-02 16:15:00,2025-10-02,16:15:00,40.233333333333334,0
26/10/2025 23:03,11.16,123.95,1,2.6,017 km N 09° W of City Of Bogo (Cebu), City Of Bogo ,Cebu,2025-10-26 23:03:00,2025-10-26,23:03:00,623.0333333333333,2
01/10/2025 6:07,11.01,123.84,26,1.9,016 km S 74° W of City Of Bogo (Cebu), City Of Bogo ,Cebu,2025-10-01 06:07:00,2025-10-01,06:07:00,6.1,0
03/10/2025 8:22,11.24,124.02,32,2.0,022 km N 12° E of City Of Bogo (Cebu), City Of Bogo ,Cebu,2025-10-03 08:22:00,2025-10-03,08:22:00,56.35,3
04/10/2025 15:47,11.11,124.26,21,2.3,032 km N 78° E of City Of Bogo (Cebu), City Of Bogo ,Cebu,2025-10-04 15:47:00,2025-10-04,15:47:00,87.76666666666667,1
06/10/2025 6:34,11.11,124.14,21,2.3,019 km N 68° E of City Of Bogo (Cebu), City Of Bogo ,Cebu,2025-10-06 06:34:00,2025-10-06,06:34:00,126.55,1
23/10/2025 0:02,11.1,123.98,28,1.5,006 km N 03° E of City Of Bogo (Cebu), City Of Bogo ,Cebu,2025-10-23 00:02:00,2025-10-23,00:02:00,528.0166666666667,2
12/10/2025 15:35,11.17,124.18,34,2.1,026 km N 58° E of City Of Bogo (Cebu), City Of Bogo ,Cebu,2025-10-12 15:35:00,2025-10-12,15:35:00,279.56666666666666,3
11/10/2025 1:50,11.22,123.94,9,2.2,019 km N 13° W of City Of Bogo (Cebu), City Of Bogo ,Cebu,2025-10-11 01:50:00,2025-10-11,01:50:00,241.81666666666666,1
02/10/2025 1:28,10.89,123.93,4,2.4,018 km S 19° W of City Of Bogo (Cebu), City Of Bogo ,Cebu,2025-10-02 01:28:00,2025-10-02,01:28:00,25.45,0
06/10/2025 2:50,10.95,123.93,4,2.7,012 km S 28° W of City Of Bogo (Cebu), City Of Bogo ,Cebu,2025-10-06 02:50:00,2025-10-06,02:50:00,122.81666666666666,0
14/10/2025 12:10,11.06,123.98,31,1.7,002 km N 12° W of City Of Bogo (Cebu), City Of Bogo ,Cebu,2025-10-14 12:10:00,2025-10-14,12:10:00,324.15,3
07/10/2025 2:07,11.16,123.94,12,1.7,013 km N 21° W of City Of Bogo (Cebu), City Of Bogo ,Cebu,2025-10-07 02:07:00,2025-10-07,02:07:00,146.1,1
07/10/2025 3:48,11.16,123.97,8,1.9,013 km N 03° W of City Of Bogo (Cebu), City Of Bogo ,Cebu,2025-10-07 03:48:00,2025-10-07,03:48:00,147.78333333333333,1
02/10/2025 1:01,10.81,123.89,1,2.3,028 km S 20° W of City Of Bogo (Cebu), City Of Bogo ,Cebu,2025-10-02 01:01:00,2025-10-02,01:01:00,25.0,0
19/10/2025 19:42,10.95,123.94,20,2.3,012 km S 21° W of City Of Bogo (Cebu), City Of Bogo ,Cebu,2025-10-19 19:42:00,2025-10-19,19:42:00,451.68333333333334,2
02/10/2025 2:07,11.03,123.96,3,2.1,003 km S 45° W of City Of Bogo (Cebu), City Of Bogo ,Cebu,2025-10-02 02:07:00,2025-10-02,02:07:00,26.1,0
03/10/2025 22:09,11.1,124.21,5,2.8,026 km N 78° E of City Of Bogo (Cebu), City Of Bogo ,Cebu,2025-10-03 22:09:00,2025-10-03,22:09:00,70.13333333333334,1
01/10/2025 13:41,11.16,124.11,16,2.3,019 km N 49° E of City Of Bogo (Cebu), City Of Bogo ,Cebu,2025-10-01 13:41:00,2025-10-01,13:41:00,13.666666666666666,1
03/10/2025 18:33,11.09,124.05,4,2.8,009 km N 57° E of City Of Bogo (Cebu), City Of Bogo ,Cebu,2025-10-03 18:33:00,2025-10-03,18:33:00,66.53333333333333,1
30/10/2025 7:05,11.06,124.05,2,2.1,008 km N 76° E of City Of Bogo (Cebu), City Of Bogo ,Cebu,2025-10-30 07:05:00,2025-10-30,07:05:00,703.0666666666667,2
05/10/2025 1:57,10.94,123.97,10,2.7,012 km S 07° W of City Of Bogo (Cebu), City Of Bogo ,Cebu,2025-10-05 01:57:00,2025-10-05,01:57:00,97.93333333333334,0
01/10/2025 4:03,11.17,124.15,9,2.2,023 km N 54° E of City Of Bogo (Cebu), City Of Bogo ,Cebu,2025-10-01 04:03:00,2025-10-01,04:03:00,4.033333333333333,1
03/10/2025 3:57,11.11,124.07,24,1.4,012 km N 57° E of City Of Bogo (Cebu), City Of Bogo ,Cebu,2025-10-03 03:57:00,2025-10-03,03:57:00,51.93333333333333,3
15/10/2025 20:39,11.05,124.09,40,1.9,012 km N 86° E of City Of Bogo (Cebu), City Of Bogo ,Cebu,2025-10-15 20:39:00,2025-10-15,20:39:00,356.6333333333333,3
01/10/2025 3:37,10.98,124.25,28,2.0,030 km S 75° E of City Of Bogo (Cebu), City Of Bogo ,Cebu,2025-10-01 03:37:00,2025-10-01,03:37:00,3.6,3
23/10/2025 6:58,10.94,123.89,2,2.3,016 km S 40° W of City Of Bogo (Cebu), City Of Bogo ,Cebu,2025-10-23 06:58:00,2025-10-23,06:58:00,534.95,2
13/10/2025 4:20,11.01,123.9,32,2.2,009 km S 62° W of City Of Bogo (Cebu), City Of Bogo ,Cebu,2025-10-13 04:20:00,2025-10-13,04:20:00,292.31666666666666,3
12/10/2025 10:04,11.07,124.08,7,2.1,012 km N 77° E of City Of Bogo (Cebu), City Of Bogo ,Cebu,2025-10-12 10:04:00,2025-10-12,10:04:00,274.05,1
08/10/2025 2:29,11.04,124.01,32,2.0,003 km S 82° E of City Of Bogo (Cebu), City Of Bogo ,Cebu,2025-10-08 02:29:00,2025-10-08,02:29:00,170.46666666666667,3
07/10/2025 9:54,11.18,124.06,31,1.3,017 km N 30° E of City Of Bogo (Cebu), City Of Bogo ,Cebu,2025-10-07 09:54:00,2025-10-07,09:54:00,153.88333333333333,3
19/10/2025 5:55,11.16,124.0,24,2.3,013 km N 11° E of City Of Bogo (Cebu), City Of Bogo ,Cebu,2025-10-19 05:55:00,2025-10-19,05:55:00,437.9,2
01/10/2025 1:08,11.09,124.16,2,2.3,021 km N 75° E of City Of Bogo (Cebu), City Of Bogo ,Cebu,2025-10-01 01:08:00,2025-10-01,01:08:00,1.1166666666666667,1
11/10/2025 4:17,11.13,124.03,24,1.8,010 km N 29° E of City Of Bogo (Cebu), City Of Bogo ,Cebu,2025-10-11 04:17:00,2025-10-11,04:17:00,244.26666666666668,3
04/10/2025 2:19,11.12,124.11,8,2.4,017 km N 61° E of City Of Bogo (Cebu), City Of Bogo ,Cebu,2025-10-04 02:19:00,2025-10-04,02:19:00,74.3,1
29/10/2025 21:49,11.01,124.0,6,1.8,004 km S 26° E of City Of Bogo (Cebu), City Of Bogo ,Cebu,2025-10-29 21:49:00,2025-10-29,21:49:00,693.8,2
14/10/2025 4:11,11.03,124.04,9,2.1,007 km S 79° E of City Of Bogo (Cebu), City Of Bogo ,Cebu,2025-10-14 04:11:00,2025-10-14,04:11:00,316.1666666666667,2
08/10/2025 8:46,11.17,124.08,6,2.6,018 km N 39° E of City Of Bogo (Cebu), City Of Bogo ,Cebu,2025-10-08 08:46:00,2025-10-08,08:46:00,176.75,1
25/10/2025 19:47,11.1,123.96,29,1.7,006 km N 18° W of City Of Bogo (Cebu), City Of Bogo ,Cebu,2025-10-25 19:47:00,2025-10-25,19:47:00,595.7666666666667,2
25/10/2025 19:52,11.07,123.95,8,2.1,004 km N 58° W of City Of Bogo (Cebu), City Of Bogo ,Cebu,2025-10-25 19:52:00,2025-10-25,19:52:00,595.85,2
29/10/2025 16:15,11.05,124.08,3,2.0,011 km N 87° E of City Of Bogo (Cebu), City Of Bogo ,Cebu,2025-10-29 16:15:00,2025-10-29,16:15:00,688.2333333333333,2
04/10/2025 18:52,10.9,123.88,4,4.0,019 km S 34° W of City Of Bogo (Cebu), City Of Bogo ,Cebu,2025-10-04 18:52:00,2025-10-04,18:52:00,90.85,0
16/10/2025 12:26,11.1,124.07,42,1.9,012 km N 61° E of City Of Bogo (Cebu), City Of Bogo ,Cebu,2025-10-16 12:26:00,2025-10-16,12:26:00,372.4166666666667,3
05/10/2025 1:24,11.14,124.15,10,1.6,021 km N 61° E of City Of Bogo (Cebu), City Of Bogo ,Cebu,2025-10-05 01:24:00,2025-10-05,01:24:00,97.38333333333334,1
24/10/2025 23:18,11.0,123.99,11,2.1,005 km S 12° E of City Of Bogo (Cebu), City Of Bogo ,Cebu,2025-10-24 23:18:00,2025-10-24,23:18:00,575.2833333333333,2
17/10/2025 12:59,11.16,123.97,33,1.5,013 km N 03° W of City Of Bogo (Cebu), City Of Bogo ,Cebu,2025-10-17 12:59:00,2025-10-17,12:59:00,396.96666666666664,3
05/10/2025 6:56,11.15,124.13,8,1.9,020 km N 57° E of City Of Bogo (Cebu), City Of Bogo ,Cebu,2025-10-05 06:56:00,2025-10-05,06:56:00,102.91666666666667,1
07/10/2025 15:49,11.21,124.15,5,2.4,026 km N 46° E of City Of Bogo (Cebu), City Of Bogo ,Cebu,2025-10-07 15:49:00,2025-10-07,15:49:00,159.8,1
05/10/2025 5:30,11.15,123.93,7,2.6,013 km N 25° W of City Of Bogo (Cebu), City Of Bogo ,Cebu,2025-10-05 05:30:00,2025-10-05,05:30:00,101.48333333333333,1
16/10/2025 17:09,10.89,123.87,7,2.4,021 km S 35° W of City Of Bogo (Cebu), City Of Bogo ,Cebu,2025-10-16 17:09:00,2025-10-16,17:09:00,377.1333333333333,0
13/10/2025 21:22,11.14,123.97,30,2.0,010 km N 04° W of City Of Bogo (Cebu), City Of Bogo ,Cebu,2025-10-13 21:22:00,2025-10-13,21:22:00,309.35,3
16/10/2025 1:48,11.18,123.89,6,3.2,018 km N 34° W of City Of Bogo (Cebu), City Of Bogo ,Cebu,2025-10-16 01:48:00,2025-10-16,01:48:00,361.78333333333336,2
06/10/2025 3:15,10.94,123.93,8,2.7,013 km S 26° W of City Of Bogo (Cebu), City Of Bogo ,Cebu,2025-10-06 03:15:00,2025-10-06,03:15:00,123.23333333333333,0
01/10/2025 17:37,11.05,124.01,12,3.0,003 km N 79° E of City Of Bogo (Cebu), City Of Bogo ,Cebu,2025-10-01 17:37:00,2025-10-01,17:37:00,17.6,0
02/10/2025 23:40,10.93,123.93,5,2.0,013 km S 23° W of City Of Bogo (Cebu), City Of Bogo ,Cebu,2025-10-02 23:40:00,2025-10-02,23:40:00,47.65,0
04/10/2025 22:52,10.89,123.88,7,2.0,020 km S 33° W of City Of Bogo (Cebu), City Of Bogo ,Cebu,2025-10-04 22:52:00,2025-10-04,22:52:00,94.85,0
16/10/2025 0:29,11.01,124.07,42,1.9,011 km S 69° E of City Of Bogo (Cebu), City Of Bogo ,Cebu,2025-10-16 00:29:00,2025-10-16,00:29:00,360.46666666666664,3
13/10/2025 3:45,11.16,124.07,30,2.4,015 km N 38° E of City Of Bogo (Cebu), City Of Bogo ,Cebu,2025-10-13 03:45:00,2025-10-13,03:45:00,291.73333333333335,3
11/10/2025 0:19,10.92,123.91,11,2.5,016 km S 29° W of City Of Bogo (Cebu), City Of Bogo ,Cebu,2025-10-11 00:19:00,2025-10-11,00:19:00,240.3,0
16/10/2025 15:01,11.07,124.09,15,1.4,012 km N 77° E of City Of Bogo (Cebu), City Of Bogo ,Cebu,2025-10-16 15:01:00,2025-10-16,15:01:00,375.0,3
01/10/2025 5:01,11.19,123.95,23,2.1,016 km N 13° W of City Of Bogo (Cebu), City Of Bogo ,Cebu,2025-10-01 05:01:00,2025-10-01,05:01:00,5.0,3
04/10/2025 9:23,10.96,124.06,16,1.6,013 km S 41° E of City Of Bogo (Cebu), City Of Bogo ,Cebu,2025-10-04 09:23:00,2025-10-04,09:23:00,81.36666666666666,3
18/10/2025 23:11,11.15,124.13,8,2.8,020 km N 56° E of City Of Bogo (Cebu), City Of Bogo ,Cebu,2025-10-18 23:11:00,2025-10-18,23:11:00,431.1666666666667,1
20/10/2025 5:37,11.15,124.01,32,2.4,012 km N 17° E of City Of Bogo (Cebu), City Of Bogo ,Cebu,2025-10-20 05:37:00,2025-10-20,05:37:00,461.6,3
09/10/2025 22:48,11.05,124.02,29,2.0,004 km N 87° E of City Of Bogo (Cebu), City Of Bogo ,Cebu,2025-10-09 22:48:00,2025-10-09,22:48:00,214.78333333333333,3
03/10/2025 4:17,11.1,123.99,7,2.3,006 km N 14° E of City Of Bogo (Cebu), City Of Bogo ,Cebu,2025-10-03 04:17:00,2025-10-03,04:17:00,52.266666666666666,1
28/10/2025 3:20,10.99,123.97,24,2.3,006 km S 10° W of City Of Bogo (Cebu), City Of Bogo ,Cebu,2025-10-28 03:20:00,2025-10-28,03:20:00,651.3166666666667,2
21/10/2025 17:07,11.16,124.16,6,4.1,024 km N 58° E of City Of Bogo (Cebu), City Of Bogo ,Cebu,2025-10-21 17:07:00,2025-10-21,17:07:00,497.1,2
12/10/2025 5:14,11.12,124.02,33,2.0,010 km N 27° E of City Of Bogo (Cebu), City Of Bogo ,Cebu,2025-10-12 05:14:00,2025-10-12,05:14:00,269.21666666666664,3
01/10/2025 6:27,11.14,124.09,9,1.7,016 km N 49° E of City Of Bogo (Cebu), City Of Bogo ,Cebu,2025-10-01 06:27:00,2025-10-01,06:27:00,6.433333333333334,1
15/10/2025 9:19,11.23,124.0,31,2.5,021 km N 07° E of City Of Bogo (Cebu), City Of Bogo ,Cebu,2025-10-15 09:19:00,2025-10-15,09:19:00,345.3,3
05/10/2025 0:10,11.01,124.1,6,1.7,013 km S 74° E of City Of Bogo (Cebu), City Of Bogo ,Cebu,2025-10-05 00:10:00,2025-10-05,00:10:00,96.15,1
09/10/2025 8:03,11.11,124.03,19,2.4,009 km N 38° E of City Of Bogo (Cebu), City Of Bogo ,Cebu,2025-10-09 08:03:00,2025-10-09,08:03:00,200.03333333333333,1
04/10/2025 3:02,11.01,123.95,3,2.0,006 km S 39° W of City Of Bogo (Cebu), City Of Bogo ,Cebu,2025-10-04 03:02:00,2025-10-04,03:02:00,75.01666666666667,0
03/10/2025 5:52,11.09,124.04,18,1.3,008 km N 49° E of City Of Bogo (Cebu), City Of Bogo ,Cebu,2025-10-03 05:52:00,2025-10-03,05:52:00,53.85,3
03/10/2025 14:09,11.1,124.11,6,2.0,015 km N 69° E of City Of Bogo (Cebu), City Of Bogo ,Cebu,2025-10-03 14:09:00,2025-10-03,14:09:00,62.13333333333333,1
08/10/2025 8:06,11.15,123.98,31,1.3,011 km North of City Of Bogo (Cebu), City Of Bogo ,Cebu,2025-10-08 08:06:00,2025-10-08,08:06:00,176.08333333333334,3
13/10/2025 23:45,10.87,123.92,3,2.0,020 km S 19° W of City Of Bogo (Cebu), City Of Bogo ,Cebu,2025-10-13 23:45:00,2025-10-13,23:45:00,311.73333333333335,0
03/10/2025 17:07,11.06,124.03,8,2.7,005 km N 72° E of City Of Bogo (Cebu), City Of Bogo ,Cebu,2025-10-03 17:07:00,2025-10-03,17:07:00,65.1,1
02/10/2025 23:22,11.15,123.99,17,1.3,011 km N 03° E of City Of Bogo (Cebu), City Of Bogo ,Cebu,2025-10-02 23:22:00,2025-10-02,23:22:00,47.35,3
27/10/2025 2:14,10.77,123.84,1,1.7,034 km S 27° W of City Of Bogo (Cebu), City Of Bogo ,Cebu,2025-10-27 02:14:00,2025-10-27,02:14:00,626.2166666666667,0
11/10/2025 2:36,11.06,124.06,31,2.2,009 km N 79° E of City Of Bogo (Cebu), City Of Bogo ,Cebu,2025-10-11 02:36:00,2025-10-11,02:36:00,242.58333333333334,3
08/10/2025 0:45,11.15,124.02,30,2.4,013 km N 19° E of City Of Bogo (Cebu), City Of Bogo ,Cebu,2025-10-08 00:45:00,2025-10-08,00:45:00,168.73333333333332,3
01/10/2025 0:35,11.06,123.97,5,1.7,002 km N 36° W of City Of Bogo (Cebu), City Of Bogo ,Cebu,2025-10-01 00:35:00,2025-10-01,00:35:00,0.5666666666666667,1
03/10/2025 19:04,11.15,124.14,26,2.5,020 km N 58° E of City Of Bogo (Cebu), City Of Bogo ,Cebu,2025-10-03 19:04:00,2025-10-03,19:04:00,67.05,1
23/10/2025 13:01,10.98,123.95,6,2.6,008 km S 19° W of City Of Bogo (Cebu), City Of Bogo ,Cebu,2025-10-23 13:01:00,2025-10-23,13:01:00,541.0,2
01/10/2025 14:56,10.93,123.94,4,3.2,013 km S 19° W of City Of Bogo (Cebu), City Of Bogo ,Cebu,2025-10-01 14:56:00,2025-10-01,14:56:00,14.916666666666666,0
27/10/2025 10:05,11.02,124.08,1,2.4,012 km S 73° E of City Of Bogo (Cebu), City Of Bogo ,Cebu,2025-10-27 10:05:00,2025-10-27,10:05:00,634.0666666666667,2
17/10/2025 4:14,10.89,123.99,1,2.6,018 km S 05° E of City Of Bogo (Cebu), City Of Bogo ,Cebu,2025-10-17 04:14:00,2025-10-17,04:14:00,388.21666666666664,0
08/10/2025 18:09,11.19,124.08,2,2.1,020 km N 36° E of City Of Bogo (Cebu), City Of Bogo ,Cebu,2025-10-08 18:09:00,2025-10-08,18:09:00,186.13333333333333,1
02/10/2025 4:33,10.89,123.94,2,3.5,018 km S 15° W of City Of Bogo (Cebu), City Of Bogo ,Cebu,2025-10-02 04:33:00,2025-10-02,04:33:00,28.533333333333335,0
07/10/2025 20:37,11.08,124.13,5,2.2,017 km N 78° E of City Of Bogo (Cebu), City Of Bogo ,Cebu,2025-10-07 20:37:00,2025-10-07,20:37:00,164.6,1
23/10/2025 9:21,11.02,124.05,32,2.6,008 km S 68° E of City Of Bogo (Cebu), City Of Bogo ,Cebu,2025-10-23 09:21:00,2025-10-23,09:21:00,537.3333333333334,2
14/10/2025 2:49,11.02,124.09,4,2.2,012 km S 79° E of City Of Bogo (Cebu), City Of Bogo ,Cebu,2025-10-14 02:49:00,2025-10-14,02:49:00,314.8,1
05/10/2025 17:42,11.15,124.02,27,1.1,012 km N 22° E of City Of Bogo (Cebu), City Of Bogo ,Cebu,2025-10-05 17:42:00,2025-10-05,17:42:00,113.68333333333334,3
05/10/2025 12:38,11.14,124.07,18,1.9,015 km N 43° E of City Of Bogo (Cebu), City Of Bogo ,Cebu,2025-10-05 12:38:00,2025-10-05,12:38:00,108.61666666666666,1
08/10/2025 6:57,11.07,124.17,31,2.0,021 km N 81° E of City Of Bogo (Cebu), City Of Bogo ,Cebu,2025-10-08 06:57:00,2025-10-08,06:57:00,174.93333333333334,3
05/10/2025 9:25,10.88,123.91,6,2.7,020 km S 23° W of City Of Bogo (Cebu), City Of Bogo ,Cebu,2025-10-05 09:25:00,2025-10-05,09:25:00,105.4,0
05/10/2025 8:27,10.86,123.94,5,3.1,021 km S 12° W of City Of Bogo (Cebu), City Of Bogo ,Cebu,2025-10-05 08:27:00,2025-10-05,08:27:00,104.43333333333334,0
05/10/2025 3:52,11.11,124.09,6,2.1,014 km N 59° E of City Of Bogo (Cebu), City Of Bogo ,Cebu,2025-10-05 03:52:00,2025-10-05,03:52:00,99.85,1
05/10/2025 3:59,10.94,123.92,6,2.1,013 km S 31° W of City Of Bogo (Cebu), City Of Bogo ,Cebu,2025-10-05 03:59:00,2025-10-05,03:59:00,99.96666666666667,0
02/10/2025 13:40,10.81,123.94,24,1.8,027 km S 10° W of City Of Bogo (Cebu), City Of Bogo ,Cebu,2025-10-02 13:40:00,2025-10-02,13:40:00,37.65,0
02/10/2025 11:20,11.19,124.2,2,1.3,029 km N 57° E of City Of Bogo (Cebu), City Of Bogo ,Cebu,2025-10-02 11:20:00,2025-10-02,11:20:00,35.31666666666667,1
01/10/2025 5:46,11.19,123.95,22,1.8,016 km N 10° W of City Of Bogo (Cebu), City Of Bogo ,Cebu,2025-10-01 05:46:00,2025-10-01,05:46:00,5.75,3
11/10/2025 7:55,11.22,123.93,8,2.1,020 km N 17° W of City Of Bogo (Cebu), City Of Bogo ,Cebu,2025-10-11 07:55:00,2025-10-11,07:55:00,247.9,1
03/10/2025 0:30,11.15,124.08,11,2.0,016 km N 44° E of City Of Bogo (Cebu), City Of Bogo ,Cebu,2025-10-03 00:30:00,2025-10-03,00:30:00,48.483333333333334,1
05/10/2025 1:25,11.09,124.04,24,1.5,009 km N 51° E of City Of Bogo (Cebu), City Of Bogo ,Cebu,2025-10-05 01:25:00,2025-10-05,01:25:00,97.4,3
13/10/2025 1:50,10.97,123.94,7,3.5,010 km S 28° W of City Of Bogo (Cebu), City Of Bogo ,Cebu,2025-10-13 01:50:00,2025-10-13,01:50:00,289.81666666666666,0
02/10/2025 15:24,10.98,123.97,31,1.6,007 km S 06° W of City Of Bogo (Cebu), City Of Bogo ,Cebu,2025-10-02 15:24:00,2025-10-02,15:24:00,39.38333333333333,3
05/10/2025 10:26,11.16,123.98,21,1.4,012 km N 02° E of City Of Bogo (Cebu), City Of Bogo ,Cebu,2025-10-05 10:26:00,2025-10-05,10:26:00,106.41666666666667,3
02/10/2025 16:56,11.18,124.17,5,3.1,025 km N 56° E of City Of Bogo (Cebu), City Of Bogo ,Cebu,2025-10-02 16:56:00,2025-10-02,16:56:00,40.916666666666664,1
03/10/2025 7:41,11.1,123.92,5,3.1,009 km N 47° W of City Of Bogo (Cebu), City Of Bogo ,Cebu,2025-10-03 07:41:00,2025-10-03,07:41:00,55.666666666666664,0
01/10/2025 0:15,11.19,124.11,3,2.4,022 km N 41° E of City Of Bogo (Cebu), City Of Bogo ,Cebu,2025-10-01 00:15:00,2025-10-01,00:15:00,0.23333333333333334,1
21/10/2025 4:27,11.07,124.04,33,1.9,007 km N 66° E of City Of Bogo (Cebu), City Of Bogo ,Cebu,2025-10-21 04:27:00,2025-10-21,04:27:00,484.43333333333334,3
03/10/2025 11:08,11.1,124.09,8,2.5,014 km N 66° E of City Of Bogo (Cebu), City Of Bogo ,Cebu,2025-10-03 11:08:00,2025-10-03,11:08:00,59.11666666666667,1
26/10/2025 17:04,10.99,123.96,1,2.4,008 km S 20° W of City Of Bogo (Cebu), City Of Bogo ,Cebu,2025-10-26 17:04:00,2025-10-26,17:04:00,617.05,2
04/10/2025 22:35,11.02,124.04,6,2.1,007 km S 68° E of City Of Bogo (Cebu), City Of Bogo ,Cebu,2025-10-04 22:35:00,2025-10-04,22:35:00,94.56666666666666,1
05/10/2025 13:11,11.12,124.14,7,2.4,019 km N 67° E of City Of Bogo (Cebu), City Of Bogo ,Cebu,2025-10-05 13:11:00,2025-10-05,13:11:00,109.16666666666667,1
10/10/2025 18:53,11.08,124.11,25,1.4,014 km N 77° E of City Of Bogo (Cebu), City Of Bogo ,Cebu,2025-10-10 18:53:00,2025-10-10,18:53:00,234.86666666666667,3
06/10/2025 9:35,11.1,123.93,8,2.9,008 km N 45° W of City Of Bogo (Cebu), City Of Bogo ,Cebu,2025-10-06 09:35:00,2025-10-06,09:35:00,129.56666666666666,0
20/10/2025 13:00,11.05,124.15,34,2.0,019 km N 89° E of City Of Bogo (Cebu), City Of Bogo ,Cebu,2025-10-20 13:00:00,2025-10-20,13:00:00,468.98333333333335,3
29/10/2025 17:48,11.12,124.1,34,2.0,015 km N 59° E of City Of Bogo (Cebu), City Of Bogo ,Cebu,2025-10-29 17:48:00,2025-10-29,17:48:00,689.7833333333333,2
17/10/2025 16:04,11.06,124.08,33,1.6,011 km N 80° E of City Of Bogo (Cebu), City Of Bogo ,Cebu,2025-10-17 16:04:00,2025-10-17,16:04:00,400.05,3
23/10/2025 8:48,11.01,123.96,16,2.0,005 km S 32° W of City Of Bogo (Cebu), City Of Bogo ,Cebu,2025-10-23 08:48:00,2025-10-23,08:48:00,536.7833333333333,2
01/10/2025 13:17,11.17,124.07,33,1.3,017 km N 36° E of City Of Bogo (Cebu), City Of Bogo ,Cebu,2025-10-01 13:17:00,2025-10-01,13:17:00,13.266666666666667,3
01/10/2025 20:53,10.95,123.97,5,2.1,011 km S 06° W of City Of Bogo (Cebu), City Of Bogo ,Cebu,2025-10-01 20:53:00,2025-10-01,20:53:00,20.866666666666667,0
08/10/2025 8:27,11.18,124.12,5,2.6,022 km N 46° E of City Of Bogo (Cebu), City Of Bogo ,Cebu,2025-10-08 08:27:00,2025-10-08,08:27:00,176.43333333333334,1
02/10/2025 23:31,10.9,123.94,5,2.9,018 km S 15° W of City Of Bogo (Cebu), City Of Bogo ,Cebu,2025-10-02 23:31:00,2025-10-02,23:31:00,47.5,0
18/10/2025 15:19,11.24,124.11,11,2.4,025 km N 34° E of City Of Bogo (Cebu), City Of Bogo ,Cebu,2025-10-18 15:19:00,2025-10-18,15:19:00,423.3,1
16/10/2025 0:20,11.17,124.11,16,2.2,020 km N 46° E of City Of Bogo (Cebu), City Of Bogo ,Cebu,2025-10-16 00:20:00,2025-10-16,00:20:00,360.31666666666666,1
05/10/2025 3:28,11.12,124.04,13,1.8,010 km N 40° E of City Of Bogo (Cebu), City Of Bogo ,Cebu,2025-10-05 03:28:00,2025-10-05,03:28:00,99.45,1
01/10/2025 1:12,11.04,124.04,33,3.5,006 km S 85° E of City Of Bogo (Cebu), City Of Bogo ,Cebu,2025-10-01 01:12:00,2025-10-01,01:12:00,1.1833333333333333,3
04/10/2025 1:06,11.07,124.12,34,2.4,016 km N 79° E of City Of Bogo (Cebu), City Of Bogo ,Cebu,2025-10-04 01:06:00,2025-10-04,01:06:00,73.08333333333333,3
19/10/2025 23:52,11.27,124.03,8,2.1,025 km N 14° E of City Of Bogo (Cebu), City Of Bogo ,Cebu,2025-10-19 23:52:00,2025-10-19,23:52:00,455.85,2
01/10/2025 20:06,10.97,124.05,1,1.4,012 km S 43° E of City Of Bogo (Cebu), City Of Bogo ,Cebu,2025-10-01 20:06:00,2025-10-01,20:06:00,20.083333333333332,1
03/10/2025 1:36,11.12,123.99,5,2.2,008 km N 11° E of City Of Bogo (Cebu), City Of Bogo ,Cebu,2025-10-03 01:36:00,2025-10-03,01:36:00,49.583333333333336,1
16/10/2025 11:28,11.1,124.05,12,2.5,010 km N 53° E of City Of Bogo (Cebu), City Of Bogo ,Cebu,2025-10-16 11:28:00,2025-10-16,11:28:00,371.45,2
01/10/2025 17:03,10.96,123.97,2,2.5,010 km S 07° W of City Of Bogo (Cebu), City Of Bogo ,Cebu,2025-10-01 17:03:00,2025-10-01,17:03:00,17.033333333333335,0
02/10/2025 18:23,11.09,124.05,20,1.2,009 km N 55° E of City Of Bogo (Cebu), City Of Bogo ,Cebu,2025-10-02 18:23:00,2025-10-02,18:23:00,42.36666666666667,3
11/10/2025 1:08,11.09,124.04,17,1.6,008 km N 51° E of City Of Bogo (Cebu), City Of Bogo ,Cebu,2025-10-11 01:08:00,2025-10-11,01:08:00,241.11666666666667,3
07/10/2025 10:08,10.93,123.96,7,2.7,013 km S 12° W of City Of Bogo (Cebu), City Of Bogo ,Cebu,2025-10-07 10:08:00,2025-10-07,10:08:00,154.11666666666667,0
14/10/2025 19:15,10.96,123.94,7,2.5,010 km S 23° W of City Of Bogo (Cebu), City Of Bogo ,Cebu,2025-10-14 19:15:00,2025-10-14,19:15:00,331.23333333333335,0
02/10/2025 6:05,10.87,123.9,2,2.8,022 km S 25° W of City Of Bogo (Cebu), City Of Bogo ,Cebu,2025-10-02 06:05:00,2025-10-02,06:05:00,30.066666666666666,0
30/10/2025 20:13,11.15,124.13,5,2.5,020 km N 56° E of City Of Bogo (Cebu), City Of Bogo ,Cebu,2025-10-30 20:13:00,2025-10-30,20:13:00,716.2,2
05/10/2025 4:07,11.05,124.13,26,1.4,017 km N 87° E of City Of Bogo (Cebu), City Of Bogo ,Cebu,2025-10-05 04:07:00,2025-10-05,04:07:00,100.1,3
02/10/2025 22:24,11.15,123.98,21,1.5,012 km N 03° E of City Of Bogo (Cebu), City Of Bogo ,Cebu,2025-10-02 22:24:00,2025-10-02,22:24:00,46.38333333333333,3
15/10/2025 15:58,11.15,124.13,2,4.0,020 km N 55° E of City Of Bogo (Cebu), City Of Bogo ,Cebu,2025-10-15 15:58:00,2025-10-15,15:58:00,351.95,1
04/10/2025 22:54,10.89,123.89,3,3.2,020 km S 29° W of City Of Bogo (Cebu), City Of Bogo ,Cebu,2025-10-04 22:54:00,2025-10-04,22:54:00,94.88333333333334,0
04/10/2025 11:58,11.09,124.07,26,1.7,011 km N 65° E of City Of Bogo (Cebu), City Of Bogo ,Cebu,2025-10-04 11:58:00,2025-10-04,11:58:00,83.95,3
01/10/2025 10:36,11.01,124.09,20,1.4,012 km S 72° E of City Of Bogo (Cebu), City Of Bogo ,Cebu,2025-10-01 10:36:00,2025-10-01,10:36:00,10.583333333333334,3
17/10/2025 2:20,11.16,123.98,23,2.7,013 km N 02° E of City Of Bogo (Cebu), City Of Bogo ,Cebu,2025-10-17 02:20:00,2025-10-17,02:20:00,386.31666666666666,2
13/10/2025 11:45,10.96,123.9,3,2.6,014 km S 42° W of City Of Bogo (Cebu), City Of Bogo ,Cebu,2025-10-13 11:45:00,2025-10-13,11:45:00,299.73333333333335,0
09/10/2025 19:11,10.85,123.94,5,2.1,023 km S 10° W of City Of Bogo (Cebu), City Of Bogo ,Cebu,2025-10-09 19:11:00,2025-10-09,19:11:00,211.16666666666666,0
03/10/2025 14:07,10.9,123.8,7,2.1,025 km S 49° W of City Of Bogo (Cebu), City Of Bogo ,Cebu,2025-10-03 14:07:00,2025-10-03,14:07:00,62.1,0
02/10/2025 4:53,11.02,123.98,22,1.7,003 km S 02° E of City Of Bogo (Cebu), City Of Bogo ,Cebu,2025-10-02 04:53:00,2025-10-02,04:53:00,28.866666666666667,3
04/10/2025 21:02,11.27,124.18,9,2.9,033 km N 42° E of City Of Bogo (Cebu), City Of Bogo ,Cebu,2025-10-04 21:02:00,2025-10-04,21:02:00,93.01666666666667,1
16/10/2025 22:49,11.0,123.98,27,1.7,005 km S 02° E of City Of Bogo (Cebu), City Of Bogo ,Cebu,2025-10-16 22:49:00,2025-10-16,22:49:00,382.8,3
12/10/2025 23:13,10.88,123.84,5,2.2,025 km S 40° W of City Of Bogo (Cebu), City Of Bogo ,Cebu,2025-10-12 23:13:00,2025-10-12,23:13:00,287.2,0
06/10/2025 20:07,11.12,124.17,4,2.9,022 km N 67° E of City Of Bogo (Cebu), City Of Bogo ,Cebu,2025-10-06 20:07:00,2025-10-06,20:07:00,140.1,1
13/10/2025 18:15,11.12,124.04,33,2.0,011 km N 39° E of City Of Bogo (Cebu), City Of Bogo ,Cebu,2025-10-13 18:15:00,2025-10-13,18:15:00,306.23333333333335,3
10/10/2025 2:15,11.08,123.96,28,2.4,004 km N 34° W of City Of Bogo (Cebu), City Of Bogo ,Cebu,2025-10-10 02:15:00,2025-10-10,02:15:00,218.23333333333332,3
01/10/2025 3:39,11.19,124.15,12,2.0,024 km N 50° E of City Of Bogo (Cebu), City Of Bogo ,Cebu,2025-10-01 03:39:00,2025-10-01,03:39:00,3.6333333333333333,1
08/10/2025 1:33,11.15,124.03,20,1.9,013 km N 24° E of City Of Bogo (Cebu), City Of Bogo ,Cebu,2025-10-08 01:33:00,2025-10-08,01:33:00,169.53333333333333,3
02/10/2025 3:17,11.0,124.18,23,2.2,022 km S 76° E of City Of Bogo (Cebu), City Of Bogo ,Cebu,2025-10-02 03:17:00,2025-10-02,03:17:00,27.266666666666666,3
03/10/2025 1:47,10.96,123.76,5,3.8,026 km S 68° W of City Of Bogo (Cebu), City Of Bogo ,Cebu,2025-10-03 01:47:00,2025-10-03,01:47:00,49.766666666666666,0
03/10/2025 13:19,11.17,124.17,9,2.0,026 km N 56° E of City Of Bogo (Cebu), City Of Bogo ,Cebu,2025-10-03 13:19:00,2025-10-03,13:19:00,61.3,1
08/10/2025 23:23,11.22,124.08,25,1.2,022 km N 30° E of City Of Bogo (Cebu), City Of Bogo ,Cebu,2025-10-08 23:23:00,2025-10-08,23:23:00,191.36666666666667,3
26/10/2025 0:20,10.92,123.88,6,3.0,018 km S 38° W of City Of Bogo (Cebu), City Of Bogo ,Cebu,2025-10-26 00:20:00,2025-10-26,00:20:00,600.3166666666667,2
02/10/2025 16:36,11.02,124.04,12,2.7,007 km S 67° E of City Of Bogo (Cebu), City Of Bogo ,Cebu,2025-10-02 16:36:00,2025-10-02,16:36:00,40.583333333333336,0
02/10/2025 14:51,11.0,123.93,1,2.6,008 km S 49° W of City Of Bogo (Cebu), City Of Bogo ,Cebu,2025-10-02 14:51:00,2025-10-02,14:51:00,38.833333333333336,0
03/10/2025 22:35,11.14,124.05,24,2.2,013 km N 39° E of City Of Bogo (Cebu), City Of Bogo ,Cebu,2025-10-03 22:35:00,2025-10-03,22:35:00,70.56666666666666,3
04/10/2025 12:11,11.2,124.16,8,2.6,026 km N 49° E of City Of Bogo (Cebu), City Of Bogo ,Cebu,2025-10-04 12:11:00,2025-10-04,12:11:00,84.16666666666667,1
05/10/2025 1:05,11.12,124.01,22,1.5,009 km N 20° E of City Of Bogo (Cebu), City Of Bogo ,Cebu,2025-10-05 01:05:00,2025-10-05,01:05:00,97.06666666666666,3
25/10/2025 22:47,11.1,124.02,33,2.1,007 km N 34° E of City Of Bogo (Cebu), City Of Bogo ,Cebu,2025-10-25 22:47:00,2025-10-25,22:47:00,598.7666666666667,2
03/10/2025 5:28,10.93,123.93,1,1.6,014 km S 24° W of City Of Bogo (Cebu), City Of Bogo ,Cebu,2025-10-03 05:28:00,2025-10-03,05:28:00,53.45,0
19/10/2025 20:30,10.84,123.83,7,3.5,028 km S 35° W of City Of Bogo (Cebu), City Of Bogo ,Cebu,2025-10-19 20:30:00,2025-10-19,20:30:00,452.48333333333335,0
30/10/2025 21:13,11.14,124.07,33,1.3,014 km N 43° E of City Of Bogo (Cebu), City Of Bogo ,Cebu,2025-10-30 21:13:00,2025-10-30,21:13:00,717.2,2
07/10/2025 0:41,11.18,124.03,16,1.9,016 km N 22° E of City Of Bogo (Cebu), City Of Bogo ,Cebu,2025-10-07 00:41:00,2025-10-07,00:41:00,144.66666666666666,1
10/10/2025 5:53,11.01,123.97,33,2.1,005 km S 15° W of City Of Bogo (Cebu), City Of Bogo ,Cebu,2025-10-10 05:53:00,2025-10-10,05:53:00,221.86666666666667,3
17/10/2025 10:06,11.23,124.15,8,2.7,027 km N 43° E of City Of Bogo (Cebu), City Of Bogo ,Cebu,2025-10-17 10:06:00,2025-10-17,10:06:00,394.0833333333333,1
04/10/2025 0:03,11.12,124.07,27,1.8,013 km N 50° E of City Of Bogo (Cebu), City Of Bogo ,Cebu,2025-10-04 00:03:00,2025-10-04,00:03:00,72.03333333333333,3
01/10/2025 23:16,10.95,123.99,1,3.3,011 km S 07° E of City Of Bogo (Cebu), City Of Bogo ,Cebu,2025-10-01 23:16:00,2025-10-01,23:16:00,23.25,0
01/10/2025 4:09,10.8,123.93,25,3.0,028 km S 11° W of City Of Bogo (Cebu), City Of Bogo ,Cebu,2025-10-01 04:09:00,2025-10-01,04:09:00,4.133333333333334,0
07/10/2025 0:44,11.16,124.1,23,2.4,018 km N 45° E of City Of Bogo (Cebu), City Of Bogo ,Cebu,2025-10-07 00:44:00,2025-10-07,00:44:00,144.71666666666667,1
01/10/2025 13:30,11.18,124.15,5,2.7,025 km N 51° E of City Of Bogo (Cebu), City Of Bogo ,Cebu,2025-10-01 13:30:00,2025-10-01,13:30:00,13.483333333333333,1
13/10/2025 22:09,10.98,123.96,28,2.0,008 km S 18° W of City Of Bogo (Cebu), City Of Bogo ,Cebu,2025-10-13 22:09:00,2025-10-13,22:09:00,310.1333333333333,3
18/10/2025 2:09,11.13,124.07,35,1.4,014 km N 46° E of City Of Bogo (Cebu), City Of Bogo ,Cebu,2025-10-18 02:09:00,2025-10-18,02:09:00,410.1333333333333,3
05/10/2025 0:21,11.08,124.07,34,1.8,010 km N 72° E of City Of Bogo (Cebu), City Of Bogo ,Cebu,2025-10-05 00:21:00,2025-10-05,00:21:00,96.33333333333333,3
02/10/2025 22:33,10.93,123.98,8,2.4,013 km S 01° W of City Of Bogo (Cebu), City Of Bogo ,Cebu,2025-10-02 22:33:00,2025-10-02,22:33:00,46.53333333333333,0
11/10/2025 11:52,11.15,124.11,35,1.1,018 km N 52° E of City Of Bogo (Cebu), City Of Bogo ,Cebu,2025-10-11 11:52:00,2025-10-11,11:52:00,251.85,3
02/10/2025 9:34,10.93,123.89,8,2.5,016 km S 38° W of City Of Bogo (Cebu), City Of Bogo ,Cebu,2025-10-02 09:34:00,2025-10-02,09:34:00,33.55,0
05/10/2025 23:27,11.16,123.98,18,1.8,012 km N 01° E of City Of Bogo (Cebu), City Of Bogo ,Cebu,2025-10-05 23:27:00,2025-10-05,23:27:00,119.43333333333334,3
01/10/2025 8:53,10.91,123.98,32,1.8,015 km S 01° E of City Of Bogo (Cebu), City Of Bogo ,Cebu,2025-10-01 08:53:00,2025-10-01,08:53:00,8.866666666666667,3
07/10/2025 2:55,10.97,123.96,3,3.1,009 km S 16° W of City Of Bogo (Cebu), City Of Bogo ,Cebu,2025-10-07 02:55:00,2025-10-07,02:55:00,146.9,0
03/10/2025 0:51,11.1,124.04,19,1.5,008 km N 47° E of City Of Bogo (Cebu), City Of Bogo ,Cebu,2025-10-03 00:51:00,2025-10-03,00:51:00,48.833333333333336,3
09/10/2025 18:10,11.16,124.17,3,2.4,024 km N 60° E of City Of Bogo (Cebu), City Of Bogo ,Cebu,2025-10-09 18:10:00,2025-10-09,18:10:00,210.15,1
13/10/2025 1:31,11.24,123.93,34,3.9,022 km N 13° W of City Of Bogo (Cebu), City Of Bogo ,Cebu,2025-10-13 01:31:00,2025-10-13,01:31:00,289.5,3
01/10/2025 14:24,10.89,123.85,9,2.2,022 km S 38° W of City Of Bogo (Cebu), City Of Bogo ,Cebu,2025-10-01 14:24:00,2025-10-01,14:24:00,14.383333333333333,0
02/10/2025 7:24,10.89,123.97,2,3.6,018 km S 04° W of City Of Bogo (Cebu), City Of Bogo ,Cebu,2025-10-02 07:24:00,2025-10-02,07:24:00,31.383333333333333,0
25/10/2025 22:28,11.02,123.97,3,3.1,004 km S 25° W of City Of Bogo (Cebu), City Of Bogo ,Cebu,2025-10-25 22:28:00,2025-10-25,22:28:00,598.45,2
05/10/2025 14:22,11.08,124.05,25,1.6,009 km N 63° E of City Of Bogo (Cebu), City Of Bogo ,Cebu,2025-10-05 14:22:00,2025-10-05,14:22:00,110.35,3
01/10/2025 16:43,11.1,124.09,5,4.1,013 km N 64° E of City Of Bogo (Cebu), City Of Bogo ,Cebu,2025-10-01 16:43:00,2025-10-01,16:43:00,16.7,1
29/10/2025 14:25,10.92,123.93,3,2.0,015 km S 22° W of City Of Bogo (Cebu), City Of Bogo ,Cebu,2025-10-29 14:25:00,2025-10-29,14:25:00,686.4,2
13/10/2025 2:51,10.99,123.98,19,3.6,006 km S 03° W of City Of Bogo (Cebu), City Of Bogo ,Cebu,2025-10-13 02:51:00,2025-10-13,02:51:00,290.8333333333333,0
10/10/2025 18:52,11.08,124.09,30,1.2,013 km N 74° E of City Of Bogo (Cebu), City Of Bogo ,Cebu,2025-10-10 18:52:00,2025-10-10,18:52:00,234.85,3
16/10/2025 6:16,10.93,124.01,6,2.5,014 km S 14° E of City Of Bogo (Cebu), City Of Bogo ,Cebu,2025-10-16 06:16:00,2025-10-16,06:16:00,366.25,0
07/10/2025 11:45,11.1,123.85,2,2.2,016 km N 68° W of City Of Bogo (Cebu), City Of Bogo ,Cebu,2025-10-07 11:45:00,2025-10-07,11:45:00,155.73333333333332,0
25/10/2025 22:28,11.01,123.97,1,3.1,004 km S 09° W of City Of Bogo (Cebu), City Of Bogo ,Cebu,2025-10-25 22:28:00,2025-10-25,22:28:00,598.45,2
02/10/2025 18:02,11.07,123.97,33,1.5,003 km N 17° W of City Of Bogo (Cebu), City Of Bogo ,Cebu,2025-10-02 18:02:00,2025-10-02,18:02:00,42.016666666666666,3
13/10/2025 3:33,10.96,123.95,2,3.0,011 km S 14° W of City Of Bogo (Cebu), City Of Bogo ,Cebu,2025-10-13 03:33:00,2025-10-13,03:33:00,291.53333333333336,0
10/10/2025 4:24,11.18,124.22,13,2.0,030 km N 60° E of City Of Bogo (Cebu), City Of Bogo ,Cebu,2025-10-10 04:24:00,2025-10-10,04:24:00,220.38333333333333,1
01/10/2025 7:19,10.91,123.87,41,2.1,019 km S 39° W of City Of Bogo (Cebu), City Of Bogo ,Cebu,2025-10-01 07:19:00,2025-10-01,07:19:00,7.3,3
04/10/2025 3:45,11.11,124.08,17,2.1,013 km N 57° E of City Of Bogo (Cebu), City Of Bogo ,Cebu,2025-10-04 03:45:00,2025-10-04,03:45:00,75.73333333333333,1
03/10/2025 18:12,11.15,124.13,13,2.9,020 km N 54° E of City Of Bogo (Cebu), City Of Bogo ,Cebu,2025-10-03 18:12:00,2025-10-03,18:12:00,66.18333333333334,1
16/10/2025 0:39,11.16,123.86,18,2.3,018 km N 47° W of City Of Bogo (Cebu), City Of Bogo ,Cebu,2025-10-16 00:39:00,2025-10-16,00:39:00,360.6333333333333,2
15/10/2025 8:36,11.13,124.01,33,1.6,010 km N 17° E of City Of Bogo (Cebu), City Of Bogo ,Cebu,2025-10-15 08:36:00,2025-10-15,08:36:00,344.5833333333333,3
09/10/2025 4:32,10.92,123.99,22,1.5,014 km S 07° E of City Of Bogo (Cebu), City Of Bogo ,Cebu,2025-10-09 04:32:00,2025-10-09,04:32:00,196.51666666666668,3
06/10/2025 1:48,10.9,123.9,2,2.0,018 km S 27° W of City Of Bogo (Cebu), City Of Bogo ,Cebu,2025-10-06 01:48:00,2025-10-06,01:48:00,121.78333333333333,0
01/10/2025 1:05,11.04,124.22,2,1.5,026 km S 89° E of City Of Bogo (Cebu), City Of Bogo ,Cebu,2025-10-01 01:05:00,2025-10-01,01:05:00,1.0666666666666667,1
28/10/2025 20:48,11.18,124.18,8,2.2,026 km N 56° E of City Of Bogo (Cebu), City Of Bogo ,Cebu,2025-10-28 20:48:00,2025-10-28,20:48:00,668.7833333333333,2
05/10/2025 19:18,11.0,123.92,1,2.0,008 km S 52° W of City Of Bogo (Cebu), City Of Bogo ,Cebu,2025-10-05 19:18:00,2025-10-05,19:18:00,115.28333333333333,0
26/10/2025 11:23,10.9,123.96,7,3.0,017 km S 09° W of City Of Bogo (Cebu), City Of Bogo ,Cebu,2025-10-26 11:23:00,2025-10-26,11:23:00,611.3666666666667,2
04/10/2025 19:29,10.88,123.91,9,3.5,020 km S 22° W of City Of Bogo (Cebu), City Of Bogo ,Cebu,2025-10-04 19:29:00,2025-10-04,19:29:00,91.46666666666667,0
28/10/2025 22:32,11.06,123.9,25,2.5,009 km N 78° W of City Of Bogo (Cebu), City Of Bogo ,Cebu,2025-10-28 22:32:00,2025-10-28,22:32:00,670.5166666666667,2
14/10/2025 23:43,11.05,123.95,17,2.4,003 km N 77° W of City Of Bogo (Cebu), City Of Bogo ,Cebu,2025-10-14 23:43:00,2025-10-14,23:43:00,335.7,2
06/10/2025 6:47,10.88,123.92,1,3.2,019 km S 19° W of City Of Bogo (Cebu), City Of Bogo ,Cebu,2025-10-06 06:47:00,2025-10-06,06:47:00,126.76666666666667,0
13/10/2025 2:01,10.99,123.95,3,2.9,008 km S 20° W of City Of Bogo (Cebu), City Of Bogo ,Cebu,2025-10-13 02:01:00,2025-10-13,02:01:00,290.0,0
06/10/2025 15:46,10.95,123.93,7,3.7,012 km S 27° W of City Of Bogo (Cebu), City Of Bogo ,Cebu,2025-10-06 15:46:00,2025-10-06,15:46:00,135.75,0
09/10/2025 9:42,10.97,123.99,11,2.4,008 km S 05° E of City Of Bogo (Cebu), City Of Bogo ,Cebu,2025-10-09 09:42:00,2025-10-09,09:42:00,201.68333333333334,0
09/10/2025 22:58,11.21,124.15,6,2.5,026 km N 45° E of City Of Bogo (Cebu), City Of Bogo ,Cebu,2025-10-09 22:58:00,2025-10-09,22:58:00,214.95,1
01/10/2025 6:24,10.93,123.97,2,2.3,013 km S 05° W of City Of Bogo (Cebu), City Of Bogo ,Cebu,2025-10-01 06:24:00,2025-10-01,06:24:00,6.383333333333334,0
06/10/2025 6:55,11.23,124.03,4,1.5,021 km N 15° E of City Of Bogo (Cebu), City Of Bogo ,Cebu,2025-10-06 06:55:00,2025-10-06,06:55:00,126.9,1
02/10/2025 11:09,11.14,124.2,6,2.0,026 km N 66° E of City Of Bogo (Cebu), City Of Bogo ,Cebu,2025-10-02 11:09:00,2025-10-02,11:09:00,35.13333333333333,1
13/10/2025 23:48,11.13,124.06,30,2.1,013 km N 44° E of City Of Bogo (Cebu), City Of Bogo ,Cebu,2025-10-13 23:48:00,2025-10-13,23:48:00,311.78333333333336,3
09/10/2025 7:48,11.16,124.04,33,1.5,014 km N 28° E of City Of Bogo (Cebu), City Of Bogo ,Cebu,2025-10-09 07:48:00,2025-10-09,07:48:00,199.78333333333333,3
01/10/2025 10:22,11.1,123.89,1,1.5,012 km N 60° W of City Of Bogo (Cebu), City Of Bogo ,Cebu,2025-10-01 10:22:00,2025-10-01,10:22:00,10.35,0
26/10/2025 11:21,10.99,124.09,1,2.3,014 km S 63° E of City Of Bogo (Cebu), City Of Bogo ,Cebu,2025-10-26 11:21:00,2025-10-26,11:21:00,611.3333333333334,2
05/10/2025 22:09,10.96,124.0,1,2.1,010 km S 12° E of City Of Bogo (Cebu), City Of Bogo ,Cebu,2025-10-05 22:09:00,2025-10-05,22:09:00,118.13333333333334,0
05/10/2025 21:59,10.89,123.92,27,2.8,018 km S 20° W of City Of Bogo (Cebu), City Of Bogo ,Cebu,2025-10-05 21:59:00,2025-10-05,21:59:00,117.96666666666667,0
13/10/2025 21:38,10.88,123.88,13,2.0,021 km S 32° W of City Of Bogo (Cebu), City Of Bogo ,Cebu,2025-10-13 21:38:00,2025-10-13,21:38:00,309.6166666666667,0
03/10/2025 12:30,11.15,123.95,6,1.4,012 km N 13° W of City Of Bogo (Cebu), City Of Bogo ,Cebu,2025-10-03 12:30:00,2025-10-03,12:30:00,60.483333333333334,1
01/10/2025 15:57,11.11,124.11,9,2.6,015 km N 64° E of City Of Bogo (Cebu), City Of Bogo ,Cebu,2025-10-01 15:57:00,2025-10-01,15:57:00,15.933333333333334,1
09/10/2025 23:34,10.95,123.69,5,3.2,033 km S 72° W of City Of Bogo (Cebu), City Of Bogo ,Cebu,2025-10-09 23:34:00,2025-10-09,23:34:00,215.55,0
03/10/2025 23:07,11.14,124.03,5,2.4,012 km N 29° E of City Of Bogo (Cebu), City Of Bogo ,Cebu,2025-10-03 23:07:00,2025-10-03,23:07:00,71.1,1
25/10/2025 21:20,11.04,123.97,24,1.9,001 km S 56° W of City Of Bogo (Cebu), City Of Bogo ,Cebu,2025-10-25 21:20:00,2025-10-25,21:20:00,597.3166666666667,2
05/10/2025 19:43,11.13,124.08,4,3.5,014 km N 48° E of City Of Bogo (Cebu), City Of Bogo ,Cebu,2025-10-05 19:43:00,2025-10-05,19:43:00,115.7,1
11/10/2025 21:33,10.93,124.09,15,1.7,018 km S 45° E of City Of Bogo (Cebu), City Of Bogo ,Cebu,2025-10-11 21:33:00,2025-10-11,21:33:00,261.53333333333336,3
07/10/2025 7:16,10.96,123.97,6,2.4,010 km S 09° W of City Of Bogo (Cebu), City Of Bogo ,Cebu,2025-10-07 07:16:00,2025-10-07,07:16:00,151.25,0
04/10/2025 1:36,11.11,124.14,4,2.7,019 km N 65° E of City Of Bogo (Cebu), City Of Bogo ,Cebu,2025-10-04 01:36:00,2025-10-04,01:36:00,73.58333333333333,1
28/10/2025 9:09,11.18,124.15,12,2.1,024 km N 50° E of City Of Bogo (Cebu), City Of Bogo ,Cebu,2025-10-28 09:09:00,2025-10-28,09:09:00,657.1333333333333,2
01/10/2025 6:28,11.14,124.06,9,2.0,014 km N 42° E of City Of Bogo (Cebu), City Of Bogo ,Cebu,2025-10-01 06:28:00,2025-10-01,06:28:00,6.45,1
04/10/2025 7:12,11.14,124.17,5,3.2,024 km N 74° E of City Of Bogo (Cebu), City Of Bogo ,Cebu,2025-10-04 07:12:00,2025-10-04,07:12:00,79.18333333333334,1
09/10/2025 17:39,11.14,124.12,5,2.6,019 km N 56° E of City Of Bogo (Cebu), City Of Bogo ,Cebu,2025-10-09 17:39:00,2025-10-09,17:39:00,209.63333333333333,1
07/10/2025 2:35,11.15,123.99,33,1.3,012 km N 04° E of City Of Bogo (Cebu), City Of Bogo ,Cebu,2025-10-07 02:35:00,2025-10-07,02:35:00,146.56666666666666,3
02/10/2025 16:50,11.13,124.15,8,1.9,021 km N 64° E of City Of Bogo (Cebu), City Of Bogo ,Cebu,2025-10-02 16:50:00,2025-10-02,16:50:00,40.81666666666667,1
13/10/2025 19:56,10.92,123.94,1,2.0,014 km S 18° W of City Of Bogo (Cebu), City Of Bogo ,Cebu,2025-10-13 19:56:00,2025-10-13,19:56:00,307.9166666666667,0
02/10/2025 1:01,10.91,123.9,1,2.4,017 km S 30° W of City Of Bogo (Cebu), City Of Bogo ,Cebu,2025-10-02 01:01:00,2025-10-02,01:01:00,25.0,0
25/10/2025 7:48,11.04,123.98,33,2.1,001 km S 24° E of City Of Bogo (Cebu), City Of Bogo ,Cebu,2025-10-25 07:48:00,2025-10-25,07:48:00,583.7833333333333,2
05/10/2025 8:53,10.98,124.04,32,1.8,010 km S 39° E of City Of Bogo (Cebu), City Of Bogo ,Cebu,2025-10-05 08:53:00,2025-10-05,08:53:00,104.86666666666666,3
12/10/2025 22:48,11.09,124.05,33,1.7,009 km N 61° E of City Of Bogo (Cebu), City Of Bogo ,Cebu,2025-10-12 22:48:00,2025-10-12,22:48:00,286.78333333333336,3
02/10/2025 0:34,11.01,124.01,3,3.7,006 km S 38° E of City Of Bogo (Cebu), City Of Bogo ,Cebu,2025-10-02 00:34:00,2025-10-02,00:34:00,24.55,0
06/10/2025 9:25,11.08,124.09,33,1.5,013 km N 72° E of City Of Bogo (Cebu), City Of Bogo ,Cebu,2025-10-06 09:25:00,2025-10-06,09:25:00,129.4,3
02/10/2025 0:37,11.2,124.1,16,1.9,021 km N 37° E of City Of Bogo (Cebu), City Of Bogo ,Cebu,2025-10-02 00:37:00,2025-10-02,00:37:00,24.6,1
12/10/2025 18:57,11.05,124.03,19,1.7,006 km S 89° E of City Of Bogo (Cebu), City Of Bogo ,Cebu,2025-10-12 18:57:00,2025-10-12,18:57:00,282.93333333333334,3
26/10/2025 6:42,11.13,123.96,1,3.2,010 km N 13° W of City Of Bogo (Cebu), City Of Bogo ,Cebu,2025-10-26 06:42:00,2025-10-26,06:42:00,606.6833333333333,2
05/10/2025 1:58,11.18,123.95,24,2.1,015 km N 13° W of City Of Bogo (Cebu), City Of Bogo ,Cebu,2025-10-05 01:58:00,2025-10-05,01:58:00,97.95,3
11/10/2025 12:28,11.04,123.97,3,1.5,004 km S 48° W of City Of Bogo (Cebu), City Of Bogo ,Cebu,2025-10-11 12:28:00,2025-10-11,12:28:00,252.45,0
05/10/2025 8:56,11.09,124.12,5,2.8,017 km N 72° E of City Of Bogo (Cebu), City Of Bogo ,Cebu,2025-10-05 08:56:00,2025-10-05,08:56:00,104.91666666666667,1
13/10/2025 8:11,11.03,124.05,29,1.6,008 km S 75° E of City Of Bogo (Cebu), City Of Bogo ,Cebu,2025-10-13 08:11:00,2025-10-13,08:11:00,296.1666666666667,3
26/10/2025 3:16,11.12,123.93,29,1.9,010 km N 31° W of City Of Bogo (Cebu), City Of Bogo ,Cebu,2025-10-26 03:16:00,2025-10-26,03:16:00,603.25,2
01/10/2025 5:55,11.15,123.95,8,1.7,012 km N 16° W of City Of Bogo (Cebu), City Of Bogo ,Cebu,2025-10-01 05:55:00,2025-10-01,05:55:00,5.9,1
05/10/2025 23:20,11.08,123.96,7,2.4,004 km N 25° W of City Of Bogo (Cebu), City Of Bogo ,Cebu,2025-10-05 23:20:00,2025-10-05,23:20:00,119.31666666666666,0
04/10/2025 13:35,11.09,124.05,25,1.4,009 km N 60° E of City Of Bogo (Cebu), City Of Bogo ,Cebu,2025-10-04 13:35:00,2025-10-04,13:35:00,85.56666666666666,3
03/10/2025 2:25,11.03,124.03,33,1.4,005 km S 71° E of City Of Bogo (Cebu), City Of Bogo ,Cebu,2025-10-03 02:25:00,2025-10-03,02:25:00,50.4,3
15/10/2025 15:58,11.12,124.14,4,4.1,019 km N 66° E of City Of Bogo (Cebu), City Of Bogo ,Cebu,2025-10-15 15:58:00,2025-10-15,15:58:00,351.95,1
28/10/2025 3:26,11.19,124.15,19,2.6,025 km N 49° E of City Of Bogo (Cebu), City Of Bogo ,Cebu,2025-10-28 03:26:00,2025-10-28,03:26:00,651.4166666666666,2
01/10/2025 8:23,10.95,123.88,2,3.7,015 km S 46° W of City Of Bogo (Cebu), City Of Bogo ,Cebu,2025-10-01 08:23:00,2025-10-01,08:23:00,8.366666666666667,0
07/10/2025 5:13,11.15,123.98,17,1.3,012 km N 02° W of City Of Bogo (Cebu), City Of Bogo ,Cebu,2025-10-07 05:13:00,2025-10-07,05:13:00,149.2,3
13/10/2025 8:40,10.97,123.91,1,3.2,011 km S 44° W of City Of Bogo (Cebu), City Of Bogo ,Cebu,2025-10-13 08:40:00,2025-10-13,08:40:00,296.65,0
02/10/2025 15:16,11.14,124.1,29,1.4,017 km N 53° E of City Of Bogo (Cebu), City Of Bogo ,Cebu,2025-10-02 15:16:00,2025-10-02,15:16:00,39.25,3
01/10/2025 4:47,10.89,123.88,2,2.2,021 km S 33° W of City Of Bogo (Cebu), City Of Bogo ,Cebu,2025-10-01 04:47:00,2025-10-01,04:47:00,4.766666666666667,0
10/10/2025 5:55,10.94,123.98,25,1.8,012 km S 03° E of City Of Bogo (Cebu), City Of Bogo ,Cebu,2025-10-10 05:55:00,2025-10-10,05:55:00,221.9,3
02/10/2025 6:33,10.92,123.94,2,2.4,015 km S 18° W of City Of Bogo (Cebu), City Of Bogo ,Cebu,2025-10-02 06:33:00,2025-10-02,06:33:00,30.533333333333335,0
11/10/2025 15:14,11.14,124.14,16,2.6,020 km N 59° E of City Of Bogo (Cebu), City Of Bogo ,Cebu,2025-10-11 15:14:00,2025-10-11,15:14:00,255.21666666666667,1
05/10/2025 2:29,11.14,124.17,7,3.8,024 km N 63° E of City Of Bogo (Cebu), City Of Bogo ,Cebu,2025-10-05 02:29:00,2025-10-05,02:29:00,98.46666666666667,1
08/10/2025 8:35,11.11,124.11,5,2.4,015 km N 65° E of City Of Bogo (Cebu), City Of Bogo ,Cebu,2025-10-08 08:35:00,2025-10-08,08:35:00,176.56666666666666,1
05/10/2025 15:55,11.18,124.18,6,2.3,027 km N 56° E of City Of Bogo (Cebu), City Of Bogo ,Cebu,2025-10-05 15:55:00,2025-10-05,15:55:00,111.9,1
02/10/2025 17:14,10.87,123.93,4,2.0,020 km S 16° W of City Of Bogo (Cebu), City Of Bogo ,Cebu,2025-10-02 17:14:00,2025-10-02,17:14:00,41.21666666666667,0
07/10/2025 6:37,11.18,124.11,3,2.0,021 km N 45° E of City Of Bogo (Cebu), City Of Bogo ,Cebu,2025-10-07 06:37:00,2025-10-07,06:37:00,150.6,1
03/10/2025 22:03,10.98,123.88,2,2.0,013 km S 55° W of City Of Bogo (Cebu), City Of Bogo ,Cebu,2025-10-03 22:03:00,2025-10-03,22:03:00,70.03333333333333,0
23/10/2025 11:11,11.09,124.02,33,1.5,006 km N 40° E of City Of Bogo (Cebu), City Of Bogo ,Cebu,2025-10-23 11:11:00,2025-10-23,11:11:00,539.1666666666666,3
13/10/2025 2:10,11.05,123.95,13,2.7,004 km N 79° W of City Of Bogo (Cebu), City Of Bogo ,Cebu,2025-10-13 02:10:00,2025-10-13,02:10:00,290.15,0
04/10/2025 21:06,11.1,124.1,7,2.8,014 km N 66° E of City Of Bogo (Cebu), City Of Bogo ,Cebu,2025-10-04 21:06:00,2025-10-04,21:06:00,93.08333333333333,1
19/10/2025 0:51,10.91,123.89,20,3.1,018 km S 31° W of City Of Bogo (Cebu), City Of Bogo ,Cebu,2025-10-19 00:51:00,2025-10-19,00:51:00,432.8333333333333,0
03/10/2025 5:14,11.04,124.04,2,2.0,006 km S 79° E of City Of Bogo (Cebu), City Of Bogo ,Cebu,2025-10-03 05:14:00,2025-10-03,05:14:00,53.21666666666667,1
04/10/2025 0:10,11.07,124.1,7,2.1,014 km N 81° E of City Of Bogo (Cebu), City Of Bogo ,Cebu,2025-10-04 00:10:00,2025-10-04,00:10:00,72.15,1
02/10/2025 20:12,11.2,124.1,33,2.8,021 km N 39° E of City Of Bogo (Cebu), City Of Bogo ,Cebu,2025-10-02 20:12:00,2025-10-02,20:12:00,44.18333333333333,3
02/10/2025 14:45,11.13,124.02,7,2.0,010 km N 24° E of City Of Bogo (Cebu), City Of Bogo ,Cebu,2025-10-02 14:45:00,2025-10-02,14:45:00,38.733333333333334,1
15/10/2025 1:59,11.17,124.09,26,1.5,018 km N 42° E of City Of Bogo (Cebu), City Of Bogo ,Cebu,2025-10-15 01:59:00,2025-10-15,01:59:00,337.96666666666664,3
14/10/2025 20:03,11.04,124.01,33,2.0,004 km S 86° E of City Of Bogo (Cebu), City Of Bogo ,Cebu,2025-10-14 20:03:00,2025-10-14,20:03:00,332.03333333333336,3
05/10/2025 6:26,10.89,123.87,5,2.0,021 km S 35° W of City Of Bogo (Cebu), City Of Bogo ,Cebu,2025-10-05 06:26:00,2025-10-05,06:26:00,102.41666666666667,0
09/10/2025 2:04,10.9,124.0,22,1.9,017 km S 08° E of City Of Bogo (Cebu), City Of Bogo ,Cebu,2025-10-09 02:04:00,2025-10-09,02:04:00,194.05,3
01/10/2025 22:37,11.14,124.08,8,1.4,015 km N 49° E of City Of Bogo (Cebu), City Of Bogo ,Cebu,2025-10-01 22:37:00,2025-10-01,22:37:00,22.6,1
14/10/2025 18:29,10.9,123.91,1,2.8,017 km S 26° W of City Of Bogo (Cebu), City Of Bogo ,Cebu,2025-10-14 18:29:00,2025-10-14,18:29:00,330.46666666666664,0
20/10/2025 22:35,10.93,123.87,1,2.5,018 km S 43° W of City Of Bogo (Cebu), City Of Bogo ,Cebu,2025-10-20 22:35:00,2025-10-20,22:35:00,478.56666666666666,0
17/10/2025 19:43,11.1,124.09,32,1.5,013 km N 64° E of City Of Bogo (Cebu), City Of Bogo ,Cebu,2025-10-17 19:43:00,2025-10-17,19:43:00,403.7,3
15/10/2025 22:14,11.2,124.17,8,2.2,027 km N 50° E of City Of Bogo (Cebu), City Of Bogo ,Cebu,2025-10-15 22:14:00,2025-10-15,22:14:00,358.21666666666664,1
22/10/2025 6:38,11.12,124.28,1,2.3,034 km N 77° E of City Of Bogo (Cebu), City Of Bogo ,Cebu,2025-10-22 06:38:00,2025-10-22,06:38:00,510.6166666666667,1
20/10/2025 10:53,10.98,123.98,6,2.9,008 km S 02° E of City Of Bogo (Cebu), City Of Bogo ,Cebu,2025-10-20 10:53:00,2025-10-20,10:53:00,466.8666666666667,2
06/10/2025 2:45,10.98,124.02,31,1.8,008 km S 29° E of City Of Bogo (Cebu), City Of Bogo ,Cebu,2025-10-06 02:45:00,2025-10-06,02:45:00,122.73333333333333,3
26/10/2025 1:21,11.09,124.09,2,2.7,013 km N 67° E of City Of Bogo (Cebu), City Of Bogo ,Cebu,2025-10-26 01:21:00,2025-10-26,01:21:00,601.3333333333334,2
10/10/2025 3:46,10.91,123.66,11,2.2,038 km S 67° W of City Of Bogo (Cebu), City Of Bogo ,Cebu,2025-10-10 03:46:00,2025-10-10,03:46:00,219.75,0
17/10/2025 11:36,11.22,123.93,10,2.3,020 km N 16° W of City Of Bogo (Cebu), City Of Bogo ,Cebu,2025-10-17 11:36:00,2025-10-17,11:36:00,395.5833333333333,2
04/10/2025 17:06,10.88,123.97,5,4.0,018 km S 02° W of City Of Bogo (Cebu), City Of Bogo ,Cebu,2025-10-04 17:06:00,2025-10-04,17:06:00,89.08333333333333,0
05/10/2025 0:30,11.05,124.06,23,1.4,009 km N 88° E of City Of Bogo (Cebu), City Of Bogo ,Cebu,2025-10-05 00:30:00,2025-10-05,00:30:00,96.48333333333333,3
01/10/2025 11:47,11.18,124.0,32,1.4,015 km N 09° E of City Of Bogo (Cebu), City Of Bogo ,Cebu,2025-10-01 11:47:00,2025-10-01,11:47:00,11.766666666666667,3
13/10/2025 12:20,11.11,124.03,33,2.3,009 km N 37° E of City Of Bogo (Cebu), City Of Bogo ,Cebu,2025-10-13 12:20:00,2025-10-13,12:20:00,300.31666666666666,3
18/10/2025 12:31,11.15,124.06,19,2.3,015 km N 38° E of City Of Bogo (Cebu), City Of Bogo ,Cebu,2025-10-18 12:31:00,2025-10-18,12:31:00,420.5,2
29/10/2025 4:34,10.97,123.94,6,2.5,009 km S 27° W of City Of Bogo (Cebu), City Of Bogo ,Cebu,2025-10-29 04:34:00,2025-10-29,04:34:00,676.55,2
14/10/2025 5:02,11.04,124.0,28,1.8,006 km N 36° E of City Of Bogo (Cebu), City Of Bogo ,Cebu,2025-10-14 05:02:00,2025-10-14,05:02:00,317.01666666666665,3
02/10/2025 10:01,11.12,123.86,29,4.5,015 km N 58° W of City Of Bogo (Cebu), City Of Bogo ,Cebu,2025-10-02 10:01:00,2025-10-02,10:01:00,34.0,0
06/10/2025 10:20,11.09,124.06,6,2.6,010 km N 58° E of City Of Bogo (Cebu), City Of Bogo ,Cebu,2025-10-06 10:20:00,2025-10-06,10:20:00,130.31666666666666,1
15/10/2025 2:44,11.32,124.09,33,2.4,032 km N 22° E of City Of Bogo (Cebu), City Of Bogo ,Cebu,2025-10-15 02:44:00,2025-10-15,02:44:00,338.71666666666664,3
13/10/2025 8:18,10.94,123.87,1,2.2,017 km S 46° W of City Of Bogo (Cebu), City Of Bogo ,Cebu,2025-10-13 08:18:00,2025-10-13,08:18:00,296.28333333333336,0
07/10/2025 21:08,10.99,123.99,25,1.3,006 km S 12° E of City Of Bogo (Cebu), City Of Bogo ,Cebu,2025-10-07 21:08:00,2025-10-07,21:08:00,165.11666666666667,3
25/10/2025 0:59,11.0,123.91,14,2.1,010 km S 56° W of City Of Bogo (Cebu), City Of Bogo ,Cebu,2025-10-25 00:59:00,2025-10-25,00:59:00,576.9666666666667,2
04/10/2025 20:50,11.17,123.96,18,1.7,013 km N 07° W of City Of Bogo (Cebu), City Of Bogo ,Cebu,2025-10-04 20:50:00,2025-10-04,20:50:00,92.81666666666666,3
04/10/2025 21:46,10.99,123.99,28,2.2,007 km S 13° E of City Of Bogo (Cebu), City Of Bogo ,Cebu,2025-10-04 21:46:00,2025-10-04,21:46:00,93.75,3
13/10/2025 8:32,11.12,124.08,34,2.0,014 km N 53° E of City Of Bogo (Cebu), City Of Bogo ,Cebu,2025-10-13 08:32:00,2025-10-13,08:32:00,296.51666666666665,3
05/10/2025 15:32,11.17,123.98,27,1.6,013 km N 01° W of City Of Bogo (Cebu), City Of Bogo ,Cebu,2025-10-05 15:32:00,2025-10-05,15:32:00,111.51666666666667,3
26/10/2025 4:09,11.2,123.95,20,2.1,017 km N 10° W of City Of Bogo (Cebu), City Of Bogo ,Cebu,2025-10-26 04:09:00,2025-10-26,04:09:00,604.1333333333333,2
17/10/2025 17:08,10.99,123.97,4,3.3,006 km S 14° W of City Of Bogo (Cebu), City Of Bogo ,Cebu,2025-10-17 17:08:00,2025-10-17,17:08:00,401.1166666666667,0
29/10/2025 5:57,11.05,124.06,1,2.4,009 km N 86° E of City Of Bogo (Cebu), City Of Bogo ,Cebu,2025-10-29 05:57:00,2025-10-29,05:57:00,677.9333333333333,2
02/10/2025 12:35,11.01,124.09,23,3.1,013 km S 70° E of City Of Bogo (Cebu), City Of Bogo ,Cebu,2025-10-02 12:35:00,2025-10-02,12:35:00,36.56666666666667,1
22/10/2025 23:29,11.14,124.07,29,2.8,014 km N 44° E of City Of Bogo (Cebu), City Of Bogo ,Cebu,2025-10-22 23:29:00,2025-10-22,23:29:00,527.4666666666667,2
13/10/2025 2:32,10.93,123.91,8,2.1,015 km S 29° W of City Of Bogo (Cebu), City Of Bogo ,Cebu,2025-10-13 02:32:00,2025-10-13,02:32:00,290.51666666666665,0
01/10/2025 21:39,11.08,124.03,33,1.7,007 km N 58° E of City Of Bogo (Cebu), City Of Bogo ,Cebu,2025-10-01 21:39:00,2025-10-01,21:39:00,21.633333333333333,3
07/10/2025 3:45,11.17,123.97,12,1.7,013 km N 12° W of City Of Bogo (Cebu), City Of Bogo ,Cebu,2025-10-07 03:45:00,2025-10-07,03:45:00,147.73333333333332,1
12/10/2025 3:43,11.15,124.01,16,2.0,012 km N 14° E of City Of Bogo (Cebu), City Of Bogo ,Cebu,2025-10-12 03:43:00,2025-10-12,03:43:00,267.7,1
03/10/2025 2:28,11.01,124.04,6,2.1,007 km S 59° E of City Of Bogo (Cebu), City Of Bogo ,Cebu,2025-10-03 02:28:00,2025-10-03,02:28:00,50.45,1
01/10/2025 18:39,11.13,124.2,2,2.1,026 km N 68° E of City Of Bogo (Cebu), City Of Bogo ,Cebu,2025-10-01 18:39:00,2025-10-01,18:39:00,18.633333333333333,1
06/10/2025 10:20,11.09,124.07,4,2.6,011 km N 65° E of City Of Bogo (Cebu), City Of Bogo ,Cebu,2025-10-06 10:20:00,2025-10-06,10:20:00,130.31666666666666,1
02/10/2025 21:55,11.24,124.18,5,2.1,031 km N 47° E of City Of Bogo (Cebu), City Of Bogo ,Cebu,2025-10-02 21:55:00,2025-10-02,21:55:00,45.9,1
05/10/2025 0:26,11.03,123.96,7,2.2,003 km S 43° W of City Of Bogo (Cebu), City Of Bogo ,Cebu,2025-10-05 00:26:00,2025-10-05,00:26:00,96.41666666666667,0
01/10/2025 0:01,10.83,123.95,10,4.5,024 km S 08° W of City Of Bogo (Cebu), City Of Bogo ,Cebu,2025-10-01 00:01:00,2025-10-01,00:01:00,0.0,0
25/10/2025 16:49,11.11,124.09,3,3.2,014 km N 62° E of City Of Bogo (Cebu), City Of Bogo ,Cebu,2025-10-25 16:49:00,2025-10-25,16:49:00,592.8,2
12/10/2025 22:58,11.23,124.01,13,1.2,020 km N 08° E of City Of Bogo (Cebu), City Of Bogo ,Cebu,2025-10-12 22:58:00,2025-10-12,22:58:00,286.95,3
03/10/2025 3:01,11.13,124.21,34,1.5,027 km N 69° E of City Of Bogo (Cebu), City Of Bogo ,Cebu,2025-10-03 03:01:00,2025-10-03,03:01:00,51.0,3
01/10/2025 3:55,11.07,124.08,2,2.7,011 km N 75° E of City Of Bogo (Cebu), City Of Bogo ,Cebu,2025-10-01 03:55:00,2025-10-01,03:55:00,3.9,1
19/10/2025 6:27,11.03,124.01,1,4.0,004 km S 56° E of City Of Bogo (Cebu), City Of Bogo ,Cebu,2025-10-19 06:27:00,2025-10-19,06:27:00,438.43333333333334,0
16/10/2025 18:17,11.15,124.14,18,1.5,021 km N 58° E of City Of Bogo (Cebu), City Of Bogo ,Cebu,2025-10-16 18:17:00,2025-10-16,18:17:00,378.26666666666665,3
28/10/2025 3:06,11.16,123.99,21,1.9,013 km N 03° E of City Of Bogo (Cebu), City Of Bogo ,Cebu,2025-10-28 03:06:00,2025-10-28,03:06:00,651.0833333333334,2
08/10/2025 19:30,10.96,123.95,3,2.6,010 km S 15° W of City Of Bogo (Cebu), City Of Bogo ,Cebu,2025-10-08 19:30:00,2025-10-08,19:30:00,187.48333333333332,0
17/10/2025 16:05,11.14,124.13,9,2.9,019 km N 59° E of City Of Bogo (Cebu), City Of Bogo ,Cebu,2025-10-17 16:05:00,2025-10-17,16:05:00,400.06666666666666,1
06/10/2025 11:02,11.19,124.18,1,1.9,027 km N 53° E of City Of Bogo (Cebu), City Of Bogo ,Cebu,2025-10-06 11:02:00,2025-10-06,11:02:00,131.01666666666668,1
19/10/2025 23:59,11.2,124.13,35,1.8,024 km N 42° E of City Of Bogo (Cebu), City Of Bogo ,Cebu,2025-10-19 23:59:00,2025-10-19,23:59:00,455.96666666666664,3
03/10/2025 2:00,11.06,124.15,11,2.0,019 km N 86° E of City Of Bogo (Cebu), City Of Bogo ,Cebu,2025-10-03 02:00:00,2025-10-03,02:00:00,49.983333333333334,1
08/10/2025 0:39,11.15,124.12,5,2.7,019 km N 53° E of City Of Bogo (Cebu), City Of Bogo ,Cebu,2025-10-08 00:39:00,2025-10-08,00:39:00,168.63333333333333,1
04/10/2025 0:20,11.19,124.14,9,2.2,024 km N 47° E of City Of Bogo (Cebu), City Of Bogo ,Cebu,2025-10-04 00:20:00,2025-10-04,00:20:00,72.31666666666666,1
13/10/2025 18:41,11.07,123.97,27,1.5,002 km N 17° W of City Of Bogo (Cebu), City Of Bogo ,Cebu,2025-10-13 18:41:00,2025-10-13,18:41:00,306.6666666666667,3
02/10/2025 4:16,11.06,124.07,18,2.4,010 km N 79° E of City Of Bogo (Cebu), City Of Bogo ,Cebu,2025-10-02 04:16:00,2025-10-02,04:16:00,28.25,1
13/10/2025 0:35,11.02,123.88,2,2.4,011 km S 76° W of City Of Bogo (Cebu), City Of Bogo ,Cebu,2025-10-13 00:35:00,2025-10-13,00:35:00,288.56666666666666,0
06/10/2025 18:02,10.91,123.92,16,3.0,016 km S 22° W of City Of Bogo (Cebu), City Of Bogo ,Cebu,2025-10-06 18:02:00,2025-10-06,18:02:00,138.01666666666668,0
02/10/2025 15:06,11.12,124.16,10,1.9,021 km N 68° E of City Of Bogo (Cebu), City Of Bogo ,Cebu,2025-10-02 15:06:00,2025-10-02,15:06:00,39.083333333333336,1
17/10/2025 23:22,11.03,124.02,26,2.1,005 km S 66° E of City Of Bogo (Cebu), City Of Bogo ,Cebu,2025-10-17 23:22:00,2025-10-17,23:22:00,407.35,3
07/10/2025 12:47,11.18,124.1,12,1.9,020 km N 43° E of City Of Bogo (Cebu), City Of Bogo ,Cebu,2025-10-07 12:47:00,2025-10-07,12:47:00,156.76666666666668,1
09/10/2025 2:21,10.76,123.95,18,1.7,032 km S 06° W of City Of Bogo (Cebu), City Of Bogo ,Cebu,2025-10-09 02:21:00,2025-10-09,02:21:00,194.33333333333334,0
13/10/2025 18:31,10.97,124.06,32,1.4,012 km S 46° E of City Of Bogo (Cebu), City Of Bogo ,Cebu,2025-10-13 18:31:00,2025-10-13,18:31:00,306.5,3
14/10/2025 1:38,11.25,123.91,32,3.1,023 km N 19° W of City Of Bogo (Cebu), City Of Bogo ,Cebu,2025-10-14 01:38:00,2025-10-14,01:38:00,313.6166666666667,3
01/10/2025 0:34,11.18,124.17,5,4.8,025 km N 56° E of City Of Bogo (Cebu), City Of Bogo ,Cebu,2025-10-01 00:34:00,2025-10-01,00:34:00,0.55,1
16/10/2025 22:15,11.08,124.04,23,2.0,007 km N 62° E of City Of Bogo (Cebu), City Of Bogo ,Cebu,2025-10-16 22:15:00,2025-10-16,22:15:00,382.23333333333335,3
27/10/2025 10:05,11.03,124.04,7,2.3,007 km S 69° E of City Of Bogo (Cebu), City Of Bogo ,Cebu,2025-10-27 10:05:00,2025-10-27,10:05:00,634.0666666666667,2
26/10/2025 1:21,11.07,124.09,2,2.7,012 km N 79° E of City Of Bogo (Cebu), City Of Bogo ,Cebu,2025-10-26 01:21:00,2025-10-26,01:21:00,601.3333333333334,2
25/10/2025 23:35,11.08,124.19,2,2.0,023 km N 81° E of City Of Bogo (Cebu), City Of Bogo ,Cebu,2025-10-25 23:35:00,2025-10-25,23:35:00,599.5666666666667,2
13/10/2025 22:52,10.97,123.99,31,2.0,009 km S 07° E of City Of Bogo (Cebu), City Of Bogo ,Cebu,2025-10-13 22:52:00,2025-10-13,22:52:00,310.85,3
26/10/2025 7:57,10.99,123.94,3,2.3,007 km S 35° W of City Of Bogo (Cebu), City Of Bogo ,Cebu,2025-10-26 07:57:00,2025-10-26,07:57:00,607.9333333333333,2
01/10/2025 2:55,11.16,124.16,2,2.6,024 km N 57° E of City Of Bogo (Cebu), City Of Bogo ,Cebu,2025-10-01 02:55:00,2025-10-01,02:55:00,2.9,1
07/10/2025 2:58,11.01,124.05,33,1.7,008 km S 65° E of City Of Bogo (Cebu), City Of Bogo ,Cebu,2025-10-07 02:58:00,2025-10-07,02:58:00,146.95,3
11/10/2025 13:30,10.96,123.98,2,2.4,010 km S 01° W of City Of Bogo (Cebu), City Of Bogo ,Cebu,2025-10-11 13:30:00,2025-10-11,13:30:00,253.48333333333332,0
20/10/2025 17:37,11.04,123.97,26,2.0,001 km S 73° W of City Of Bogo (Cebu), City Of Bogo ,Cebu,2025-10-20 17:37:00,2025-10-20,17:37:00,473.6,2
30/10/2025 10:37,11.13,124.18,8,2.2,024 km N 66° E of City Of Bogo (Cebu), City Of Bogo ,Cebu,2025-10-30 10:37:00,2025-10-30,10:37:00,706.6,2
07/10/2025 12:54,11.02,124.12,26,2.5,015 km S 80° E of City Of Bogo (Cebu), City Of Bogo ,Cebu,2025-10-07 12:54:00,2025-10-07,12:54:00,156.88333333333333,3
01/10/2025 1:48,11.17,124.09,5,2.2,019 km N 41° E of City Of Bogo (Cebu), City Of Bogo ,Cebu,2025-10-01 01:48:00,2025-10-01,01:48:00,1.7833333333333334,1
18/10/2025 5:07,11.14,123.98,2,1.8,010 km N 01° W of City Of Bogo (Cebu), City Of Bogo ,Cebu,2025-10-18 05:07:00,2025-10-18,05:07:00,413.1,2
06/10/2025 2:28,10.97,123.97,26,2.3,008 km S 06° W of City Of Bogo (Cebu), City Of Bogo ,Cebu,2025-10-06 02:28:00,2025-10-06,02:28:00,122.45,3
03/10/2025 4:29,11.09,124.14,34,1.8,018 km N 76° E of City Of Bogo (Cebu), City Of Bogo ,Cebu,2025-10-03 04:29:00,2025-10-03,04:29:00,52.46666666666667,3
06/10/2025 22:45,11.15,123.99,21,1.2,011 km N 07° E of City Of Bogo (Cebu), City Of Bogo ,Cebu,2025-10-06 22:45:00,2025-10-06,22:45:00,142.73333333333332,3
02/10/2025 4:26,11.06,123.95,31,1.3,003 km N 67° W of City Of Bogo (Cebu), City Of Bogo ,Cebu,2025-10-02 04:26:00,2025-10-02,04:26:00,28.416666666666668,3
02/10/2025 9:25,10.91,123.97,32,2.5,016 km S 06° W of City Of Bogo (Cebu), City Of Bogo ,Cebu,2025-10-02 09:25:00,2025-10-02,09:25:00,33.4,3
09/10/2025 5:22,11.06,124.09,32,1.2,013 km N 83° E of City Of Bogo (Cebu), City Of Bogo ,Cebu,2025-10-09 05:22:00,2025-10-09,05:22:00,197.35,3
03/10/2025 20:37,11.28,124.14,11,2.4,032 km N 34° E of City Of Bogo (Cebu), City Of Bogo ,Cebu,2025-10-03 20:37:00,2025-10-03,20:37:00,68.6,1
01/10/2025 6:09,11.11,123.93,22,2.2,009 km N 37° W of City Of Bogo (Cebu), City Of Bogo ,Cebu,2025-10-01 06:09:00,2025-10-01,06:09:00,6.133333333333334,3
03/10/2025 20:19,11.23,123.91,6,3.2,021 km N 20° W of City Of Bogo (Cebu), City Of Bogo ,Cebu,2025-10-03 20:19:00,2025-10-03,20:19:00,68.3,1
01/10/2025 15:15,11.08,124.23,32,1.4,028 km N 82° E of City Of Bogo (Cebu), City Of Bogo ,Cebu,2025-10-01 15:15:00,2025-10-01,15:15:00,15.233333333333333,3
02/10/2025 16:38,11.02,124.17,7,2.2,021 km S 81° E of City Of Bogo (Cebu), City Of Bogo ,Cebu,2025-10-02 16:38:00,2025-10-02,16:38:00,40.61666666666667,1
04/10/2025 2:07,11.22,124.17,7,1.7,028 km N 48° E of City Of Bogo (Cebu), City Of Bogo ,Cebu,2025-10-04 02:07:00,2025-10-04,02:07:00,74.1,1
05/10/2025 17:52,10.92,123.96,6,2.1,014 km S 09° W of City Of Bogo (Cebu), City Of Bogo ,Cebu,2025-10-05 17:52:00,2025-10-05,17:52:00,113.85,0
02/10/2025 6:03,11.26,124.03,33,1.1,024 km N 12° E of City Of Bogo (Cebu), City Of Bogo ,Cebu,2025-10-02 06:03:00,2025-10-02,06:03:00,30.033333333333335,3
05/10/2025 18:27,10.88,123.94,1,1.9,019 km S 11° W of City Of Bogo (Cebu), City Of Bogo ,Cebu,2025-10-05 18:27:00,2025-10-05,18:27:00,114.43333333333334,0
04/10/2025 11:49,10.82,123.94,17,1.7,025 km S 09° W of City Of Bogo (Cebu), City Of Bogo ,Cebu,2025-10-04 11:49:00,2025-10-04,11:49:00,83.8,0
13/10/2025 22:46,11.08,124.04,29,2.1,008 km N 58° E of City Of Bogo (Cebu), City Of Bogo ,Cebu,2025-10-13 22:46:00,2025-10-13,22:46:00,310.75,3
12/10/2025 2:44,11.05,124.03,3,2.9,006 km S 89° E of City Of Bogo (Cebu), City Of Bogo ,Cebu,2025-10-12 02:44:00,2025-10-12,02:44:00,266.71666666666664,0
28/10/2025 0:52,11.19,124.01,15,2.9,016 km N 13° E of City Of Bogo (Cebu), City Of Bogo ,Cebu,2025-10-28 00:52:00,2025-10-28,00:52:00,648.85,2
05/10/2025 7:07,11.13,123.95,6,1.9,010 km N 20° W of City Of Bogo (Cebu), City Of Bogo ,Cebu,2025-10-05 07:07:00,2025-10-05,07:07:00,103.1,1
12/10/2025 21:51,11.18,124.02,20,2.7,015 km N 16° E of City Of Bogo (Cebu), City Of Bogo ,Cebu,2025-10-12 21:51:00,2025-10-12,21:51:00,285.8333333333333,1
14/10/2025 0:50,11.16,123.98,31,1.7,013 km N 01° W of City Of Bogo (Cebu), City Of Bogo ,Cebu,2025-10-14 00:50:00,2025-10-14,00:50:00,312.81666666666666,3
05/10/2025 14:28,11.09,123.87,3,1.9,012 km N 69° W of City Of Bogo (Cebu), City Of Bogo ,Cebu,2025-10-05 14:28:00,2025-10-05,14:28:00,110.45,0
01/10/2025 20:35,10.98,124.02,25,2.4,008 km S 30° E of City Of Bogo (Cebu), City Of Bogo ,Cebu,2025-10-01 20:35:00,2025-10-01,20:35:00,20.566666666666666,3
08/10/2025 15:11,11.07,124.14,34,1.8,018 km N 83° E of City Of Bogo (Cebu), City Of Bogo ,Cebu,2025-10-08 15:11:00,2025-10-08,15:11:00,183.16666666666666,3
01/10/2025 9:20,11.27,124.05,51,1.4,026 km N 16° E of City Of Bogo (Cebu), City Of Bogo ,Cebu,2025-10-01 09:20:00,2025-10-01,09:20:00,9.316666666666666,3
03/10/2025 17:28,11.07,124.09,2,1.8,013 km N 79° E of City Of Bogo (Cebu), City Of Bogo ,Cebu,2025-10-03 17:28:00,2025-10-03,17:28:00,65.45,1
27/10/2025 23:17,11.1,124.01,27,1.9,007 km N 29° E of City Of Bogo (Cebu), City Of Bogo ,Cebu,2025-10-27 23:17:00,2025-10-27,23:17:00,647.2666666666667,2
14/10/2025 17:24,10.98,123.99,24,2.7,007 km S 13° E of City Of Bogo (Cebu), City Of Bogo ,Cebu,2025-10-14 17:24:00,2025-10-14,17:24:00,329.3833333333333,0
03/10/2025 3:55,10.97,124.1,33,1.6,015 km S 59° E of City Of Bogo (Cebu), City Of Bogo ,Cebu,2025-10-03 03:55:00,2025-10-03,03:55:00,51.9,3
13/10/2025 11:01,11.1,124.02,33,2.0,008 km N 36° E of City Of Bogo (Cebu), City Of Bogo ,Cebu,2025-10-13 11:01:00,2025-10-13,11:01:00,299.0,3
03/10/2025 13:43,10.99,123.97,26,2.2,007 km S 10° W of City Of Bogo (Cebu), City Of Bogo ,Cebu,2025-10-03 13:43:00,2025-10-03,13:43:00,61.7,3
01/10/2025 18:21,11.05,124.08,8,2.1,011 km N 87° E of City Of Bogo (Cebu), City Of Bogo ,Cebu,2025-10-01 18:21:00,2025-10-01,18:21:00,18.333333333333332,1
06/10/2025 4:34,10.88,123.91,2,2.2,020 km S 22° W of City Of Bogo (Cebu), City Of Bogo ,Cebu,2025-10-06 04:34:00,2025-10-06,04:34:00,124.55,0
28/10/2025 20:48,11.14,124.2,1,2.3,026 km N 67° E of City Of Bogo (Cebu), City Of Bogo ,Cebu,2025-10-28 20:48:00,2025-10-28,20:48:00,668.7833333333333,2
14/10/2025 23:30,11.18,124.15,7,2.4,024 km N 51° E of City Of Bogo (Cebu), City Of Bogo ,Cebu,2025-10-14 23:30:00,2025-10-14,23:30:00,335.48333333333335,1
06/10/2025 3:39,10.99,124.02,3,2.0,008 km S 34° E of City Of Bogo (Cebu), City Of Bogo ,Cebu,2025-10-06 03:39:00,2025-10-06,03:39:00,123.63333333333334,0
01/10/2025 10:48,10.96,123.95,2,2.2,011 km S 20° W of City Of Bogo (Cebu), City Of Bogo ,Cebu,2025-10-01 10:48:00,2025-10-01,10:48:00,10.783333333333333,0
12/10/2025 23:24,11.08,124.1,19,2.0,014 km N 77° E of City Of Bogo (Cebu), City Of Bogo ,Cebu,2025-10-12 23:24:00,2025-10-12,23:24:00,287.3833333333333,3
13/10/2025 5:00,11.06,123.94,19,1.8,004 km N 66° W of City Of Bogo (Cebu), City Of Bogo ,Cebu,2025-10-13 05:00:00,2025-10-13,05:00:00,292.98333333333335,3
09/10/2025 20:31,11.2,124.0,23,2.4,017 km N 09° E of City Of Bogo (Cebu), City Of Bogo ,Cebu,2025-10-09 20:31:00,2025-10-09,20:31:00,212.5,3
16/10/2025 4:18,11.17,124.17,25,1.9,025 km N 57° E of City Of Bogo (Cebu), City Of Bogo ,Cebu,2025-10-16 04:18:00,2025-10-16,04:18:00,364.28333333333336,3
22/10/2025 16:32,11.03,124.09,4,2.3,013 km S 80° E of City Of Bogo (Cebu), City Of Bogo ,Cebu,2025-10-22 16:32:00,2025-10-22,16:32:00,520.5166666666667,2
01/10/2025 18:23,10.92,123.98,4,2.8,014 km S 05° W of City Of Bogo (Cebu), City Of Bogo ,Cebu,2025-10-01 18:23:00,2025-10-01,18:23:00,18.366666666666667,0
19/10/2025 10:54,10.92,123.97,2,2.6,014 km S 03° W of City Of Bogo (Cebu), City Of Bogo ,Cebu,2025-10-19 10:54:00,2025-10-19,10:54:00,442.8833333333333,0
04/10/2025 7:51,11.0,123.93,18,2.8,007 km S 43° W of City Of Bogo (Cebu), City Of Bogo ,Cebu,2025-10-04 07:51:00,2025-10-04,07:51:00,79.83333333333333,0
