Date_Time_PH,Latitude,Longitude,Depth_In_Km,Magnitude,Location,Specific_Location,General_Location,datetime,date,time,hours_since_start,cluster
02/10/2025 2:18,11.06,123.97,7,1.9,002 km N 22° W of City Of Bogo (Cebu), City Of Bogo ,Cebu,2025-10-02 02:18:00,2025-10-02,02:18:00,26.283333333333335,1
23/10/2025 22:45,11.25,123.85,6,2.5,026 km N 32° W of City Of Bogo (Cebu), City Of Bogo ,Cebu,2025-10-23 22:45:00,2025-10-23,22:45:00,550.7333333333333,2
21/10/2025 1:18,11.22,124.11,6,2.8,024 km N 37° E of City Of Bogo (Cebu), City Of Bogo ,Cebu,2025-10-21 01:18:00,2025-10-21,01:18:00,481.28333333333336,1
02/10/2025 1:05,10.87,123.93,3,2.2,020 km S 15° W of City Of Bogo (Cebu), City Of Bogo ,Cebu,2025-10-02 01:05:00,2025-10-02,01:05:00,25.066666666666666,0
04/10/2025 11:24,11.01,124.04,32,1.3,008 km S 56° E of City Of Bogo (Cebu), City Of Bogo ,Cebu,2025-10-04 11:24:00,2025-10-04,11:24:00,83.38333333333334,3
20/10/2025 0:01,10.98,123.97,18,2.1,007 km S 07° W of City Of Bogo (Cebu), City Of Bogo ,Cebu,2025-10-20 00:01:00,2025-10-20,00:01:00,456.0,2
23/10/2025 23:19,10.98,123.94,4,3.2,009 km S 29° W of City Of Bogo (Cebu), City Of Bogo ,Cebu,2025-10-23 23:19:00,2025-10-23,23:19:00,551.3,2
01/10/2025 17:54,11.11,123.95,10,3.8,007 km N 24° W of City Of Bogo (Cebu), City Of Bogo ,Cebu,2025-10-01 17:54:00,2025-10-01,17:54:00,17.883333333333333,0
03/10/2025 8:48,10.91,123.93,1,2.2,016 km S 21° W of City Of Bogo (Cebu), City Of Bogo ,Cebu,2025-10-03 08:48:00,2025-10-03,08:48:00,56.78333333333333,0
03/10/2025 17:38,11.03,123.93,4,1.6,005 km S 70° W of City Of Bogo (Cebu), City Of Bogo ,Cebu,2025-10-03 17:38:00,2025-10-03,17:38:00,65.61666666666666,0
01/10/2025 9:49,10.99,124.08,15,1.6,013 km S 62° E of City Of Bogo (Cebu), City Of Bogo ,Cebu,2025-10-01 09:49:00,2025-10-01,09:49:00,9.8,3
08/10/2025 11:48,11.16,124.0,26,1.5,012 km N 10° E of City Of Bogo (Cebu), City Of Bogo ,Cebu,2025-10-08 11:48:00,2025-10-08,11:48:00,179.78333333333333,3
06/10/2025 5:43,11.09,124.09,32,1.1,013 km N 66° E of City Of Bogo (Cebu), City Of Bogo ,Cebu,2025-10-06 05:43:00,2025-10-06,05:43:00,125.7,3
01/10/2025 21:36,10.88,123.93,8,2.1,020 km S 16° W of City Of Bogo (Cebu), City Of Bogo ,Cebu,2025-10-01 21:36:00,2025-10-01,21:36:00,21.583333333333332,0
01/10/2025 23:12,11.17,124.19,4,1.7,026 km N 59° E of City Of Bogo (Cebu), City Of Bogo ,Cebu,2025-10-01 23:12:00,2025-10-01,23:12:00,23.183333333333334,1
23/10/2025 10:35,11.16,123.96,10,2.0,012 km N 10° W of City Of Bogo (Cebu), City Of Bogo ,Cebu,2025-10-23 10:35:00,2025-10-23,10:35:00,538.5666666666667,2
15/10/2025 5:29,11.15,123.95,9,2.7,012 km N 16° W of City Of Bogo (Cebu), City Of Bogo ,Cebu,2025-10-15 05:29:00,2025-10-15,05:29:00,341.46666666666664,2
25/10/2025 19:29,11.09,123.89,42,2.5,011 km N 63° W of City Of Bogo (Cebu), City Of Bogo ,Cebu,2025-10-25 19:29:00,2025-10-25,19:29:00,595.4666666666667,2
01/10/2025 1:20,11.37,124.07,35,2.1,037 km N 16° E of City Of Bogo (Cebu), City Of Bogo ,Cebu,2025-10-01 01:20:00,2025-10-01,01:20:00,1.3166666666666667,3
26/10/2025 6:29,11.11,123.94,33,1.8,008 km N 32° W of City Of Bogo (Cebu), City Of Bogo ,Cebu,2025-10-26 06:29:00,2025-10-26,06:29:00,606.4666666666667,2
06/10/2025 6:21,10.95,123.8,5,3.7,022 km S 61° W of City Of Bogo (Cebu), City Of Bogo ,Cebu,2025-10-06 06:21:00,2025-10-06,06:21:00,126.33333333333333,0
03/10/2025 21:49,11.08,124.08,17,1.4,012 km N 71° E of City Of Bogo (Cebu), City Of Bogo ,Cebu,2025-10-03 21:49:00,2025-10-03,21:49:00,69.8,3
25/10/2025 3:03,10.97,123.99,12,2.0,009 km S 09° E of City Of Bogo (Cebu), City Of Bogo ,Cebu,2025-10-25 03:03:00,2025-10-25,03:03:00,579.0333333333333,2
26/10/2025 4:36,11.21,124.03,31,1.9,019 km N 19° E of City Of Bogo (Cebu), City Of Bogo ,Cebu,2025-10-26 04:36:00,2025-10-26,04:36:00,604.5833333333334,2
09/10/2025 9:21,10.89,123.8,4,3.2,027 km S 48° W of City Of Bogo (Cebu), City Of Bogo ,Cebu,2025-10-09 09:21:00,2025-10-09,09:21:00,201.33333333333334,0
01/10/2025 15:16,11.14,124.16,23,2.2,022 km N 61° E of City Of Bogo (Cebu), City Of Bogo ,Cebu,2025-10-01 15:16:00,2025-10-01,15:16:00,15.25,1
05/10/2025 12:15,11.29,124.14,10,1.6,033 km N 33° E of City Of Bogo (Cebu), City Of Bogo ,Cebu,2025-10-05 12:15:00,2025-10-05,12:15:00,108.23333333333333,1
22/10/2025 21:31,10.95,123.88,19,2.1,016 km S 44° W of City Of Bogo (Cebu), City Of Bogo ,Cebu,2025-10-22 21:31:00,2025-10-22,21:31:00,525.5,2
17/10/2025 12:53,11.02,124.04,34,1.5,008 km S 68° E of City Of Bogo (Cebu), City Of Bogo ,Cebu,2025-10-17 12:53:00,2025-10-17,12:53:00,396.8666666666667,3
05/10/2025 22:28,11.16,123.95,5,2.4,012 km N 15° W of City Of Bogo (Cebu), City Of Bogo ,Cebu,2025-10-05 22:28:00,2025-10-05,22:28:00,118.45,1
08/10/2025 2:02,10.9,123.87,6,2.3,020 km S 36° W of City Of Bogo (Cebu), City Of Bogo ,Cebu,2025-10-08 02:02:00,2025-10-08,02:02:00,170.01666666666668,0
13/10/2025 23:10,11.12,124.08,33,1.9,014 km N 56° E of City Of Bogo (Cebu), City Of Bogo ,Cebu,2025-10-13 23:10:00,2025-10-13,23:10:00,311.15,3
14/10/2025 3:26,10.86,123.93,2,2.2,021 km S 16° W of City Of Bogo (Cebu), City Of Bogo ,Cebu,2025-10-14 03:26:00,2025-10-14,03:26:00,315.4166666666667,0
23/10/2025 6:58,10.94,123.87,2,2.5,017 km S 47° W of City Of Bogo (Cebu), City Of Bogo ,Cebu,2025-10-23 06:58:00,2025-10-23,06:58:00,534.95,0
10/10/2025 1:47,11.18,124.11,6,1.8,020 km N 43° E of City Of Bogo (Cebu), City Of Bogo ,Cebu,2025-10-10 01:47:00,2025-10-10,01:47:00,217.76666666666668,1
04/10/2025 13:28,11.17,123.97,15,1.6,014 km N 04° W of City Of Bogo (Cebu), City Of Bogo ,Cebu,2025-10-04 13:28:00,2025-10-04,13:28:00,85.45,3
13/10/2025 4:17,11.06,123.92,32,2.3,007 km N 73° W of City Of Bogo (Cebu), City Of Bogo ,Cebu,2025-10-13 04:17:00,2025-10-13,04:17:00,292.26666666666665,3
08/10/2025 23:05,11.1,124.11,3,1.8,015 km N 65° E of City Of Bogo (Cebu), City Of Bogo ,Cebu,2025-10-08 23:05:00,2025-10-08,23:05:00,191.06666666666666,1
08/10/2025 2:04,10.94,124.22,25,2.1,028 km S 67° E of City Of Bogo (Cebu), City Of Bogo ,Cebu,2025-10-08 02:04:00,2025-10-08,02:04:00,170.05,3
03/10/2025 23:14,11.41,123.91,11,2.2,040 km N 10° W of City Of Bogo (Cebu), City Of Bogo ,Cebu,2025-10-03 23:14:00,2025-10-03,23:14:00,71.21666666666667,1
02/10/2025 15:26,11.01,123.98,32,2.1,004 km S 03° E of City Of Bogo (Cebu), City Of Bogo ,Cebu,2025-10-02 15:26:00,2025-10-02,15:26:00,39.416666666666664,3
21/10/2025 5:22,11.03,123.81,20,2.4,018 km S 83° W of City Of Bogo (Cebu), City Of Bogo ,Cebu,2025-10-21 05:22:00,2025-10-21,05:22:00,485.35,2
29/10/2025 16:15,11.01,124.07,2,2.0,011 km S 68° E of City Of Bogo (Cebu), City Of Bogo ,Cebu,2025-10-29 16:15:00,2025-10-29,16:15:00,688.2333333333333,2
11/10/2025 14:05,10.86,123.95,2,2.3,023 km S 06° W of City Of Bogo (Cebu), City Of Bogo ,Cebu,2025-10-11 14:05:00,2025-10-11,14:05:00,254.06666666666666,0
01/10/2025 15:28,11.18,123.92,30,1.9,016 km N 22° W of City Of Bogo (Cebu), City Of Bogo ,Cebu,2025-10-01 15:28:00,2025-10-01,15:28:00,15.45,3
01/10/2025 7:01,10.98,123.96,5,4.4,007 km S 13° W of City Of Bogo (Cebu), City Of Bogo ,Cebu,2025-10-01 07:01:00,2025-10-01,07:01:00,7.0,0
14/10/2025 3:18,11.17,124.02,32,1.7,015 km N 18° E of City Of Bogo (Cebu), City Of Bogo ,Cebu,2025-10-14 03:18:00,2025-10-14,03:18:00,315.28333333333336,3
01/10/2025 22:10,11.0,124.03,19,2.2,007 km S 43° E of City Of Bogo (Cebu), City Of Bogo ,Cebu,2025-10-01 22:10:00,2025-10-01,22:10:00,22.15,3
13/10/2025 20:27,10.98,123.92,2,3.1,010 km S 39° W of City Of Bogo (Cebu), City Of Bogo ,Cebu,2025-10-13 20:27:00,2025-10-13,20:27:00,308.43333333333334,0
18/10/2025 23:24,11.17,124.12,7,3.0,021 km N 50° E of City Of Bogo (Cebu), City Of Bogo ,Cebu,2025-10-18 23:24:00,2025-10-18,23:24:00,431.3833333333333,1
16/10/2025 23:01,10.98,123.92,21,2.0,010 km S 41° W of City Of Bogo (Cebu), City Of Bogo ,Cebu,2025-10-16 23:01:00,2025-10-16,23:01:00,383.0,2
15/10/2025 15:55,11.16,124.11,6,4.5,019 km N 51° E of City Of Bogo (Cebu), City Of Bogo ,Cebu,2025-10-15 15:55:00,2025-10-15,15:55:00,351.9,1
04/10/2025 1:15,10.95,123.99,4,2.9,010 km S 04° E of City Of Bogo (Cebu), City Of Bogo ,Cebu,2025-10-04 01:15:00,2025-10-04,01:15:00,73.23333333333333,0
10/10/2025 23:00,10.94,123.89,33,2.4,016 km S 38° W of City Of Bogo (Cebu), City Of Bogo ,Cebu,2025-10-10 23:00:00,2025-10-10,23:00:00,238.98333333333332,0
23/10/2025 6:29,11.1,123.98,29,1.8,006 km N 04° E of City Of Bogo (Cebu), City Of Bogo ,Cebu,2025-10-23 06:29:00,2025-10-23,06:29:00,534.4666666666667,2
09/10/2025 5:18,11.11,123.98,21,1.5,007 km N 02° W of City Of Bogo (Cebu), City Of Bogo ,Cebu,2025-10-09 05:18:00,2025-10-09,05:18:00,197.28333333333333,3
07/10/2025 1:48,10.91,123.93,3,2.3,016 km S 18° W of City Of Bogo (Cebu), City Of Bogo ,Cebu,2025-10-07 01:48:00,2025-10-07,01:48:00,145.78333333333333,0
05/10/2025 4:42,11.05,124.12,32,1.5,015 km N 87° E of City Of Bogo (Cebu), City Of Bogo ,Cebu,2025-10-05 04:42:00,2025-10-05,04:42:00,100.68333333333334,3
30/10/2025 15:30,11.12,124.08,9,2.2,014 km N 52° E of City Of Bogo (Cebu), City Of Bogo ,Cebu,2025-10-30 15:30:00,2025-10-30,15:30:00,711.4833333333333,2
17/10/2025 1:27,11.18,124.03,5,2.4,016 km N 22° E of City Of Bogo (Cebu), City Of Bogo ,Cebu,2025-10-17 01:27:00,2025-10-17,01:27:00,385.43333333333334,1
05/10/2025 13:29,10.85,123.89,3,2.2,024 km S 25° W of City Of Bogo (Cebu), City Of Bogo ,Cebu,2025-10-05 13:29:00,2025-10-05,13:29:00,109.46666666666667,0
04/10/2025 22:46,11.06,124.06,8,2.3,009 km N 78° E of City Of Bogo (Cebu), City Of Bogo ,Cebu,2025-10-04 22:46:00,2025-10-04,22:46:00,94.75,1
02/10/2025 19:12,11.12,124.05,18,1.3,011 km N 46° E of City Of Bogo (Cebu), City Of Bogo ,Cebu,2025-10-02 19:12:00,2025-10-02,19:12:00,43.18333333333333,3
01/10/2025 14:59,11.09,124.2,27,2.1,025 km N 79° E of City Of Bogo (Cebu), City Of Bogo ,Cebu,2025-10-01 14:59:00,2025-10-01,14:59:00,14.966666666666667,3
17/10/2025 6:10,11.13,124.12,5,1.5,018 km N 60° E of City Of Bogo (Cebu), City Of Bogo ,Cebu,2025-10-17 06:10:00,2025-10-17,06:10:00,390.15,1
19/10/2025 9:23,11.05,124.1,9,1.8,014 km S 90° E of City Of Bogo (Cebu), City Of Bogo ,Cebu,2025-10-19 09:23:00,2025-10-19,09:23:00,441.3666666666667,2
05/10/2025 10:31,11.08,124.08,3,2.4,012 km N 70° E of City Of Bogo (Cebu), City Of Bogo ,Cebu,2025-10-05 10:31:00,2025-10-05,10:31:00,106.5,1
13/10/2025 9:35,11.18,124.09,30,2.6,019 km N 39° E of City Of Bogo (Cebu), City Of Bogo ,Cebu,2025-10-13 09:35:00,2025-10-13,09:35:00,297.56666666666666,3
30/10/2025 18:42,11.15,123.96,20,2.1,012 km N 09° W of City Of Bogo (Cebu), City Of Bogo ,Cebu,2025-10-30 18:42:00,2025-10-30,18:42:00,714.6833333333333,2
01/10/2025 14:38,11.12,124.06,14,1.5,012 km N 47° E of City Of Bogo (Cebu), City Of Bogo ,Cebu,2025-10-01 14:38:00,2025-10-01,14:38:00,14.616666666666667,1
06/10/2025 11:08,11.1,124.05,9,2.0,010 km N 54° E of City Of Bogo (Cebu), City Of Bogo ,Cebu,2025-10-06 11:08:00,2025-10-06,11:08:00,131.11666666666667,1
01/10/2025 22:09,11.18,124.16,17,1.4,024 km N 53° E of City Of Bogo (Cebu), City Of Bogo ,Cebu,2025-10-01 22:09:00,2025-10-01,22:09:00,22.133333333333333,1
14/10/2025 20:48,11.22,124.21,6,2.2,032 km N 52° E of City Of Bogo (Cebu), City Of Bogo ,Cebu,2025-10-14 20:48:00,2025-10-14,20:48:00,332.78333333333336,1
13/10/2025 10:14,11.05,124.06,2,2.2,009 km N 88° E of City Of Bogo (Cebu), City Of Bogo ,Cebu,2025-10-13 10:14:00,2025-10-13,10:14:00,298.21666666666664,1
12/10/2025 13:35,10.9,123.94,2,2.8,017 km S 16° W of City Of Bogo (Cebu), City Of Bogo ,Cebu,2025-10-12 13:35:00,2025-10-12,13:35:00,277.56666666666666,0
01/10/2025 9:38,10.97,123.94,4,1.4,009 km S 29° W of City Of Bogo (Cebu), City Of Bogo ,Cebu,2025-10-01 09:38:00,2025-10-01,09:38:00,9.616666666666667,0
07/10/2025 0:05,10.92,123.91,3,2.3,015 km S 28° W of City Of Bogo (Cebu), City Of Bogo ,Cebu,2025-10-07 00:05:00,2025-10-07,00:05:00,144.06666666666666,0
10/10/2025 21:52,11.0,124.06,33,2.4,011 km S 60° E of City Of Bogo (Cebu), City Of Bogo ,Cebu,2025-10-10 21:52:00,2025-10-10,21:52:00,237.85,3
07/10/2025 3:51,11.02,124.06,32,1.6,010 km S 75° E of City Of Bogo (Cebu), City Of Bogo ,Cebu,2025-10-07 03:51:00,2025-10-07,03:51:00,147.83333333333334,3
14/10/2025 14:31,11.12,124.07,31,1.8,013 km N 49° E of City Of Bogo (Cebu), City Of Bogo ,Cebu,2025-10-14 14:31:00,2025-10-14,14:31:00,326.5,3
22/10/2025 6:11,11.17,123.91,10,2.2,015 km N 28° W of City Of Bogo (Cebu), City Of Bogo ,Cebu,2025-10-22 06:11:00,2025-10-22,06:11:00,510.1666666666667,2
11/10/2025 9:35,11.16,124.01,33,1.3,013 km N 15° E of City Of Bogo (Cebu), City Of Bogo ,Cebu,2025-10-11 09:35:00,2025-10-11,09:35:00,249.56666666666666,3
08/10/2025 20:42,11.01,124.02,5,3.5,006 km S 42° E of City Of Bogo (Cebu), City Of Bogo ,Cebu,2025-10-08 20:42:00,2025-10-08,20:42:00,188.68333333333334,0
29/10/2025 19:21,11.22,124.12,13,2.3,025 km N 39° E of City Of Bogo (Cebu), City Of Bogo ,Cebu,2025-10-29 19:21:00,2025-10-29,19:21:00,691.3333333333334,2
01/10/2025 13:36,10.99,123.99,2,2.4,006 km S 09° E of City Of Bogo (Cebu), City Of Bogo ,Cebu,2025-10-01 13:36:00,2025-10-01,13:36:00,13.583333333333334,0
15/10/2025 15:58,11.11,124.12,7,4.1,017 km N 65° E of City Of Bogo (Cebu), City Of Bogo ,Cebu,2025-10-15 15:58:00,2025-10-15,15:58:00,351.95,1
01/10/2025 14:30,11.22,124.15,32,2.5,027 km N 43° E of City Of Bogo (Cebu), City Of Bogo ,Cebu,2025-10-01 14:30:00,2025-10-01,14:30:00,14.483333333333333,3
07/10/2025 5:12,11.16,123.99,34,1.9,012 km N 04° E of City Of Bogo (Cebu), City Of Bogo ,Cebu,2025-10-07 05:12:00,2025-10-07,05:12:00,149.18333333333334,3
10/10/2025 14:47,11.14,124.05,30,2.5,012 km N 37° E of City Of Bogo (Cebu), City Of Bogo ,Cebu,2025-10-10 14:47:00,2025-10-10,14:47:00,230.76666666666668,3
15/10/2025 22:36,10.94,124.04,31,1.6,013 km S 29° E of City Of Bogo (Cebu), City Of Bogo ,Cebu,2025-10-15 22:36:00,2025-10-15,22:36:00,358.5833333333333,3
08/10/2025 4:47,10.99,123.99,5,2.1,007 km S 14° E of City Of Bogo (Cebu), City Of Bogo ,Cebu,2025-10-08 04:47:00,2025-10-08,04:47:00,172.76666666666668,0
10/10/2025 2:15,10.96,123.91,8,1.9,012 km S 38° W of City Of Bogo (Cebu), City Of Bogo ,Cebu,2025-10-10 02:15:00,2025-10-10,02:15:00,218.23333333333332,0
27/10/2025 17:03,11.01,123.96,1,2.7,005 km S 31° W of City Of Bogo (Cebu), City Of Bogo ,Cebu,2025-10-27 17:03:00,2025-10-27,17:03:00,641.0333333333333,2
07/10/2025 11:33,11.11,123.97,9,2.6,007 km N 10° W of City Of Bogo (Cebu), City Of Bogo ,Cebu,2025-10-07 11:33:00,2025-10-07,11:33:00,155.53333333333333,1
19/10/2025 21:17,11.05,123.94,27,1.8,004 km N 79° W of City Of Bogo (Cebu), City Of Bogo ,Cebu,2025-10-19 21:17:00,2025-10-19,21:17:00,453.26666666666665,2
07/10/2025 7:11,11.09,124.02,1,2.2,007 km N 41° E of City Of Bogo (Cebu), City Of Bogo ,Cebu,2025-10-07 07:11:00,2025-10-07,07:11:00,151.16666666666666,1
12/10/2025 22:28,11.13,124.11,33,2.0,017 km N 57° E of City Of Bogo (Cebu), City Of Bogo ,Cebu,2025-10-12 22:28:00,2025-10-12,22:28:00,286.45,3
03/10/2025 12:07,10.99,123.98,7,2.7,006 km S 04° E of City Of Bogo (Cebu), City Of Bogo ,Cebu,2025-10-03 12:07:00,2025-10-03,12:07:00,60.1,0
14/10/2025 18:28,11.1,124.04,17,1.6,009 km N 47° E of City Of Bogo (Cebu), City Of Bogo ,Cebu,2025-10-14 18:28:00,2025-10-14,18:28:00,330.45,3
03/10/2025 1:42,11.16,124.11,33,1.7,020 km N 49° E of City Of Bogo (Cebu), City Of Bogo ,Cebu,2025-10-03 01:42:00,2025-10-03,01:42:00,49.68333333333333,3
09/10/2025 2:42,11.17,124.04,17,1.7,015 km N 27° E of City Of Bogo (Cebu), City Of Bogo ,Cebu,2025-10-09 02:42:00,2025-10-09,02:42:00,194.68333333333334,3
01/10/2025 3:15,10.95,123.96,4,2.2,011 km S 11° W of City Of Bogo (Cebu), City Of Bogo ,Cebu,2025-10-01 03:15:00,2025-10-01,03:15:00,3.2333333333333334,0
04/10/2025 18:28,10.99,124.02,10,2.7,008 km S 34° E of City Of Bogo (Cebu), City Of Bogo ,Cebu,2025-10-04 18:28:00,2025-10-04,18:28:00,90.45,0
24/10/2025 14:43,11.11,124.05,22,2.4,011 km N 50° E of City Of Bogo (Cebu), City Of Bogo ,Cebu,2025-10-24 14:43:00,2025-10-24,14:43:00,566.7,2
08/10/2025 10:48,11.27,124.03,34,1.6,026 km N 13° E of City Of Bogo (Cebu), City Of Bogo ,Cebu,2025-10-08 10:48:00,2025-10-08,10:48:00,178.78333333333333,3
16/10/2025 4:59,11.04,124.15,4,1.9,018 km S 89° E of City Of Bogo (Cebu), City Of Bogo ,Cebu,2025-10-16 04:59:00,2025-10-16,04:59:00,364.96666666666664,1
04/10/2025 21:19,11.0,123.91,8,2.7,009 km S 54° W of City Of Bogo (Cebu), City Of Bogo ,Cebu,2025-10-04 21:19:00,2025-10-04,21:19:00,93.3,0
17/10/2025 2:54,11.13,123.95,14,1.7,010 km N 20° W of City Of Bogo (Cebu), City Of Bogo ,Cebu,2025-10-17 02:54:00,2025-10-17,02:54:00,386.8833333333333,2
13/10/2025 1:58,11.0,123.92,9,3.0,008 km S 55° W of City Of Bogo (Cebu), City Of Bogo ,Cebu,2025-10-13 01:58:00,2025-10-13,01:58:00,289.95,0
15/10/2025 4:19,10.96,123.98,29,2.3,009 km S 03° W of City Of Bogo (Cebu), City Of Bogo ,Cebu,2025-10-15 04:19:00,2025-10-15,04:19:00,340.3,3
01/10/2025 8:33,10.96,124.0,5,3.0,009 km S 11° E of City Of Bogo (Cebu), City Of Bogo ,Cebu,2025-10-01 08:33:00,2025-10-01,08:33:00,8.533333333333333,0
22/10/2025 11:52,11.12,123.94,5,2.6,009 km N 30° W of City Of Bogo (Cebu), City Of Bogo ,Cebu,2025-10-22 11:52:00,2025-10-22,11:52:00,515.85,2
13/10/2025 3:49,11.0,123.95,7,4.0,006 km S 30° W of City Of Bogo (Cebu), City Of Bogo ,Cebu,2025-10-13 03:49:00,2025-10-13,03:49:00,291.8,0
25/10/2025 0:34,10.99,124.03,5,3.7,008 km S 37° E of City Of Bogo (Cebu), City Of Bogo ,Cebu,2025-10-25 00:34:00,2025-10-25,00:34:00,576.55,2
02/10/2025 18:19,11.05,124.04,32,2.1,007 km N 87° E of City Of Bogo (Cebu), City Of Bogo ,Cebu,2025-10-02 18:19:00,2025-10-02,18:19:00,42.3,3
08/10/2025 22:59,11.26,123.96,34,1.1,024 km N 05° W of City Of Bogo (Cebu), City Of Bogo ,Cebu,2025-10-08 22:59:00,2025-10-08,22:59:00,190.96666666666667,3
02/10/2025 12:29,11.08,124.12,9,2.0,016 km N 75° E of City Of Bogo (Cebu), City Of Bogo ,Cebu,2025-10-02 12:29:00,2025-10-02,12:29:00,36.46666666666667,1
13/10/2025 6:23,11.19,124.2,33,2.5,029 km N 57° E of City Of Bogo (Cebu), City Of Bogo ,Cebu,2025-10-13 06:23:00,2025-10-13,06:23:00,294.3666666666667,3
06/10/2025 9:19,11.17,123.99,30,2.1,014 km N 06° E of City Of Bogo (Cebu), City Of Bogo ,Cebu,2025-10-06 09:19:00,2025-10-06,09:19:00,129.3,3
06/10/2025 18:49,11.14,124.07,28,1.9,014 km N 44° E of City Of Bogo (Cebu), City Of Bogo ,Cebu,2025-10-06 18:49:00,2025-10-06,18:49:00,138.8,3
02/10/2025 22:49,11.11,123.98,5,3.0,007 km N 02° E of City Of Bogo (Cebu), City Of Bogo ,Cebu,2025-10-02 22:49:00,2025-10-02,22:49:00,46.8,0
02/10/2025 12:22,10.95,123.99,1,2.3,011 km S 08° E of City Of Bogo (Cebu), City Of Bogo ,Cebu,2025-10-02 12:22:00,2025-10-02,12:22:00,36.35,0
27/10/2025 17:03,11.01,123.99,1,2.8,004 km S 10° E of City Of Bogo (Cebu), City Of Bogo ,Cebu,2025-10-27 17:03:00,2025-10-27,17:03:00,641.0333333333333,2
02/10/2025 0:22,11.13,124.17,4,2.4,023 km N 66° E of City Of Bogo (Cebu), City Of Bogo ,Cebu,2025-10-02 00:22:00,2025-10-02,00:22:00,24.35,1
01/10/2025 7:31,11.17,124.02,32,1.9,014 km N 19° E of City Of Bogo (Cebu), City Of Bogo ,Cebu,2025-10-01 07:31:00,2025-10-01,07:31:00,7.5,3
15/10/2025 13:21,11.06,124.0,21,1.7,003 km N 51° E of City Of Bogo (Cebu), City Of Bogo ,Cebu,2025-10-15 13:21:00,2025-10-15,13:21:00,349.3333333333333,3
18/10/2025 2:59,10.95,123.93,8,2.3,012 km S 27° W of City Of Bogo (Cebu), City Of Bogo ,Cebu,2025-10-18 02:59:00,2025-10-18,02:59:00,410.96666666666664,0
03/10/2025 10:50,10.98,123.98,7,1.9,007 km S 02° W of City Of Bogo (Cebu), City Of Bogo ,Cebu,2025-10-03 10:50:00,2025-10-03,10:50:00,58.81666666666667,0
14/10/2025 2:29,11.15,124.1,32,2.0,018 km N 48° E of City Of Bogo (Cebu), City Of Bogo ,Cebu,2025-10-14 02:29:00,2025-10-14,02:29:00,314.46666666666664,3
04/10/2025 20:11,11.17,123.96,9,2.1,014 km N 09° W of City Of Bogo (Cebu), City Of Bogo ,Cebu,2025-10-04 20:11:00,2025-10-04,20:11:00,92.16666666666667,1
08/10/2025 3:11,11.11,123.93,2,2.8,009 km N 41° W of City Of Bogo (Cebu), City Of Bogo ,Cebu,2025-10-08 03:11:00,2025-10-08,03:11:00,171.16666666666666,0
01/10/2025 12:18,10.95,123.71,16,1.3,031 km S 70° W of City Of Bogo (Cebu), City Of Bogo ,Cebu,2025-10-01 12:18:00,2025-10-01,12:18:00,12.283333333333333,0
03/10/2025 14:20,11.16,124.0,6,2.3,013 km N 10° E of City Of Bogo (Cebu), City Of Bogo ,Cebu,2025-10-03 14:20:00,2025-10-03,14:20:00,62.31666666666667,1
06/10/2025 10:23,10.98,124.1,5,1.8,015 km S 62° E of City Of Bogo (Cebu), City Of Bogo ,Cebu,2025-10-06 10:23:00,2025-10-06,10:23:00,130.36666666666667,1
13/10/2025 18:28,11.01,124.01,6,1.8,005 km S 39° E of City Of Bogo (Cebu), City Of Bogo ,Cebu,2025-10-13 18:28:00,2025-10-13,18:28:00,306.45,2
12/10/2025 4:07,11.09,124.01,22,2.2,006 km N 36° E of City Of Bogo (Cebu), City Of Bogo ,Cebu,2025-10-12 04:07:00,2025-10-12,04:07:00,268.1,3
04/10/2025 8:06,11.11,124.09,12,2.4,014 km N 61° E of City Of Bogo (Cebu), City Of Bogo ,Cebu,2025-10-04 08:06:00,2025-10-04,08:06:00,80.08333333333333,1
02/10/2025 20:45,11.11,123.94,5,2.9,008 km N 35° W of City Of Bogo (Cebu), City Of Bogo ,Cebu,2025-10-02 20:45:00,2025-10-02,20:45:00,44.733333333333334,0
05/10/2025 18:59,11.13,124.11,2,2.0,017 km N 56° E of City Of Bogo (Cebu), City Of Bogo ,Cebu,2025-10-05 18:59:00,2025-10-05,18:59:00,114.96666666666667,1
07/10/2025 19:51,11.05,124.03,24,1.4,005 km N 87° E of City Of Bogo (Cebu), City Of Bogo ,Cebu,2025-10-07 19:51:00,2025-10-07,19:51:00,163.83333333333334,3
04/10/2025 8:26,11.11,124.04,25,1.7,013 km N 43° E of City Of Bogo (Cebu), City Of Bogo ,Cebu,2025-10-04 08:26:00,2025-10-04,08:26:00,80.41666666666667,3
26/10/2025 4:51,11.01,123.95,28,2.1,005 km S 33° W of City Of Bogo (Cebu), City Of Bogo ,Cebu,2025-10-26 04:51:00,2025-10-26,04:51:00,604.8333333333334,2
01/10/2025 19:58,10.9,124.07,28,2.6,018 km S 32° E of City Of Bogo (Cebu), City Of Bogo ,Cebu,2025-10-01 19:58:00,2025-10-01,19:58:00,19.95,3
05/10/2025 0:44,10.9,123.93,2,3.3,018 km S 18° W of City Of Bogo (Cebu), City Of Bogo ,Cebu,2025-10-05 00:44:00,2025-10-05,00:44:00,96.71666666666667,0
13/10/2025 19:27,11.03,123.97,3,2.5,002 km S 15° W of City Of Bogo (Cebu), City Of Bogo ,Cebu,2025-10-13 19:27:00,2025-10-13,19:27:00,307.43333333333334,0
04/10/2025 19:13,11.0,124.01,6,3.0,006 km S 37° E of City Of Bogo (Cebu), City Of Bogo ,Cebu,2025-10-04 19:13:00,2025-10-04,19:13:00,91.2,0
01/10/2025 12:05,11.01,124.04,1,2.5,008 km S 56° E of City Of Bogo (Cebu), City Of Bogo ,Cebu,2025-10-01 12:05:00,2025-10-01,12:05:00,12.066666666666666,0
02/10/2025 12:29,11.04,124.09,9,2.1,012 km S 86° E of City Of Bogo (Cebu), City Of Bogo ,Cebu,2025-10-02 12:29:00,2025-10-02,12:29:00,36.46666666666667,1
01/10/2025 22:01,10.98,123.95,26,1.5,008 km S 20° W of City Of Bogo (Cebu), City Of Bogo ,Cebu,2025-10-01 22:01:00,2025-10-01,22:01:00,22.0,3
03/10/2025 19:17,11.09,124.06,3,3.8,010 km N 60° E of City Of Bogo (Cebu), City Of Bogo ,Cebu,2025-10-03 19:17:00,2025-10-03,19:17:00,67.26666666666667,1
01/10/2025 7:11,11.15,123.89,31,1.6,015 km N 39° W of City Of Bogo (Cebu), City Of Bogo ,Cebu,2025-10-01 07:11:00,2025-10-01,07:11:00,7.166666666666667,3
09/10/2025 23:11,11.04,123.85,26,2.0,014 km S 86° W of City Of Bogo (Cebu), City Of Bogo ,Cebu,2025-10-09 23:11:00,2025-10-09,23:11:00,215.16666666666666,3
08/10/2025 8:29,10.9,123.86,1,1.7,021 km S 38° W of City Of Bogo (Cebu), City Of Bogo ,Cebu,2025-10-08 08:29:00,2025-10-08,08:29:00,176.46666666666667,0
04/10/2025 0:03,11.16,124.07,33,1.6,016 km N 37° E of City Of Bogo (Cebu), City Of Bogo ,Cebu,2025-10-04 00:03:00,2025-10-04,00:03:00,72.03333333333333,3
03/10/2025 16:25,11.14,124.12,8,2.0,019 km N 55° E of City Of Bogo (Cebu), City Of Bogo ,Cebu,2025-10-03 16:25:00,2025-10-03,16:25:00,64.4,1
06/10/2025 9:19,10.98,123.92,4,2.1,010 km S 41° W of City Of Bogo (Cebu), City Of Bogo ,Cebu,2025-10-06 09:19:00,2025-10-06,09:19:00,129.3,0
18/10/2025 23:30,10.98,123.94,6,3.1,009 km S 32° W of City Of Bogo (Cebu), City Of Bogo ,Cebu,2025-10-18 23:30:00,2025-10-18,23:30:00,431.48333333333335,0
04/10/2025 7:23,11.12,124.06,26,2.5,012 km N 47° E of City Of Bogo (Cebu), City Of Bogo ,Cebu,2025-10-04 07:23:00,2025-10-04,07:23:00,79.36666666666666,3
07/10/2025 14:21,11.15,124.03,28,2.1,013 km N 29° E of City Of Bogo (Cebu), City Of Bogo ,Cebu,2025-10-07 14:21:00,2025-10-07,14:21:00,158.33333333333334,3
24/10/2025 2:06,11.16,124.16,6,2.3,023 km N 58° E of City Of Bogo (Cebu), City Of Bogo ,Cebu,2025-10-24 02:06:00,2025-10-24,02:06:00,554.0833333333334,2
19/10/2025 15:01,11.12,124.01,28,1.9,009 km N 23° E of City Of Bogo (Cebu), City Of Bogo ,Cebu,2025-10-19 15:01:00,2025-10-19,15:01:00,447.0,3
05/10/2025 7:27,11.09,124.08,33,1.8,012 km N 67° E of City Of Bogo (Cebu), City Of Bogo ,Cebu,2025-10-05 07:27:00,2025-10-05,07:27:00,103.43333333333334,3
28/10/2025 21:49,11.15,124.02,31,2.4,012 km N 21° E of City Of Bogo (Cebu), City Of Bogo ,Cebu,2025-10-28 21:49:00,2025-10-28,21:49:00,669.8,2
07/10/2025 17:11,11.15,124.0,33,2.0,012 km N 09° E of City Of Bogo (Cebu), City Of Bogo ,Cebu,2025-10-07 17:11:00,2025-10-07,17:11:00,161.16666666666666,3
16/10/2025 6:16,10.89,123.96,4,2.4,018 km S 08° W of City Of Bogo (Cebu), City Of Bogo ,Cebu,2025-10-16 06:16:00,2025-10-16,06:16:00,366.25,0
03/10/2025 22:22,11.12,123.95,3,3.7,008 km N 20° W of City Of Bogo (Cebu), City Of Bogo ,Cebu,2025-10-03 22:22:00,2025-10-03,22:22:00,70.35,0
14/10/2025 6:10,11.12,124.03,29,1.8,010 km N 33° E of City Of Bogo (Cebu), City Of Bogo ,Cebu,2025-10-14 06:10:00,2025-10-14,06:10:00,318.15,3
08/10/2025 6:20,11.09,124.05,16,2.0,010 km N 58° E of City Of Bogo (Cebu), City Of Bogo ,Cebu,2025-10-08 06:20:00,2025-10-08,06:20:00,174.31666666666666,1
04/10/2025 15:52,10.95,124.06,33,1.7,013 km S 40° E of City Of Bogo (Cebu), City Of Bogo ,Cebu,2025-10-04 15:52:00,2025-10-04,15:52:00,87.85,3
07/10/2025 4:44,11.06,123.63,6,2.4,038 km N 88° W of City Of Bogo (Cebu), City Of Bogo ,Cebu,2025-10-07 04:44:00,2025-10-07,04:44:00,148.71666666666667,0
01/10/2025 8:58,11.06,123.89,32,2.1,010 km N 81° W of City Of Bogo (Cebu), City Of Bogo ,Cebu,2025-10-01 08:58:00,2025-10-01,08:58:00,8.95,3
01/10/2025 0:06,10.95,123.89,2,2.0,014 km S 42° W of City Of Bogo (Cebu), City Of Bogo ,Cebu,2025-10-01 00:06:00,2025-10-01,00:06:00,0.08333333333333333,0
07/10/2025 10:56,11.01,123.96,3,2.3,005 km S 30° W of City Of Bogo (Cebu), City Of Bogo ,Cebu,2025-10-07 10:56:00,2025-10-07,10:56:00,154.91666666666666,0
03/10/2025 23:37,11.1,124.07,7,2.8,011 km N 58° E of City Of Bogo (Cebu), City Of Bogo ,Cebu,2025-10-03 23:37:00,2025-10-03,23:37:00,71.6,1
03/10/2025 12:18,11.12,124.14,8,2.0,019 km N 64° E of City Of Bogo (Cebu), City Of Bogo ,Cebu,2025-10-03 12:18:00,2025-10-03,12:18:00,60.28333333333333,1
01/10/2025 3:41,11.17,124.12,34,2.5,021 km N 47° E of City Of Bogo (Cebu), City Of Bogo ,Cebu,2025-10-01 03:41:00,2025-10-01,03:41:00,3.6666666666666665,3
13/10/2025 18:01,11.14,124.16,5,1.9,022 km N 62° E of City Of Bogo (Cebu), City Of Bogo ,Cebu,2025-10-13 18:01:00,2025-10-13,18:01:00,306.0,1
03/10/2025 7:13,11.06,124.06,32,1.4,009 km N 77° E of City Of Bogo (Cebu), City Of Bogo ,Cebu,2025-10-03 07:13:00,2025-10-03,07:13:00,55.2,3
07/10/2025 4:56,11.12,124.01,20,1.6,009 km N 24° E of City Of Bogo (Cebu), City Of Bogo ,Cebu,2025-10-07 04:56:00,2025-10-07,04:56:00,148.91666666666666,3
03/10/2025 1:54,11.13,124.01,25,1.2,009 km N 19° E of City Of Bogo (Cebu), City Of Bogo ,Cebu,2025-10-03 01:54:00,2025-10-03,01:54:00,49.88333333333333,3
02/10/2025 22:26,10.98,124.02,31,2.4,008 km S 34° E of City Of Bogo (Cebu), City Of Bogo ,Cebu,2025-10-02 22:26:00,2025-10-02,22:26:00,46.416666666666664,3
04/10/2025 10:36,10.84,124.17,33,2.0,030 km S 42° E of City Of Bogo (Cebu), City Of Bogo ,Cebu,2025-10-04 10:36:00,2025-10-04,10:36:00,82.58333333333333,3
14/10/2025 23:22,11.11,124.02,34,2.1,008 km N 32° E of City Of Bogo (Cebu), City Of Bogo ,Cebu,2025-10-14 23:22:00,2025-10-14,23:22:00,335.35,3
26/10/2025 22:02,11.1,124.04,5,1.6,009 km N 46° E of City Of Bogo (Cebu), City Of Bogo ,Cebu,2025-10-26 22:02:00,2025-10-26,22:02:00,622.0166666666667,2
02/10/2025 23:26,11.11,124.03,18,2.1,009 km N 42° E of City Of Bogo (Cebu), City Of Bogo ,Cebu,2025-10-02 23:26:00,2025-10-02,23:26:00,47.416666666666664,1
05/10/2025 0:43,11.13,123.96,5,1.5,010 km N 15° W of City Of Bogo (Cebu), City Of Bogo ,Cebu,2025-10-05 00:43:00,2025-10-05,00:43:00,96.7,1
09/10/2025 4:20,11.07,124.07,32,2.1,010 km N 76° E of City Of Bogo (Cebu), City Of Bogo ,Cebu,2025-10-09 04:20:00,2025-10-09,04:20:00,196.31666666666666,3
04/10/2025 1:07,10.97,123.9,10,2.3,012 km S 44° W of City Of Bogo (Cebu), City Of Bogo ,Cebu,2025-10-04 01:07:00,2025-10-04,01:07:00,73.1,0
01/10/2025 10:44,11.08,124.28,32,1.6,033 km N 83° E of City Of Bogo (Cebu), City Of Bogo ,Cebu,2025-10-01 10:44:00,2025-10-01,10:44:00,10.716666666666667,3
03/10/2025 23:40,10.85,123.78,10,2.1,031 km S 46° W of City Of Bogo (Cebu), City Of Bogo ,Cebu,2025-10-03 23:40:00,2025-10-03,23:40:00,71.65,0
02/10/2025 8:54,11.0,124.05,5,3.4,009 km S 58° E of City Of Bogo (Cebu), City Of Bogo ,Cebu,2025-10-02 08:54:00,2025-10-02,08:54:00,32.88333333333333,0
02/10/2025 20:23,10.87,123.9,1,1.8,021 km S 24° W of City Of Bogo (Cebu), City Of Bogo ,Cebu,2025-10-02 20:23:00,2025-10-02,20:23:00,44.36666666666667,0
01/10/2025 7:59,11.14,124.1,34,2.0,017 km N 50° E of City Of Bogo (Cebu), City Of Bogo ,Cebu,2025-10-01 07:59:00,2025-10-01,07:59:00,7.966666666666667,3
04/10/2025 3:17,11.16,124.0,20,1.6,013 km N 12° E of City Of Bogo (Cebu), City Of Bogo ,Cebu,2025-10-04 03:17:00,2025-10-04,03:17:00,75.26666666666667,3
03/10/2025 22:17,10.99,123.96,7,2.7,006 km S 18° W of City Of Bogo (Cebu), City Of Bogo ,Cebu,2025-10-03 22:17:00,2025-10-03,22:17:00,70.26666666666667,0
03/10/2025 20:53,11.09,124.08,4,1.6,012 km N 65° E of City Of Bogo (Cebu), City Of Bogo ,Cebu,2025-10-03 20:53:00,2025-10-03,20:53:00,68.86666666666666,1
17/10/2025 3:56,11.14,124.21,9,3.4,027 km N 69° E of City Of Bogo (Cebu), City Of Bogo ,Cebu,2025-10-17 03:56:00,2025-10-17,03:56:00,387.9166666666667,1
04/10/2025 0:09,10.97,124.07,28,2.0,013 km S 49° E of City Of Bogo (Cebu), City Of Bogo ,Cebu,2025-10-04 00:09:00,2025-10-04,00:09:00,72.13333333333334,3
04/10/2025 0:59,11.02,123.95,5,2.8,005 km S 46° W of City Of Bogo (Cebu), City Of Bogo ,Cebu,2025-10-04 00:59:00,2025-10-04,00:59:00,72.96666666666667,0
20/10/2025 16:06,11.19,124.05,4,2.4,017 km N 27° E of City Of Bogo (Cebu), City Of Bogo ,Cebu,2025-10-20 16:06:00,2025-10-20,16:06:00,472.0833333333333,2
06/10/2025 9:17,11.06,124.08,32,1.6,011 km N 82° E of City Of Bogo (Cebu), City Of Bogo ,Cebu,2025-10-06 09:17:00,2025-10-06,09:17:00,129.26666666666668,3
25/10/2025 19:02,11.07,123.96,11,2.3,003 km N 34° W of City Of Bogo (Cebu), City Of Bogo ,Cebu,2025-10-25 19:02:00,2025-10-25,19:02:00,595.0166666666667,2
02/10/2025 19:56,11.1,124.12,8,2.7,017 km N 68° E of City Of Bogo (Cebu), City Of Bogo ,Cebu,2025-10-02 19:56:00,2025-10-02,19:56:00,43.916666666666664,1
02/10/2025 0:16,11.18,124.03,22,1.6,015 km N 21° E of City Of Bogo (Cebu), City Of Bogo ,Cebu,2025-10-02 00:16:00,2025-10-02,00:16:00,24.25,3
10/10/2025 23:41,11.22,124.15,36,1.3,026 km N 44° E of City Of Bogo (Cebu), City Of Bogo ,Cebu,2025-10-10 23:41:00,2025-10-10,23:41:00,239.66666666666666,3
06/10/2025 2:57,10.94,123.78,4,2.3,024 km S 62° W of City Of Bogo (Cebu), City Of Bogo ,Cebu,2025-10-06 02:57:00,2025-10-06,02:57:00,122.93333333333334,0
02/10/2025 22:11,11.09,124.11,7,1.5,010 km S 68° E of City Of Bogo (Cebu), City Of Bogo ,Cebu,2025-10-02 22:11:00,2025-10-02,22:11:00,46.166666666666664,1
07/10/2025 4:37,11.14,124.08,23,1.2,015 km N 48° E of City Of Bogo (Cebu), City Of Bogo ,Cebu,2025-10-07 04:37:00,2025-10-07,04:37:00,148.6,3
11/10/2025 23:51,11.16,124.15,10,3.0,023 km N 56° E of City Of Bogo (Cebu), City Of Bogo ,Cebu,2025-10-11 23:51:00,2025-10-11,23:51:00,263.8333333333333,1
01/10/2025 4:27,10.93,123.97,7,3.6,013 km S 03° W of City Of Bogo (Cebu), City Of Bogo ,Cebu,2025-10-01 04:27:00,2025-10-01,04:27:00,4.433333333333334,0
02/10/2025 11:05,10.99,123.96,5,2.9,007 km S 22° W of City Of Bogo (Cebu), City Of Bogo ,Cebu,2025-10-02 11:05:00,2025-10-02,11:05:00,35.06666666666667,0
13/10/2025 19:35,10.85,123.96,1,3.2,022 km S 07° W of City Of Bogo (Cebu), City Of Bogo ,Cebu,2025-10-13 19:35:00,2025-10-13,19:35:00,307.56666666666666,0
22/10/2025 6:45,10.86,123.87,3,2.5,024 km S 29° W of City Of Bogo (Cebu), City Of Bogo ,Cebu,2025-10-22 06:45:00,2025-10-22,06:45:00,510.73333333333335,0
05/10/2025 13:43,11.05,124.0,29,2.0,002 km N 70° E of City Of Bogo (Cebu), City Of Bogo ,Cebu,2025-10-05 13:43:00,2025-10-05,13:43:00,109.7,3
09/10/2025 4:42,11.06,124.05,4,2.0,008 km N 81° E of City Of Bogo (Cebu), City Of Bogo ,Cebu,2025-10-09 04:42:00,2025-10-09,04:42:00,196.68333333333334,1
10/10/2025 9:18,11.16,124.03,33,1.3,014 km N 25° E of City Of Bogo (Cebu), City Of Bogo ,Cebu,2025-10-10 09:18:00,2025-10-10,09:18:00,225.28333333333333,3
04/10/2025 2:42,11.07,124.23,12,2.1,028 km N 80° E of City Of Bogo (Cebu), City Of Bogo ,Cebu,2025-10-04 02:42:00,2025-10-04,02:42:00,74.68333333333334,1
01/10/2025 3:50,11.1,124.1,9,3.1,015 km N 68° E of City Of Bogo (Cebu), City Of Bogo ,Cebu,2025-10-01 03:50:00,2025-10-01,03:50:00,3.816666666666667,1
12/10/2025 11:16,11.3,123.86,13,2.9,031 km N 24° W of City Of Bogo (Cebu), City Of Bogo ,Cebu,2025-10-12 11:16:00,2025-10-12,11:16:00,275.25,1
04/10/2025 3:06,11.17,124.07,32,1.9,017 km N 35° E of City Of Bogo (Cebu), City Of Bogo ,Cebu,2025-10-04 03:06:00,2025-10-04,03:06:00,75.08333333333333,3
01/10/2025 11:03,10.99,123.94,13,2.4,008 km S 32° W of City Of Bogo (Cebu), City Of Bogo ,Cebu,2025-10-01 11:03:00,2025-10-01,11:03:00,11.033333333333333,0
01/10/2025 11:02,11.16,124.19,4,2.4,026 km N 61° E of City Of Bogo (Cebu), City Of Bogo ,Cebu,2025-10-01 11:02:00,2025-10-01,11:02:00,11.016666666666667,1
05/10/2025 3:29,10.87,124.11,26,2.2,025 km S 36° E of City Of Bogo (Cebu), City Of Bogo ,Cebu,2025-10-05 03:29:00,2025-10-05,03:29:00,99.46666666666667,3
20/10/2025 20:08,11.28,124.15,12,2.2,032 km N 35° E of City Of Bogo (Cebu), City Of Bogo ,Cebu,2025-10-20 20:08:00,2025-10-20,20:08:00,476.1166666666667,1
02/10/2025 16:31,11.16,124.08,28,2.2,017 km N 42° E of City Of Bogo (Cebu), City Of Bogo ,Cebu,2025-10-02 16:31:00,2025-10-02,16:31:00,40.5,3
10/10/2025 1:57,11.18,123.97,13,2.1,015 km N 04° W of City Of Bogo (Cebu), City Of Bogo ,Cebu,2025-10-10 01:57:00,2025-10-10,01:57:00,217.93333333333334,1
23/10/2025 9:22,10.92,123.96,7,2.7,015 km S 09° W of City Of Bogo (Cebu), City Of Bogo ,Cebu,2025-10-23 09:22:00,2025-10-23,09:22:00,537.35,2
19/10/2025 7:09,11.17,124.2,9,2.8,027 km N 61° E of City Of Bogo (Cebu), City Of Bogo ,Cebu,2025-10-19 07:09:00,2025-10-19,07:09:00,439.1333333333333,1
10/10/2025 4:12,11.1,124.07,9,1.7,012 km N 59° E of City Of Bogo (Cebu), City Of Bogo ,Cebu,2025-10-10 04:12:00,2025-10-10,04:12:00,220.18333333333334,1
13/10/2025 2:24,10.96,123.93,8,3.4,010 km S 28° W of City Of Bogo (Cebu), City Of Bogo ,Cebu,2025-10-13 02:24:00,2025-10-13,02:24:00,290.3833333333333,0
14/10/2025 22:14,11.02,124.01,11,2.3,004 km S 49° E of City Of Bogo (Cebu), City Of Bogo ,Cebu,2025-10-14 22:14:00,2025-10-14,22:14:00,334.21666666666664,2
01/10/2025 3:16,11.08,123.98,34,2.2,003 km North of City Of Bogo (Cebu), City Of Bogo ,Cebu,2025-10-01 03:16:00,2025-10-01,03:16:00,3.25,3
02/10/2025 11:11,11.08,124.12,31,2.1,015 km N 77° E of City Of Bogo (Cebu), City Of Bogo ,Cebu,2025-10-02 11:11:00,2025-10-02,11:11:00,35.166666666666664,3
04/10/2025 3:26,11.19,124.06,10,1.9,018 km N 31° E of City Of Bogo (Cebu), City Of Bogo ,Cebu,2025-10-04 03:26:00,2025-10-04,03:26:00,75.41666666666667,1
13/10/2025 1:06,10.96,123.94,5,5.8,010 km S 24° W of City Of Bogo (Cebu), City Of Bogo ,Cebu,2025-10-13 01:06:00,2025-10-13,01:06:00,289.0833333333333,0
06/10/2025 10:49,10.99,124.03,13,1.7,008 km S 41° E of City Of Bogo (Cebu), City Of Bogo ,Cebu,2025-10-06 10:49:00,2025-10-06,10:49:00,130.8,3
01/10/2025 10:10,11.08,124.05,3,3.2,008 km N 65° E of City Of Bogo (Cebu), City Of Bogo ,Cebu,2025-10-01 10:10:00,2025-10-01,10:10:00,10.15,1
15/10/2025 7:25,11.08,124.01,19,2.5,005 km N 46° E of City Of Bogo (Cebu), City Of Bogo ,Cebu,2025-10-15 07:25:00,2025-10-15,07:25:00,343.4,2
14/10/2025 19:11,10.92,123.94,5,2.9,015 km S 18° W of City Of Bogo (Cebu), City Of Bogo ,Cebu,2025-10-14 19:11:00,2025-10-14,19:11:00,331.1666666666667,0
14/10/2025 12:31,11.06,124.03,33,2.1,006 km N 76° E of City Of Bogo (Cebu), City Of Bogo ,Cebu,2025-10-14 12:31:00,2025-10-14,12:31:00,324.5,3
23/10/2025 7:25,10.89,123.97,4,2.3,017 km S 05° W of City Of Bogo (Cebu), City Of Bogo ,Cebu,2025-10-23 07:25:00,2025-10-23,07:25:00,535.4,2
05/10/2025 15:19,11.12,124.08,5,2.3,013 km N 55° E of City Of Bogo (Cebu), City Of Bogo ,Cebu,2025-10-05 15:19:00,2025-10-05,15:19:00,111.3,1
04/10/2025 2:02,10.95,123.96,5,2.9,011 km S 16° W of City Of Bogo (Cebu), City Of Bogo ,Cebu,2025-10-04 02:02:00,2025-10-04,02:02:00,74.01666666666667,0
04/10/2025 12:47,11.11,124.12,9,1.9,017 km N 66° E of City Of Bogo (Cebu), City Of Bogo ,Cebu,2025-10-04 12:47:00,2025-10-04,12:47:00,84.76666666666667,1
18/10/2025 4:32,11.11,124.08,31,1.7,013 km N 56° E of City Of Bogo (Cebu), City Of Bogo ,Cebu,2025-10-18 04:32:00,2025-10-18,04:32:00,412.51666666666665,3
26/10/2025 19:40,11.23,124.15,9,1.4,027 km N 43° E of City Of Bogo (Cebu), City Of Bogo ,Cebu,2025-10-26 19:40:00,2025-10-26,19:40:00,619.65,2
29/10/2025 20:51,11.11,124.16,7,1.5,020 km N 70° E of City Of Bogo (Cebu), City Of Bogo ,Cebu,2025-10-29 20:51:00,2025-10-29,20:51:00,692.8333333333334,2
14/10/2025 8:44,10.86,123.96,1,3.9,021 km S 05° W of City Of Bogo (Cebu), City Of Bogo ,Cebu,2025-10-14 08:44:00,2025-10-14,08:44:00,320.71666666666664,0
25/10/2025 23:10,11.15,123.97,29,2.0,011 km N 05° W of City Of Bogo (Cebu), City Of Bogo ,Cebu,2025-10-25 23:10:00,2025-10-25,23:10:00,599.15,2
03/10/2025 2:26,11.06,124.09,17,2.2,012 km N 85° E of City Of Bogo (Cebu), City Of Bogo ,Cebu,2025-10-03 02:26:00,2025-10-03,02:26:00,50.416666666666664,1
01/10/2025 3:29,11.0,123.92,25,2.1,008 km S 53° W of City Of Bogo (Cebu), City Of Bogo ,Cebu,2025-10-01 03:29:00,2025-10-01,03:29:00,3.466666666666667,3
01/10/2025 22:32,11.1,124.01,12,2.2,007 km N 31° E of City Of Bogo (Cebu), City Of Bogo ,Cebu,2025-10-01 22:32:00,2025-10-01,22:32:00,22.516666666666666,1
12/10/2025 19:15,11.06,124.07,30,1.9,010 km N 81° E of City Of Bogo (Cebu), City Of Bogo ,Cebu,2025-10-12 19:15:00,2025-10-12,19:15:00,283.23333333333335,3
04/10/2025 1:45,10.91,123.96,9,2.7,015 km S 10° W of City Of Bogo (Cebu), City Of Bogo ,Cebu,2025-10-04 01:45:00,2025-10-04,01:45:00,73.73333333333333,0
01/10/2025 1:39,11.0,124.04,11,2.2,009 km S 51° E of City Of Bogo (Cebu), City Of Bogo ,Cebu,2025-10-01 01:39:00,2025-10-01,01:39:00,1.6333333333333333,1
01/10/2025 20:47,10.63,124.0,10,3.6,046 km S 2° E of City Of Bogo (Cebu), City Of Bogo ,Cebu,2025-10-01 20:47:00,2025-10-01,20:47:00,20.766666666666666,0
19/10/2025 0:48,11.15,123.97,13,2.6,011 km N 06° W of City Of Bogo (Cebu), City Of Bogo ,Cebu,2025-10-19 00:48:00,2025-10-19,00:48:00,432.78333333333336,2
13/10/2025 3:11,10.96,123.96,11,1.6,010 km S 13° W of City Of Bogo (Cebu), City Of Bogo ,Cebu,2025-10-13 03:11:00,2025-10-13,03:11:00,291.1666666666667,0
26/10/2025 3:01,10.95,123.98,6,2.9,011 km S 02° E of City Of Bogo (Cebu), City Of Bogo ,Cebu,2025-10-26 03:01:00,2025-10-26,03:01:00,603.0,2
19/10/2025 2:06,11.17,123.98,32,1.7,013 km N 01° E of City Of Bogo (Cebu), City Of Bogo ,Cebu,2025-10-19 02:06:00,2025-10-19,02:06:00,434.0833333333333,3
13/10/2025 10:35,11.09,124.03,33,1.7,007 km N 46° E of City Of Bogo (Cebu), City Of Bogo ,Cebu,2025-10-13 10:35:00,2025-10-13,10:35:00,298.56666666666666,3
01/10/2025 0:59,11.17,124.04,4,3.8,015 km N 26° E of City Of Bogo (Cebu), City Of Bogo ,Cebu,2025-10-01 00:59:00,2025-10-01,00:59:00,0.9666666666666667,1
26/10/2025 3:03,10.97,123.94,36,1.9,009 km S 25° W of City Of Bogo (Cebu), City Of Bogo ,Cebu,2025-10-26 03:03:00,2025-10-26,03:03:00,603.0333333333333,2
05/10/2025 4:18,11.12,124.01,8,2.3,009 km N 23° E of City Of Bogo (Cebu), City Of Bogo ,Cebu,2025-10-05 04:18:00,2025-10-05,04:18:00,100.28333333333333,1
13/10/2025 3:49,11.0,123.96,10,4.1,005 km S 22° W of City Of Bogo (Cebu), City Of Bogo ,Cebu,2025-10-13 03:49:00,2025-10-13,03:49:00,291.8,0
23/10/2025 22:38,11.22,123.85,6,3.0,024 km N 37° W of City Of Bogo (Cebu), City Of Bogo ,Cebu,2025-10-23 22:38:00,2025-10-23,22:38:00,550.6166666666667,2
02/10/2025 2:24,11.12,123.94,24,1.8,009 km N 29° W of City Of Bogo (Cebu), City Of Bogo ,Cebu,2025-10-02 02:24:00,2025-10-02,02:24:00,26.383333333333333,3
20/10/2025 4:51,11.11,124.1,29,2.3,015 km N 59° E of City Of Bogo (Cebu), City Of Bogo ,Cebu,2025-10-20 04:51:00,2025-10-20,04:51:00,460.8333333333333,3
09/10/2025 6:40,10.91,123.9,5,2.6,018 km S 31° W of City Of Bogo (Cebu), City Of Bogo ,Cebu,2025-10-09 06:40:00,2025-10-09,06:40:00,198.65,0
15/10/2025 16:01,11.14,124.15,7,3.1,021 km N 60° E of City Of Bogo (Cebu), City Of Bogo ,Cebu,2025-10-15 16:01:00,2025-10-15,16:01:00,352.0,1
14/10/2025 0:36,10.89,124.0,2,3.3,017 km S 08° E of City Of Bogo (Cebu), City Of Bogo ,Cebu,2025-10-14 00:36:00,2025-10-14,00:36:00,312.5833333333333,0
01/10/2025 4:04,11.15,123.96,4,2.3,012 km N 13° W of City Of Bogo (Cebu), City Of Bogo ,Cebu,2025-10-01 04:04:00,2025-10-01,04:04:00,4.05,1
18/10/2025 12:59,10.93,123.9,8,4.1,015 km S 35° W of City Of Bogo (Cebu), City Of Bogo ,Cebu,2025-10-18 12:59:00,2025-10-18,12:59:00,420.96666666666664,0
05/10/2025 17:57,11.2,124.06,30,1.7,019 km N 29° E of City Of Bogo (Cebu), City Of Bogo ,Cebu,2025-10-05 17:57:00,2025-10-05,17:57:00,113.93333333333334,3
30/10/2025 5:23,10.96,123.82,12,2.1,019 km S 61° W of City Of Bogo (Cebu), City Of Bogo ,Cebu,2025-10-30 05:23:00,2025-10-30,05:23:00,701.3666666666667,2
02/10/2025 6:56,10.92,123.96,10,3.9,014 km S 8° W of City Of Bogo (Cebu), City Of Bogo ,Cebu,2025-10-02 06:56:00,2025-10-02,06:56:00,30.916666666666668,0
07/10/2025 10:24,11.06,124.17,1,2.1,021 km N 85° E of City Of Bogo (Cebu), City Of Bogo ,Cebu,2025-10-07 10:24:00,2025-10-07,10:24:00,154.38333333333333,1
13/10/2025 1:24,10.97,123.92,8,3.4,011 km S 37° W of City Of Bogo (Cebu), City Of Bogo ,Cebu,2025-10-13 01:24:00,2025-10-13,01:24:00,289.3833333333333,0
04/10/2025 17:36,11.04,124.03,39,1.2,006 km S 79° E of City Of Bogo (Cebu), City Of Bogo ,Cebu,2025-10-04 17:36:00,2025-10-04,17:36:00,89.58333333333333,3
03/10/2025 8:10,11.0,123.82,4,2.4,019 km S 74° W of City Of Bogo (Cebu), City Of Bogo ,Cebu,2025-10-03 08:10:00,2025-10-03,08:10:00,56.15,0
06/10/2025 15:57,11.15,124.09,2,2.5,016 km N 45° E of City Of Bogo (Cebu), City Of Bogo ,Cebu,2025-10-06 15:57:00,2025-10-06,15:57:00,135.93333333333334,1
05/10/2025 14:49,11.04,124.02,30,1.4,005 km S 86° E of City Of Bogo (Cebu), City Of Bogo ,Cebu,2025-10-05 14:49:00,2025-10-05,14:49:00,110.8,3
03/10/2025 5:53,11.08,124.05,4,2.8,009 km N 62° E of City Of Bogo (Cebu), City Of Bogo ,Cebu,2025-10-03 05:53:00,2025-10-03,05:53:00,53.86666666666667,1
11/10/2025 1:12,11.05,124.04,12,1.3,006 km N 82° E of City Of Bogo (Cebu), City Of Bogo ,Cebu,2025-10-11 01:12:00,2025-10-11,01:12:00,241.18333333333334,3
05/10/2025 6:47,11.17,123.97,30,1.4,014 km N 04° W of City Of Bogo (Cebu), City Of Bogo ,Cebu,2025-10-05 06:47:00,2025-10-05,06:47:00,102.76666666666667,3
07/10/2025 1:56,11.22,123.98,16,2.9,019 km N 01° W of City Of Bogo (Cebu), City Of Bogo ,Cebu,2025-10-07 01:56:00,2025-10-07,01:56:00,145.91666666666666,1
19/10/2025 8:29,10.91,123.98,16,2.8,015 km S 01° E of City Of Bogo (Cebu), City Of Bogo ,Cebu,2025-10-19 08:29:00,2025-10-19,08:29:00,440.46666666666664,0
27/10/2025 12:49,10.97,123.99,4,2.8,008 km S 07° E of City Of Bogo (Cebu), City Of Bogo ,Cebu,2025-10-27 12:49:00,2025-10-27,12:49:00,636.8,2
01/10/2025 4:15,11.12,123.99,5,1.7,009 km N 10° E of City Of Bogo (Cebu), City Of Bogo ,Cebu,2025-10-01 04:15:00,2025-10-01,04:15:00,4.233333333333333,1
03/10/2025 20:17,11.13,123.95,10,2.8,010 km N 17° W of City Of Bogo (Cebu), City Of Bogo ,Cebu,2025-10-03 20:17:00,2025-10-03,20:17:00,68.26666666666667,0
26/10/2025 7:32,11.1,124.02,27,1.7,008 km N 34° E of City Of Bogo (Cebu), City Of Bogo ,Cebu,2025-10-26 07:32:00,2025-10-26,07:32:00,607.5166666666667,2
06/10/2025 17:43,11.0,124.06,24,2.0,011 km S 58° E of City Of Bogo (Cebu), City Of Bogo ,Cebu,2025-10-06 17:43:00,2025-10-06,17:43:00,137.7,3
26/10/2025 3:38,10.89,123.9,6,2.2,020 km S 27° W of City Of Bogo (Cebu), City Of Bogo ,Cebu,2025-10-26 03:38:00,2025-10-26,03:38:00,603.6166666666667,2
01/10/2025 3:27,11.05,123.95,24,1.8,003 km S 88° W of City Of Bogo (Cebu), City Of Bogo ,Cebu,2025-10-01 03:27:00,2025-10-01,03:27:00,3.433333333333333,3
05/10/2025 3:09,10.93,123.98,7,4.0,013 km South of City Of Bogo (Cebu), City Of Bogo ,Cebu,2025-10-05 03:09:00,2025-10-05,03:09:00,99.13333333333334,0
13/10/2025 1:14,10.97,123.92,5,3.6,010 km S 37° W of City Of Bogo (Cebu), City Of Bogo ,Cebu,2025-10-13 01:14:00,2025-10-13,01:14:00,289.21666666666664,0
22/10/2025 8:18,11.04,124.03,8,2.4,005 km S 86° E of City Of Bogo (Cebu), City Of Bogo ,Cebu,2025-10-22 08:18:00,2025-10-22,08:18:00,512.2833333333333,2
26/10/2025 4:39,11.14,124.0,16,2.1,010 km N 10° E of City Of Bogo (Cebu), City Of Bogo ,Cebu,2025-10-26 04:39:00,2025-10-26,04:39:00,604.6333333333333,2
13/10/2025 7:09,11.02,124.02,4,3.1,005 km S 64° E of City Of Bogo (Cebu), City Of Bogo ,Cebu,2025-10-13 07:09:00,2025-10-13,07:09:00,295.1333333333333,0
04/10/2025 21:38,11.02,124.01,36,2.0,004 km S 52° E of City Of Bogo (Cebu), City Of Bogo ,Cebu,2025-10-04 21:38:00,2025-10-04,21:38:00,93.61666666666666,3
13/10/2025 20:36,11.06,124.06,32,2.5,009 km N 82° E of City Of Bogo (Cebu), City Of Bogo ,Cebu,2025-10-13 20:36:00,2025-10-13,20:36:00,308.5833333333333,3
03/10/2025 21:44,11.03,124.1,5,2.2,013 km S 80° E of City Of Bogo (Cebu), City Of Bogo ,Cebu,2025-10-03 21:44:00,2025-10-03,21:44:00,69.71666666666667,1
01/10/2025 20:16,10.95,123.9,3,2.8,014 km S 37° W of City Of Bogo (Cebu), City Of Bogo ,Cebu,2025-10-01 20:16:00,2025-10-01,20:16:00,20.25,0
01/10/2025 5:58,11.18,123.97,23,2.4,015 km N 04° W of City Of Bogo (Cebu), City Of Bogo ,Cebu,2025-10-01 05:58:00,2025-10-01,05:58:00,5.95,3
24/10/2025 20:28,10.83,123.9,4,2.1,025 km S 20° W of City Of Bogo (Cebu), City Of Bogo ,Cebu,2025-10-24 20:28:00,2025-10-24,20:28:00,572.45,0
19/10/2025 7:26,11.07,124.04,33,2.3,007 km N 70° E of City Of Bogo (Cebu), City Of Bogo ,Cebu,2025-10-19 07:26:00,2025-10-19,07:26:00,439.4166666666667,3
01/10/2025 4:59,11.37,123.9,35,2.6,036 km N 14° W of City Of Bogo (Cebu), City Of Bogo ,Cebu,2025-10-01 04:59:00,2025-10-01,04:59:00,4.966666666666667,3
10/10/2025 5:32,10.94,123.97,4,2.6,012 km S 05° W of City Of Bogo (Cebu), City Of Bogo ,Cebu,2025-10-10 05:32:00,2025-10-10,05:32:00,221.51666666666668,0
25/10/2025 6:23,11.0,123.9,1,3.0,011 km S 60° W of City Of Bogo (Cebu), City Of Bogo ,Cebu,2025-10-25 06:23:00,2025-10-25,06:23:00,582.3666666666667,2
05/10/2025 5:55,11.17,124.05,7,2.4,016 km N 30° E of City Of Bogo (Cebu), City Of Bogo ,Cebu,2025-10-05 05:55:00,2025-10-05,05:55:00,101.9,1
02/10/2025 4:55,10.86,124.02,22,2.4,022 km S 11° E of City Of Bogo (Cebu), City Of Bogo ,Cebu,2025-10-02 04:55:00,2025-10-02,04:55:00,28.9,0
28/10/2025 5:36,11.11,123.97,29,2.1,007 km N 10° W of City Of Bogo (Cebu), City Of Bogo ,Cebu,2025-10-28 05:36:00,2025-10-28,05:36:00,653.5833333333334,2
03/10/2025 11:42,11.1,124.06,30,2.1,011 km N 58° E of City Of Bogo (Cebu), City Of Bogo ,Cebu,2025-10-03 11:42:00,2025-10-03,11:42:00,59.68333333333333,3
05/10/2025 13:31,10.99,124.0,2,2.8,007 km S 23° E of City Of Bogo (Cebu), City Of Bogo ,Cebu,2025-10-05 13:31:00,2025-10-05,13:31:00,109.5,0
02/10/2025 0:21,10.92,123.91,1,2.0,016 km S 28° W of City Of Bogo (Cebu), City Of Bogo ,Cebu,2025-10-02 00:21:00,2025-10-02,00:21:00,24.333333333333332,0
14/10/2025 18:40,11.04,124.1,7,2.3,013 km S 87° E of City Of Bogo (Cebu), City Of Bogo ,Cebu,2025-10-14 18:40:00,2025-10-14,18:40:00,330.65,1
26/10/2025 21:04,10.97,124.07,30,2.1,013 km S 49° E of City Of Bogo (Cebu), City Of Bogo ,Cebu,2025-10-26 21:04:00,2025-10-26,21:04:00,621.05,2
23/10/2025 8:50,11.17,123.99,32,1.9,013 km N 07° E of City Of Bogo (Cebu), City Of Bogo ,Cebu,2025-10-23 08:50:00,2025-10-23,08:50:00,536.8166666666667,2
06/10/2025 1:42,10.98,123.94,8,3.5,009 km S 33° W of City Of Bogo (Cebu), City Of Bogo ,Cebu,2025-10-06 01:42:00,2025-10-06,01:42:00,121.68333333333334,0
07/10/2025 7:21,11.07,124.02,34,2.0,005 km N 63° E of City Of Bogo (Cebu), City Of Bogo ,Cebu,2025-10-07 07:21:00,2025-10-07,07:21:00,151.33333333333334,3
04/10/2025 8:39,11.05,123.95,18,2.4,003 km N 75° W of City Of Bogo (Cebu), City Of Bogo ,Cebu,2025-10-04 08:39:00,2025-10-04,08:39:00,80.63333333333334,0
02/10/2025 0:13,11.1,124.09,18,2.2,014 km N 63° E of City Of Bogo (Cebu), City Of Bogo ,Cebu,2025-10-02 00:13:00,2025-10-02,00:13:00,24.2,1
02/10/2025 18:27,11.07,124.04,5,3.7,007 km N 67° E of City Of Bogo (Cebu), City Of Bogo ,Cebu,2025-10-02 18:27:00,2025-10-02,18:27:00,42.43333333333333,0
20/10/2025 5:01,10.86,123.86,11,2.0,025 km S 31° W of City Of Bogo (Cebu), City Of Bogo ,Cebu,2025-10-20 05:01:00,2025-10-20,05:01:00,461.0,0
02/10/2025 23:37,11.09,124.05,19,1.8,009 km N 58° E of City Of Bogo (Cebu), City Of Bogo ,Cebu,2025-10-02 23:37:00,2025-10-02,23:37:00,47.6,3
12/10/2025 20:35,11.13,123.93,8,1.2,010 km N 31° W of City Of Bogo (Cebu), City Of Bogo ,Cebu,2025-10-12 20:35:00,2025-10-12,20:35:00,284.56666666666666,3
27/10/2025 5:50,11.08,124.07,23,2.1,010 km N 71° E of City Of Bogo (Cebu), City Of Bogo ,Cebu,2025-10-27 05:50:00,2025-10-27,05:50:00,629.8166666666667,2
07/10/2025 7:27,11.08,124.07,34,1.8,010 km N 67° E of City Of Bogo (Cebu), City Of Bogo ,Cebu,2025-10-07 07:27:00,2025-10-07,07:27:00,151.43333333333334,3
14/10/2025 0:13,11.16,124.12,3,2.4,020 km N 49° E of City Of Bogo (Cebu), City Of Bogo ,Cebu,2025-10-14 00:13:00,2025-10-14,00:13:00,312.2,1
06/10/2025 16:37,11.05,124.0,9,2.1,002 km N 66° E of City Of Bogo (Cebu), City Of Bogo ,Cebu,2025-10-06 16:37:00,2025-10-06,16:37:00,136.6,1
08/10/2025 3:03,10.91,124.1,2,2.3,020 km S 42° E of City Of Bogo (Cebu), City Of Bogo ,Cebu,2025-10-08 03:03:00,2025-10-08,03:03:00,171.03333333333333,0
03/10/2025 22:15,10.9,123.9,5,2.8,018 km S 28° W of City Of Bogo (Cebu), City Of Bogo ,Cebu,2025-10-03 22:15:00,2025-10-03,22:15:00,70.23333333333333,0
13/10/2025 4:18,11.02,123.92,28,2.1,007 km S 71° W of City Of Bogo (Cebu), City Of Bogo ,Cebu,2025-10-13 04:18:00,2025-10-13,04:18:00,292.28333333333336,3
04/10/2025 17:56,10.9,123.87,5,2.0,021 km S 36° W of City Of Bogo (Cebu), City Of Bogo ,Cebu,2025-10-04 17:56:00,2025-10-04,17:56:00,89.91666666666667,0
03/10/2025 12:21,11.16,124.11,24,1.8,020 km N 49° E of City Of Bogo (Cebu), City Of Bogo ,Cebu,2025-10-03 12:21:00,2025-10-03,12:21:00,60.333333333333336,3
07/10/2025 4:37,11.14,124.08,33,1.5,015 km N 49° E of City Of Bogo (Cebu), City Of Bogo ,Cebu,2025-10-07 04:37:00,2025-10-07,04:37:00,148.6,3
01/10/2025 0:43,11.02,124.04,4,2.8,007 km S 65° E of City Of Bogo (Cebu), City Of Bogo ,Cebu,2025-10-01 00:43:00,2025-10-01,00:43:00,0.7,0
11/10/2025 13:03,11.18,124.1,26,1.9,020 km N 42° E of City Of Bogo (Cebu), City Of Bogo ,Cebu,2025-10-11 13:03:00,2025-10-11,13:03:00,253.03333333333333,3
27/10/2025 15:44,11.09,124.13,34,2.0,017 km N 76° E of City Of Bogo (Cebu), City Of Bogo ,Cebu,2025-10-27 15:44:00,2025-10-27,15:44:00,639.7166666666667,2
30/10/2025 17:40,11.13,124.18,9,1.8,024 km N 66° E of City Of Bogo (Cebu), City Of Bogo ,Cebu,2025-10-30 17:40:00,2025-10-30,17:40:00,713.65,2
03/10/2025 5:42,11.16,124.04,33,1.4,014 km N 29° E of City Of Bogo (Cebu), City Of Bogo ,Cebu,2025-10-03 05:42:00,2025-10-03,05:42:00,53.68333333333333,3
01/10/2025 10:54,11.18,124.1,37,1.8,020 km N 40° E of City Of Bogo (Cebu), City Of Bogo ,Cebu,2025-10-01 10:54:00,2025-10-01,10:54:00,10.883333333333333,3
01/10/2025 15:10,11.03,123.97,4,4.1,002 km S 45° W of City Of Bogo (Cebu), City Of Bogo ,Cebu,2025-10-01 15:10:00,2025-10-01,15:10:00,15.15,0
26/10/2025 5:07,11.24,124.08,8,2.1,024 km N 27° E of City Of Bogo (Cebu), City Of Bogo ,Cebu,2025-10-26 05:07:00,2025-10-26,05:07:00,605.1,2
08/10/2025 7:34,11.17,124.16,7,1.9,024 km N 54° E of City Of Bogo (Cebu), City Of Bogo ,Cebu,2025-10-08 07:34:00,2025-10-08,07:34:00,175.55,1
01/10/2025 0:12,11.08,124.11,6,2.5,015 km N 77° E of City Of Bogo (Cebu), City Of Bogo ,Cebu,2025-10-01 00:12:00,2025-10-01,00:12:00,0.18333333333333332,1
08/10/2025 2:16,11.06,124.02,23,1.5,004 km N 63° E of City Of Bogo (Cebu), City Of Bogo ,Cebu,2025-10-08 02:16:00,2025-10-08,02:16:00,170.25,3
01/10/2025 3:10,11.15,124.13,9,2.4,020 km N 54° E of City Of Bogo (Cebu), City Of Bogo ,Cebu,2025-10-01 03:10:00,2025-10-01,03:10:00,3.15,1
27/10/2025 12:19,11.11,124.03,8,2.3,009 km N 40° E of City Of Bogo (Cebu), City Of Bogo ,Cebu,2025-10-27 12:19:00,2025-10-27,12:19:00,636.3,2
13/10/2025 2:36,10.99,123.88,22,1.5,012 km S 60° W of City Of Bogo (Cebu), City Of Bogo ,Cebu,2025-10-13 02:36:00,2025-10-13,02:36:00,290.5833333333333,3
26/10/2025 11:21,11.01,124.06,2,2.3,010 km S 67° E of City Of Bogo (Cebu), City Of Bogo ,Cebu,2025-10-26 11:21:00,2025-10-26,11:21:00,611.3333333333334,2
02/10/2025 13:44,11.0,123.98,22,1.8,005 km S 03° W of City Of Bogo (Cebu), City Of Bogo ,Cebu,2025-10-02 13:44:00,2025-10-02,13:44:00,37.71666666666667,3
01/10/2025 20:39,10.99,123.98,4,2.3,007 km S 04° W of City Of Bogo (Cebu), City Of Bogo ,Cebu,2025-10-01 20:39:00,2025-10-01,20:39:00,20.633333333333333,0
30/10/2025 19:21,10.93,123.94,1,2.2,013 km S 18° W of City Of Bogo (Cebu), City Of Bogo ,Cebu,2025-10-30 19:21:00,2025-10-30,19:21:00,715.3333333333334,2
09/10/2025 21:36,11.05,124.06,8,2.1,009 km N 88° E of City Of Bogo (Cebu), City Of Bogo ,Cebu,2025-10-09 21:36:00,2025-10-09,21:36:00,213.58333333333334,1
03/10/2025 0:47,11.09,124.04,20,2.5,009 km N 55° E of City Of Bogo (Cebu), City Of Bogo ,Cebu,2025-10-03 00:47:00,2025-10-03,00:47:00,48.766666666666666,1
01/10/2025 5:53,11.06,124.08,2,2.3,011 km N 80° E of City Of Bogo (Cebu), City Of Bogo ,Cebu,2025-10-01 05:53:00,2025-10-01,05:53:00,5.866666666666666,1
02/10/2025 1:29,11.13,124.11,3,2.0,017 km N 59° E of City Of Bogo (Cebu), City Of Bogo ,Cebu,2025-10-02 01:29:00,2025-10-02,01:29:00,25.466666666666665,1
05/10/2025 0:31,11.01,123.9,23,2.1,010 km S 64° W of City Of Bogo (Cebu), City Of Bogo ,Cebu,2025-10-05 00:31:00,2025-10-05,00:31:00,96.5,0
25/10/2025 12:51,10.95,123.89,1,1.9,014 km S 43° W of City Of Bogo (Cebu), City Of Bogo ,Cebu,2025-10-25 12:51:00,2025-10-25,12:51:00,588.8333333333334,2
04/10/2025 6:54,11.02,123.99,23,2.5,004 km S 23° E of City Of Bogo (Cebu), City Of Bogo ,Cebu,2025-10-04 06:54:00,2025-10-04,06:54:00,78.88333333333334,3
23/10/2025 22:32,11.11,123.96,2,3.2,007 km N 15° W of City Of Bogo (Cebu), City Of Bogo ,Cebu,2025-10-23 22:32:00,2025-10-23,22:32:00,550.5166666666667,2
06/10/2025 21:53,11.12,124.02,33,2.4,009 km N 30° E of City Of Bogo (Cebu), City Of Bogo ,Cebu,2025-10-06 21:53:00,2025-10-06,21:53:00,141.86666666666667,3
15/10/2025 21:16,11.17,123.98,32,1.5,014 km N 01° W of City Of Bogo (Cebu), City Of Bogo ,Cebu,2025-10-15 21:16:00,2025-10-15,21:16:00,357.25,3
01/10/2025 0:53,11.31,123.95,31,3.1,030 km N 07° W of City Of Bogo (Cebu), City Of Bogo ,Cebu,2025-10-01 00:53:00,2025-10-01,00:53:00,0.8666666666666667,3
25/10/2025 0:59,10.97,123.91,6,2.3,012 km S 43° W of City Of Bogo (Cebu), City Of Bogo ,Cebu,2025-10-25 00:59:00,2025-10-25,00:59:00,576.9666666666667,2
02/10/2025 18:21,11.11,124.1,5,4.4,015 km N 63° E of City Of Bogo (Cebu), City Of Bogo ,Cebu,2025-10-02 18:21:00,2025-10-02,18:21:00,42.333333333333336,1
02/10/2025 3:11,11.18,123.99,31,1.5,015 km N 04° E of City Of Bogo (Cebu), City Of Bogo ,Cebu,2025-10-02 03:11:00,2025-10-02,03:11:00,27.166666666666668,3
01/10/2025 1:34,11.13,123.87,24,2.2,015 km N 52° W of City Of Bogo (Cebu), City Of Bogo ,Cebu,2025-10-01 01:34:00,2025-10-01,01:34:00,1.55,3
12/10/2025 19:06,11.26,124.02,12,1.6,024 km N 09° E of City Of Bogo (Cebu), City Of Bogo ,Cebu,2025-10-12 19:06:00,2025-10-12,19:06:00,283.0833333333333,1
07/10/2025 8:10,11.15,123.97,6,2.1,012 km N 06° W of City Of Bogo (Cebu), City Of Bogo ,Cebu,2025-10-07 08:10:00,2025-10-07,08:10:00,152.15,1
23/10/2025 20:53,11.0,123.84,24,2.8,016 km S 71° W of City Of Bogo (Cebu), City Of Bogo ,Cebu,2025-10-23 20:53:00,2025-10-23,20:53:00,548.8666666666667,2
16/10/2025 12:43,10.99,123.96,4,2.7,006 km S 19° W of City Of Bogo (Cebu), City Of Bogo ,Cebu,2025-10-16 12:43:00,2025-10-16,12:43:00,372.7,0
07/10/2025 3:10,11.05,124.06,3,2.6,009 km East of City Of Bogo (Cebu), City Of Bogo ,Cebu,2025-10-07 03:10:00,2025-10-07,03:10:00,147.15,1
17/10/2025 11:42,11.16,124.09,20,2.3,017 km N 42° E of City Of Bogo (Cebu), City Of Bogo ,Cebu,2025-10-17 11:42:00,2025-10-17,11:42:00,395.68333333333334,2
30/10/2025 12:01,11.02,124.1,32,2.5,013 km S 79° E of City Of Bogo (Cebu), City Of Bogo ,Cebu,2025-10-30 12:01:00,2025-10-30,12:01:00,708.0,2
03/10/2025 17:33,11.12,124.11,15,1.8,016 km N 59° E of City Of Bogo (Cebu), City Of Bogo ,Cebu,2025-10-03 17:33:00,2025-10-03,17:33:00,65.53333333333333,1
02/10/2025 2:01,11.16,124.14,3,2.6,022 km N 53° E of City Of Bogo (Cebu), City Of Bogo ,Cebu,2025-10-02 02:01:00,2025-10-02,02:01:00,26.0,1
27/10/2025 20:38,10.85,123.81,23,2.1,029 km S 41° W of City Of Bogo (Cebu), City Of Bogo ,Cebu,2025-10-27 20:38:00,2025-10-27,20:38:00,644.6166666666667,2
03/10/2025 8:30,11.13,124.05,22,1.4,012 km N 40° E of City Of Bogo (Cebu), City Of Bogo ,Cebu,2025-10-03 08:30:00,2025-10-03,08:30:00,56.483333333333334,3
26/10/2025 3:01,10.94,123.95,5,2.9,013 km S 14° W of City Of Bogo (Cebu), City Of Bogo ,Cebu,2025-10-26 03:01:00,2025-10-26,03:01:00,603.0,2
04/10/2025 9:49,11.02,124.08,5,1.7,011 km S 77° E of City Of Bogo (Cebu), City Of Bogo ,Cebu,2025-10-04 09:49:00,2025-10-04,09:49:00,81.8,1
17/10/2025 19:44,11.04,124.08,33,1.2,011 km S 89° E of City Of Bogo (Cebu), City Of Bogo ,Cebu,2025-10-17 19:44:00,2025-10-17,19:44:00,403.71666666666664,3
07/10/2025 0:17,11.15,124.05,32,1.3,014 km N 36° E of City Of Bogo (Cebu), City Of Bogo ,Cebu,2025-10-07 00:17:00,2025-10-07,00:17:00,144.26666666666668,3
26/10/2025 23:03,11.1,123.94,3,2.6,007 km N 31° W of City Of Bogo (Cebu), City Of Bogo ,Cebu,2025-10-26 23:03:00,2025-10-26,23:03:00,623.0333333333333,2
15/10/2025 14:38,11.02,124.1,4,1.9,014 km S 76° E of City Of Bogo (Cebu), City Of Bogo ,Cebu,2025-10-15 14:38:00,2025-10-15,14:38:00,350.6166666666667,1
25/10/2025 21:18,11.29,124.09,32,2.1,029 km N 25° E of City Of Bogo (Cebu), City Of Bogo ,Cebu,2025-10-25 21:18:00,2025-10-25,21:18:00,597.2833333333333,2
14/10/2025 9:32,11.18,123.91,29,2.5,016 km N 29° W of City Of Bogo (Cebu), City Of Bogo ,Cebu,2025-10-14 09:32:00,2025-10-14,09:32:00,321.51666666666665,3
14/10/2025 10:45,10.9,123.92,7,3.7,017 km S 22° W of City Of Bogo (Cebu), City Of Bogo ,Cebu,2025-10-14 10:45:00,2025-10-14,10:45:00,322.73333333333335,0
04/10/2025 22:17,10.95,123.96,7,3.2,011 km S 10° W of City Of Bogo (Cebu), City Of Bogo ,Cebu,2025-10-04 22:17:00,2025-10-04,22:17:00,94.26666666666667,0
13/10/2025 7:04,11.21,124.13,33,2.4,024 km N 43° E of City Of Bogo (Cebu), City Of Bogo ,Cebu,2025-10-13 07:04:00,2025-10-13,07:04:00,295.05,3
07/10/2025 8:25,11.14,124.01,33,1.9,011 km N 20° E of City Of Bogo (Cebu), City Of Bogo ,Cebu,2025-10-07 08:25:00,2025-10-07,08:25:00,152.4,3
01/10/2025 15:09,11.06,123.96,1,2.4,003 km N 51° W of City Of Bogo (Cebu), City Of Bogo ,Cebu,2025-10-01 15:09:00,2025-10-01,15:09:00,15.133333333333333,0
03/10/2025 19:29,11.02,123.87,7,2.6,013 km S 77° W of City Of Bogo (Cebu), City Of Bogo ,Cebu,2025-10-03 19:29:00,2025-10-03,19:29:00,67.46666666666667,0
05/10/2025 3:01,11.12,124.12,2,1.7,017 km N 63° E of City Of Bogo (Cebu), City Of Bogo ,Cebu,2025-10-05 03:01:00,2025-10-05,03:01:00,99.0,1
01/10/2025 6:43,10.97,123.94,32,2.1,009 km S 30° W of City Of Bogo (Cebu), City Of Bogo ,Cebu,2025-10-01 06:43:00,2025-10-01,06:43:00,6.7,3
27/10/2025 11:45,11.32,123.99,1,2.5,030 km N 01° E of City Of Bogo (Cebu), City Of Bogo ,Cebu,2025-10-27 11:45:00,2025-10-27,11:45:00,635.7333333333333,2
04/10/2025 6:39,10.96,123.94,30,2.2,010 km S 26° W of City Of Bogo (Cebu), City Of Bogo ,Cebu,2025-10-04 06:39:00,2025-10-04,06:39:00,78.63333333333334,3
04/10/2025 23:19,10.92,123.9,7,2.4,016 km S 33° W of City Of Bogo (Cebu), City Of Bogo ,Cebu,2025-10-04 23:19:00,2025-10-04,23:19:00,95.3,0
14/10/2025 2:54,11.1,123.94,32,2.0,007 km N 40° W of City Of Bogo (Cebu), City Of Bogo ,Cebu,2025-10-14 02:54:00,2025-10-14,02:54:00,314.8833333333333,3
12/10/2025 21:18,11.14,123.97,3,1.9,011 km N 07° W of City Of Bogo (Cebu), City Of Bogo ,Cebu,2025-10-12 21:18:00,2025-10-12,21:18:00,285.28333333333336,1
24/10/2025 7:24,11.26,123.92,35,3.2,024 km N 14° W of City Of Bogo (Cebu), City Of Bogo ,Cebu,2025-10-24 07:24:00,2025-10-24,07:24:00,559.3833333333333,2
05/10/2025 20:38,11.17,123.97,17,2.3,014 km N 05° W of City Of Bogo (Cebu), City Of Bogo ,Cebu,2025-10-05 20:38:00,2025-10-05,20:38:00,116.61666666666666,1
06/10/2025 7:51,11.06,124.0,34,1.5,003 km N 43° E of City Of Bogo (Cebu), City Of Bogo ,Cebu,2025-10-06 07:51:00,2025-10-06,07:51:00,127.83333333333333,3
02/10/2025 7:39,11.05,124.07,3,3.8,009 km N 87° E of City Of Bogo (Cebu), City Of Bogo ,Cebu,2025-10-02 07:39:00,2025-10-02,07:39:00,31.633333333333333,0
30/10/2025 0:25,11.15,124.18,6,2.4,025 km N 61° E of City Of Bogo (Cebu), City Of Bogo ,Cebu,2025-10-30 00:25:00,2025-10-30,00:25:00,696.4,2
06/10/2025 19:23,11.13,124.13,9,1.7,019 km N 61° E of City Of Bogo (Cebu), City Of Bogo ,Cebu,2025-10-06 19:23:00,2025-10-06,19:23:00,139.36666666666667,1
03/10/2025 12:11,10.99,123.96,7,2.0,007 km S 16° W of City Of Bogo (Cebu), City Of Bogo ,Cebu,2025-10-03 12:11:00,2025-10-03,12:11:00,60.166666666666664,0
06/10/2025 11:43,11.13,124.12,9,2.7,018 km N 60° E of City Of Bogo (Cebu), City Of Bogo ,Cebu,2025-10-06 11:43:00,2025-10-06,11:43:00,131.7,1
15/10/2025 13:47,11.13,124.13,33,2.5,019 km N 61° E of City Of Bogo (Cebu), City Of Bogo ,Cebu,2025-10-15 13:47:00,2025-10-15,13:47:00,349.76666666666665,3
01/10/2025 2:26,10.99,124.11,33,1.8,015 km S 66° E of City Of Bogo (Cebu), City Of Bogo ,Cebu,2025-10-01 02:26:00,2025-10-01,02:26:00,2.4166666666666665,3
15/10/2025 23:55,10.98,123.99,29,2.3,007 km S 07° E of City Of Bogo (Cebu), City Of Bogo ,Cebu,2025-10-15 23:55:00,2025-10-15,23:55:00,359.9,3
09/10/2025 23:27,11.17,124.03,32,1.3,015 km N 20° E of City Of Bogo (Cebu), City Of Bogo ,Cebu,2025-10-09 23:27:00,2025-10-09,23:27:00,215.43333333333334,3
01/10/2025 14:32,10.97,123.95,4,2.4,009 km S 18° W of City Of Bogo (Cebu), City Of Bogo ,Cebu,2025-10-01 14:32:00,2025-10-01,14:32:00,14.516666666666667,0
03/10/2025 22:46,10.93,123.95,7,2.3,014 km S 15° W of City Of Bogo (Cebu), City Of Bogo ,Cebu,2025-10-03 22:46:00,2025-10-03,22:46:00,70.75,0
01/10/2025 20:01,11.02,124.0,2,2.9,003 km S 34° E of City Of Bogo (Cebu), City Of Bogo ,Cebu,2025-10-01 20:01:00,2025-10-01,20:01:00,20.0,0
23/10/2025 5:17,10.9,123.92,2,2.0,018 km S 21° W of City Of Bogo (Cebu), City Of Bogo ,Cebu,2025-10-23 05:17:00,2025-10-23,05:17:00,533.2666666666667,2
26/10/2025 3:03,11.21,124.14,32,1.8,025 km N 44° E of City Of Bogo (Cebu), City Of Bogo ,Cebu,2025-10-26 03:03:00,2025-10-26,03:03:00,603.0333333333333,3
02/10/2025 13:03,11.14,124.02,29,1.2,011 km N 24° E of City Of Bogo (Cebu), City Of Bogo ,Cebu,2025-10-02 13:03:00,2025-10-02,13:03:00,37.03333333333333,3
03/10/2025 22:41,10.92,123.94,6,3.0,017 km S 11° W of City Of Bogo (Cebu), City Of Bogo ,Cebu,2025-10-03 22:41:00,2025-10-03,22:41:00,70.66666666666667,0
09/10/2025 1:15,11.21,124.13,11,2.5,024 km N 41° E of City Of Bogo (Cebu), City Of Bogo ,Cebu,2025-10-09 01:15:00,2025-10-09,01:15:00,193.23333333333332,1
02/10/2025 15:35,11.03,124.06,6,2.9,009 km S 77° E of City Of Bogo (Cebu), City Of Bogo ,Cebu,2025-10-02 15:35:00,2025-10-02,15:35:00,39.56666666666667,1
07/10/2025 16:38,11.11,124.13,6,2.6,017 km N 66° E of City Of Bogo (Cebu), City Of Bogo ,Cebu,2025-10-07 16:38:00,2025-10-07,16:38:00,160.61666666666667,1
03/10/2025 9:37,11.08,123.95,33,2.0,005 km N 36° W of City Of Bogo (Cebu), City Of Bogo ,Cebu,2025-10-03 09:37:00,2025-10-03,09:37:00,57.6,3
29/10/2025 19:30,11.38,124.03,33,1.3,037 km N 09° E of City Of Bogo (Cebu), City Of Bogo ,Cebu,2025-10-29 19:30:00,2025-10-29,19:30:00,691.4833333333333,2
01/10/2025 7:35,10.91,123.73,11,2.1,031 km S 62° W of City Of Bogo (Cebu), City Of Bogo ,Cebu,2025-10-01 07:35:00,2025-10-01,07:35:00,7.566666666666666,0
03/10/2025 20:15,10.97,123.98,16,2.3,008 km S 02° E of City Of Bogo (Cebu), City Of Bogo ,Cebu,2025-10-03 20:15:00,2025-10-03,20:15:00,68.23333333333333,0
06/10/2025 0:27,11.15,123.97,17,2.7,011 km N 08° W of City Of Bogo (Cebu), City Of Bogo ,Cebu,2025-10-06 00:27:00,2025-10-06,00:27:00,120.43333333333334,1
20/10/2025 13:43,11.21,124.18,4,2.3,028 km N 51° E of City Of Bogo (Cebu), City Of Bogo ,Cebu,2025-10-20 13:43:00,2025-10-20,13:43:00,469.7,1
08/10/2025 3:49,11.02,123.99,31,1.7,003 km S 26° E of City Of Bogo (Cebu), City Of Bogo ,Cebu,2025-10-08 03:49:00,2025-10-08,03:49:00,171.8,3
02/10/2025 9:03,11.19,124.13,2,2.6,023 km N 46° E of City Of Bogo (Cebu), City Of Bogo ,Cebu,2025-10-02 09:03:00,2025-10-02,09:03:00,33.03333333333333,1
15/10/2025 14:40,11.12,123.96,24,2.0,008 km N 14° W of City Of Bogo (Cebu), City Of Bogo ,Cebu,2025-10-15 14:40:00,2025-10-15,14:40:00,350.65,3
01/10/2025 1:14,11.08,124.16,32,2.0,020 km N 79° E of City Of Bogo (Cebu), City Of Bogo ,Cebu,2025-10-01 01:14:00,2025-10-01,01:14:00,1.2166666666666666,3
14/10/2025 14:49,11.05,123.93,1,1.5,006 km N 86° W of City Of Bogo (Cebu), City Of Bogo ,Cebu,2025-10-14 14:49:00,2025-10-14,14:49:00,326.8,2
01/10/2025 12:06,10.94,123.93,1,3.3,013 km S 25° W of City Of Bogo (Cebu), City Of Bogo ,Cebu,2025-10-01 12:06:00,2025-10-01,12:06:00,12.083333333333334,0
09/10/2025 4:32,11.1,124.05,22,1.0,010 km N 55° E of City Of Bogo (Cebu), City Of Bogo ,Cebu,2025-10-09 04:32:00,2025-10-09,04:32:00,196.51666666666668,3
13/10/2025 1:22,11.05,124.03,22,1.8,006 km N 83° E of City Of Bogo (Cebu), City Of Bogo ,Cebu,2025-10-13 01:22:00,2025-10-13,01:22:00,289.35,3
24/10/2025 20:54,10.97,123.94,11,2.2,010 km S 29° W of City Of Bogo (Cebu), City Of Bogo ,Cebu,2025-10-24 20:54:00,2025-10-24,20:54:00,572.8833333333333,2
05/10/2025 1:16,11.08,123.97,26,2.0,004 km N 11° W of City Of Bogo (Cebu), City Of Bogo ,Cebu,2025-10-05 01:16:00,2025-10-05,01:16:00,97.25,3
05/10/2025 6:09,11.14,124.16,33,2.2,022 km N 61° E of City Of Bogo (Cebu), City Of Bogo ,Cebu,2025-10-05 06:09:00,2025-10-05,06:09:00,102.13333333333334,3
10/10/2025 4:49,10.95,123.88,15,2.2,016 km S 46° W of City Of Bogo (Cebu), City Of Bogo ,Cebu,2025-10-10 04:49:00,2025-10-10,04:49:00,220.8,0
02/10/2025 0:18,11.11,124.17,5,3.8,022 km N 70° E of City Of Bogo (Cebu), City Of Bogo ,Cebu,2025-10-02 00:18:00,2025-10-02,00:18:00,24.283333333333335,1
04/10/2025 9:09,11.03,123.97,5,2.9,002 km S 59° W of City Of Bogo (Cebu), City Of Bogo ,Cebu,2025-10-04 09:09:00,2025-10-04,09:09:00,81.13333333333334,0
07/10/2025 4:40,11.07,124.1,6,1.2,013 km N 77° E of City Of Bogo (Cebu), City Of Bogo ,Cebu,2025-10-07 04:40:00,2025-10-07,04:40:00,148.65,1
01/10/2025 0:26,11.15,124.11,4,1.4,018 km N 52° E of City Of Bogo (Cebu), City Of Bogo ,Cebu,2025-10-01 00:26:00,2025-10-01,00:26:00,0.4166666666666667,1
05/10/2025 3:54,10.99,123.91,33,2.1,010 km S 48° W of City Of Bogo (Cebu), City Of Bogo ,Cebu,2025-10-05 03:54:00,2025-10-05,03:54:00,99.88333333333334,3
29/10/2025 4:17,11.23,124.18,5,2.2,030 km N 46° E of City Of Bogo (Cebu), City Of Bogo ,Cebu,2025-10-29 04:17:00,2025-10-29,04:17:00,676.2666666666667,2
04/10/2025 10:04,11.04,124.08,27,1.9,011 km S 83° E of City Of Bogo (Cebu), City Of Bogo ,Cebu,2025-10-04 10:04:00,2025-10-04,10:04:00,82.05,3
05/10/2025 13:24,11.01,124.0,33,1.5,004 km S 26° E of City Of Bogo (Cebu), City Of Bogo ,Cebu,2025-10-05 13:24:00,2025-10-05,13:24:00,109.38333333333334,3
05/10/2025 13:50,11.14,124.04,31,1.7,013 km N 33° E of City Of Bogo (Cebu), City Of Bogo ,Cebu,2025-10-05 13:50:00,2025-10-05,13:50:00,109.81666666666666,3
05/10/2025 19:28,10.99,123.93,10,2.2,008 km S 42° W of City Of Bogo (Cebu), City Of Bogo ,Cebu,2025-10-05 19:28:00,2025-10-05,19:28:00,115.45,0
06/10/2025 21:30,11.15,124.04,11,2.7,013 km N 30° E of City Of Bogo (Cebu), City Of Bogo ,Cebu,2025-10-06 21:30:00,2025-10-06,21:30:00,141.48333333333332,1
11/10/2025 14:08,11.18,124.07,10,1.7,018 km N 33° E of City Of Bogo (Cebu), City Of Bogo ,Cebu,2025-10-11 14:08:00,2025-10-11,14:08:00,254.11666666666667,1
04/10/2025 12:05,11.28,124.2,23,1.6,035 km N 43° E of City Of Bogo (Cebu), City Of Bogo ,Cebu,2025-10-04 12:05:00,2025-10-04,12:05:00,84.06666666666666,1
26/10/2025 1:04,11.12,123.98,28,1.8,008 km N 02° E of City Of Bogo (Cebu), City Of Bogo ,Cebu,2025-10-26 01:04:00,2025-10-26,01:04:00,601.05,2
06/10/2025 12:27,10.94,123.87,1,2.4,017 km S 45° W of City Of Bogo (Cebu), City Of Bogo ,Cebu,2025-10-06 12:27:00,2025-10-06,12:27:00,132.43333333333334,0
14/10/2025 0:31,11.17,123.97,31,1.7,014 km N 04° W of City Of Bogo (Cebu), City Of Bogo ,Cebu,2025-10-14 00:31:00,2025-10-14,00:31:00,312.5,3
01/10/2025 22:05,10.98,123.98,2,2.5,007 km S 03° W of City Of Bogo (Cebu), City Of Bogo ,Cebu,2025-10-01 22:05:00,2025-10-01,22:05:00,22.066666666666666,0
21/10/2025 0:11,11.0,123.99,33,2.3,005 km S 13° E of City Of Bogo (Cebu), City Of Bogo ,Cebu,2025-10-21 00:11:00,2025-10-21,00:11:00,480.1666666666667,2
01/10/2025 19:32,11.07,124.08,11,2.4,011 km N 74° E of City Of Bogo (Cebu), City Of Bogo ,Cebu,2025-10-01 19:32:00,2025-10-01,19:32:00,19.516666666666666,1
11/10/2025 9:34,11.1,124.12,30,1.5,016 km N 70° E of City Of Bogo (Cebu), City Of Bogo ,Cebu,2025-10-11 09:34:00,2025-10-11,09:34:00,249.55,3
01/10/2025 13:54,11.21,124.17,33,1.5,028 km N 48° E of City Of Bogo (Cebu), City Of Bogo ,Cebu,2025-10-01 13:54:00,2025-10-01,13:54:00,13.883333333333333,3
23/10/2025 20:15,11.13,124.07,4,1.9,013 km N 49° E of City Of Bogo (Cebu), City Of Bogo ,Cebu,2025-10-23 20:15:00,2025-10-23,20:15:00,548.2333333333333,2
02/10/2025 5:07,11.16,123.97,10,3.1,012 km N 05° W of City Of Bogo (Cebu), City Of Bogo ,Cebu,2025-10-02 05:07:00,2025-10-02,05:07:00,29.1,1
13/10/2025 7:12,11.03,123.99,2,2.1,002 km S 22° E of City Of Bogo (Cebu), City Of Bogo ,Cebu,2025-10-13 07:12:00,2025-10-13,07:12:00,295.18333333333334,0
17/10/2025 1:53,11.09,124.09,2,2.3,013 km N 69° E of City Of Bogo (Cebu), City Of Bogo ,Cebu,2025-10-17 01:53:00,2025-10-17,01:53:00,385.8666666666667,1
21/10/2025 22:11,11.2,124.18,15,1.9,028 km N 51° E of City Of Bogo (Cebu), City Of Bogo ,Cebu,2025-10-21 22:11:00,2025-10-21,22:11:00,502.1666666666667,1
09/10/2025 7:36,11.21,124.03,32,1.4,019 km N 16° E of City Of Bogo (Cebu), City Of Bogo ,Cebu,2025-10-09 07:36:00,2025-10-09,07:36:00,199.58333333333334,3
21/10/2025 18:24,11.16,124.19,10,2.4,027 km N 61° E of City Of Bogo (Cebu), City Of Bogo ,Cebu,2025-10-21 18:24:00,2025-10-21,18:24:00,498.3833333333333,1
07/10/2025 11:15,11.2,124.12,2,1.8,023 km N 43° E of City Of Bogo (Cebu), City Of Bogo ,Cebu,2025-10-07 11:15:00,2025-10-07,11:15:00,155.23333333333332,1
22/10/2025 21:19,11.12,124.17,6,2.4,022 km N 69° E of City Of Bogo (Cebu), City Of Bogo ,Cebu,2025-10-22 21:19:00,2025-10-22,21:19:00,525.3,2
16/10/2025 17:25,10.85,123.96,2,1.9,021 km S 06° W of City Of Bogo (Cebu), City Of Bogo ,Cebu,2025-10-16 17:25:00,2025-10-16,17:25:00,377.4,0
29/10/2025 18:21,10.98,123.95,1,2.5,008 km S 22° W of City Of Bogo (Cebu), City Of Bogo ,Cebu,2025-10-29 18:21:00,2025-10-29,18:21:00,690.3333333333334,2
01/10/2025 10:50,10.96,124.05,18,1.5,012 km S 38° E of City Of Bogo (Cebu), City Of Bogo ,Cebu,2025-10-01 10:50:00,2025-10-01,10:50:00,10.816666666666666,3
11/10/2025 9:30,10.88,123.91,2,1.6,020 km S 22° W of City Of Bogo (Cebu), City Of Bogo ,Cebu,2025-10-11 09:30:00,2025-10-11,09:30:00,249.48333333333332,0
01/10/2025 9:30,10.9,123.91,5,2.3,018 km S 27° W of City Of Bogo (Cebu), City Of Bogo ,Cebu,2025-10-01 09:30:00,2025-10-01,09:30:00,9.483333333333333,0
08/10/2025 8:16,10.99,123.97,6,1.6,007 km S 12° W of City Of Bogo (Cebu), City Of Bogo ,Cebu,2025-10-08 08:16:00,2025-10-08,08:16:00,176.25,0
02/10/2025 16:17,11.09,123.96,7,2.5,005 km N 23° W of City Of Bogo (Cebu), City Of Bogo ,Cebu,2025-10-02 16:17:00,2025-10-02,16:17:00,40.266666666666666,0
28/10/2025 0:52,11.15,123.92,4,3.0,012 km N 29° W of City Of Bogo (Cebu), City Of Bogo ,Cebu,2025-10-28 00:52:00,2025-10-28,00:52:00,648.85,2
23/10/2025 1:50,11.14,124.08,4,2.4,015 km N 46° E of City Of Bogo (Cebu), City Of Bogo ,Cebu,2025-10-23 01:50:00,2025-10-23,01:50:00,529.8166666666667,2
02/10/2025 18:37,11.16,124.13,6,2.1,021 km N 53° E of City Of Bogo (Cebu), City Of Bogo ,Cebu,2025-10-02 18:37:00,2025-10-02,18:37:00,42.6,1
14/10/2025 8:00,11.11,124.09,2,2.2,014 km N 62° E of City Of Bogo (Cebu), City Of Bogo ,Cebu,2025-10-14 08:00:00,2025-10-14,08:00:00,319.98333333333335,1
02/10/2025 3:42,11.1,124.04,13,1.6,009 km N 49° E of City Of Bogo (Cebu), City Of Bogo ,Cebu,2025-10-02 03:42:00,2025-10-02,03:42:00,27.683333333333334,1
15/10/2025 1:15,11.15,123.97,29,2.0,011 km N 04° W of City Of Bogo (Cebu), City Of Bogo ,Cebu,2025-10-15 01:15:00,2025-10-15,01:15:00,337.23333333333335,3
14/10/2025 6:58,11.09,123.96,35,1.8,005 km N 30° W of City Of Bogo (Cebu), City Of Bogo ,Cebu,2025-10-14 06:58:00,2025-10-14,06:58:00,318.95,3
01/10/2025 5:42,11.16,123.98,32,2.1,013 km N 01° E of City Of Bogo (Cebu), City Of Bogo ,Cebu,2025-10-01 05:42:00,2025-10-01,05:42:00,5.683333333333334,3
02/10/2025 9:59,11.16,123.95,18,1.8,013 km N 16° W of City Of Bogo (Cebu), City Of Bogo ,Cebu,2025-10-02 09:59:00,2025-10-02,09:59:00,33.96666666666667,3
05/10/2025 18:11,11.15,124.15,8,1.5,021 km N 59° E of City Of Bogo (Cebu), City Of Bogo ,Cebu,2025-10-05 18:11:00,2025-10-05,18:11:00,114.16666666666667,1
02/10/2025 18:14,11.14,123.99,24,1.3,011 km N 08° E of City Of Bogo (Cebu), City Of Bogo ,Cebu,2025-10-02 18:14:00,2025-10-02,18:14:00,42.21666666666667,3
02/10/2025 6:03,11.28,124.07,30,1.7,028 km N 21° E of City Of Bogo (Cebu), City Of Bogo ,Cebu,2025-10-02 06:03:00,2025-10-02,06:03:00,30.033333333333335,3
01/10/2025 16:42,10.94,123.98,5,1.5,012 km S 02° E of City Of Bogo (Cebu), City Of Bogo ,Cebu,2025-10-01 16:42:00,2025-10-01,16:42:00,16.683333333333334,0
04/10/2025 12:04,10.98,124.27,32,2.1,033 km S 77° E of City Of Bogo (Cebu), City Of Bogo ,Cebu,2025-10-04 12:04:00,2025-10-04,12:04:00,84.05,3
16/10/2025 20:47,11.02,124.02,42,2.2,005 km S 52° E of City Of Bogo (Cebu), City Of Bogo ,Cebu,2025-10-16 20:47:00,2025-10-16,20:47:00,380.76666666666665,3
06/10/2025 22:04,10.98,123.96,7,3.8,007 km S 15° W of City Of Bogo (Cebu), City Of Bogo ,Cebu,2025-10-06 22:04:00,2025-10-06,22:04:00,142.05,0
24/10/2025 20:40,11.21,124.11,37,2.4,023 km N 38° E of City Of Bogo (Cebu), City Of Bogo ,Cebu,2025-10-24 20:40:00,2025-10-24,20:40:00,572.65,3
02/10/2025 22:46,11.11,124.09,32,1.2,014 km N 59° E of City Of Bogo (Cebu), City Of Bogo ,Cebu,2025-10-02 22:46:00,2025-10-02,22:46:00,46.75,3
06/10/2025 8:19,11.12,124.13,10,1.3,019 km N 63° E of City Of Bogo (Cebu), City Of Bogo ,Cebu,2025-10-06 08:19:00,2025-10-06,08:19:00,128.3,1
07/10/2025 22:14,10.99,124.01,1,2.6,007 km S 26° E of City Of Bogo (Cebu), City Of Bogo ,Cebu,2025-10-07 22:14:00,2025-10-07,22:14:00,166.21666666666667,0
07/10/2025 22:12,11.17,123.96,11,1.7,014 km N 09° W of City Of Bogo (Cebu), City Of Bogo ,Cebu,2025-10-07 22:12:00,2025-10-07,22:12:00,166.18333333333334,1
02/10/2025 15:09,10.85,123.93,6,2.9,022 km S 13° W of City Of Bogo (Cebu), City Of Bogo ,Cebu,2025-10-02 15:09:00,2025-10-02,15:09:00,39.13333333333333,0
24/10/2025 2:09,11.0,124.03,31,1.8,008 km S 46° E of City Of Bogo (Cebu), City Of Bogo ,Cebu,2025-10-24 02:09:00,2025-10-24,02:09:00,554.1333333333333,2
24/10/2025 21:59,10.99,123.99,9,4.6,007 km S 12° E of City Of Bogo (Cebu), City Of Bogo ,Cebu,2025-10-24 21:59:00,2025-10-24,21:59:00,573.9666666666667,2
04/10/2025 1:51,11.14,124.06,6,3.2,014 km N 40° E of City Of Bogo (Cebu), City Of Bogo ,Cebu,2025-10-04 01:51:00,2025-10-04,01:51:00,73.83333333333333,1
03/10/2025 13:06,10.97,123.99,9,2.5,008 km S 11° E of City Of Bogo (Cebu), City Of Bogo ,Cebu,2025-10-03 13:06:00,2025-10-03,13:06:00,61.083333333333336,0
12/10/2025 21:44,11.05,124.1,33,1.3,014 km N 87° E of City Of Bogo (Cebu), City Of Bogo ,Cebu,2025-10-12 21:44:00,2025-10-12,21:44:00,285.71666666666664,3
22/10/2025 11:30,11.15,123.96,12,1.8,012 km N 09° W of City Of Bogo (Cebu), City Of Bogo ,Cebu,2025-10-22 11:30:00,2025-10-22,11:30:00,515.4833333333333,2
10/10/2025 23:45,11.15,123.98,29,2.6,012 km N 01° W of City Of Bogo (Cebu), City Of Bogo ,Cebu,2025-10-10 23:45:00,2025-10-10,23:45:00,239.73333333333332,3
13/10/2025 1:14,10.98,123.93,6,3.6,009 km S 33° W of City Of Bogo (Cebu), City Of Bogo ,Cebu,2025-10-13 01:14:00,2025-10-13,01:14:00,289.21666666666664,0
02/10/2025 18:33,11.14,124.06,18,1.9,014 km N 38° E of City Of Bogo (Cebu), City Of Bogo ,Cebu,2025-10-02 18:33:00,2025-10-02,18:33:00,42.53333333333333,1
12/10/2025 5:34,11.1,124.1,21,2.3,014 km N 65° E of City Of Bogo (Cebu), City Of Bogo ,Cebu,2025-10-12 05:34:00,2025-10-12,05:34:00,269.55,3
04/10/2025 22:56,11.08,123.87,27,1.8,012 km N 72° W of City Of Bogo (Cebu), City Of Bogo ,Cebu,2025-10-04 22:56:00,2025-10-04,22:56:00,94.91666666666667,3
19/10/2025 14:12,11.14,124.16,9,2.7,022 km N 63° E of City Of Bogo (Cebu), City Of Bogo ,Cebu,2025-10-19 14:12:00,2025-10-19,14:12:00,446.18333333333334,1
25/10/2025 21:08,11.05,124.03,30,1.8,006 km N 81° E of City Of Bogo (Cebu), City Of Bogo ,Cebu,2025-10-25 21:08:00,2025-10-25,21:08:00,597.1166666666667,2
16/10/2025 9:49,11.0,124.05,4,2.8,009 km S 54° E of City Of Bogo (Cebu), City Of Bogo ,Cebu,2025-10-16 09:49:00,2025-10-16,09:49:00,369.8,2
09/10/2025 23:53,11.2,124.16,6,1.7,026 km N 49° E of City Of Bogo (Cebu), City Of Bogo ,Cebu,2025-10-09 23:53:00,2025-10-09,23:53:00,215.86666666666667,1
07/10/2025 21:28,11.16,124.04,23,1.8,015 km N 28° E of City Of Bogo (Cebu), City Of Bogo ,Cebu,2025-10-07 21:28:00,2025-10-07,21:28:00,165.45,3
02/10/2025 21:49,10.89,123.92,9,2.2,019 km S 22° W of City Of Bogo (Cebu), City Of Bogo ,Cebu,2025-10-02 21:49:00,2025-10-02,21:49:00,45.8,0
07/10/2025 5:54,11.07,124.06,22,1.4,009 km N 73° E of City Of Bogo (Cebu), City Of Bogo ,Cebu,2025-10-07 05:54:00,2025-10-07,05:54:00,149.88333333333333,3
06/10/2025 10:24,10.92,123.96,1,2.0,014 km S 08° W of City Of Bogo (Cebu), City Of Bogo ,Cebu,2025-10-06 10:24:00,2025-10-06,10:24:00,130.38333333333333,0
02/10/2025 3:48,10.99,124.06,1,2.3,010 km S 54° E of City Of Bogo (Cebu), City Of Bogo ,Cebu,2025-10-02 03:48:00,2025-10-02,03:48:00,27.783333333333335,1
05/10/2025 18:36,11.15,123.97,26,1.7,012 km N 04° W of City Of Bogo (Cebu), City Of Bogo ,Cebu,2025-10-05 18:36:00,2025-10-05,18:36:00,114.58333333333333,3
08/10/2025 8:13,11.13,124.01,27,1.7,010 km N 21° E of City Of Bogo (Cebu), City Of Bogo ,Cebu,2025-10-08 08:13:00,2025-10-08,08:13:00,176.2,3
25/10/2025 3:03,10.95,123.99,3,2.1,011 km S 04° E of City Of Bogo (Cebu), City Of Bogo ,Cebu,2025-10-25 03:03:00,2025-10-25,03:03:00,579.0333333333333,2
03/10/2025 21:07,11.26,124.19,21,2.3,033 km N 44° E of City Of Bogo (Cebu), City Of Bogo ,Cebu,2025-10-03 21:07:00,2025-10-03,21:07:00,69.1,1
23/10/2025 15:25,11.0,123.99,3,3.0,005 km S 13° E of City Of Bogo (Cebu), City Of Bogo ,Cebu,2025-10-23 15:25:00,2025-10-23,15:25:00,543.4,2
12/10/2025 19:01,11.15,124.16,12,1.9,023 km N 59° E of City Of Bogo (Cebu), City Of Bogo ,Cebu,2025-10-12 19:01:00,2025-10-12,19:01:00,283.0,1
07/10/2025 14:44,11.2,124.15,4,2.1,025 km N 48° E of City Of Bogo (Cebu), City Of Bogo ,Cebu,2025-10-07 14:44:00,2025-10-07,14:44:00,158.71666666666667,1
07/10/2025 7:47,11.08,124.08,30,1.8,012 km N 69° E of City Of Bogo (Cebu), City Of Bogo ,Cebu,2025-10-07 07:47:00,2025-10-07,07:47:00,151.76666666666668,3
03/10/2025 18:04,11.1,124.16,10,1.5,020 km N 72° E of City Of Bogo (Cebu), City Of Bogo ,Cebu,2025-10-03 18:04:00,2025-10-03,18:04:00,66.05,1
06/10/2025 18:56,10.96,124.02,32,2.4,010 km S 23° E of City Of Bogo (Cebu), City Of Bogo ,Cebu,2025-10-06 18:56:00,2025-10-06,18:56:00,138.91666666666666,3
06/10/2025 23:32,11.06,123.97,12,1.8,002 km N 33° W of City Of Bogo (Cebu), City Of Bogo ,Cebu,2025-10-06 23:32:00,2025-10-06,23:32:00,143.51666666666668,3
10/10/2025 17:22,11.17,124.14,9,2.3,022 km N 53° E of City Of Bogo (Cebu), City Of Bogo ,Cebu,2025-10-10 17:22:00,2025-10-10,17:22:00,233.35,1
04/10/2025 4:42,11.08,123.89,29,2.3,010 km N 69° W of City Of Bogo (Cebu), City Of Bogo ,Cebu,2025-10-04 04:42:00,2025-10-04,04:42:00,76.68333333333334,3
30/10/2025 22:44,11.18,124.12,10,2.2,022 km N 46° E of City Of Bogo (Cebu), City Of Bogo ,Cebu,2025-10-30 22:44:00,2025-10-30,22:44:00,718.7166666666667,2
05/10/2025 13:03,11.3,124.08,33,2.2,030 km N 21° E of City Of Bogo (Cebu), City Of Bogo ,Cebu,2025-10-05 13:03:00,2025-10-05,13:03:00,109.03333333333333,3
01/10/2025 22:56,11.14,124.14,10,4.2,020 km N 59° E of City Of Bogo (Cebu), City Of Bogo ,Cebu,2025-10-01 22:56:00,2025-10-01,22:56:00,22.916666666666668,1
02/10/2025 3:05,11.13,124.14,5,2.0,020 km N 61° E of City Of Bogo (Cebu), City Of Bogo ,Cebu,2025-10-02 03:05:00,2025-10-02,03:05:00,27.066666666666666,1
01/10/2025 4:51,11.04,123.92,5,2.1,006 km S 88° W of City Of Bogo (Cebu), City Of Bogo ,Cebu,2025-10-01 04:51:00,2025-10-01,04:51:00,4.833333333333333,0
10/10/2025 6:28,10.94,123.97,16,1.6,011 km S 07° W of City Of Bogo (Cebu), City Of Bogo ,Cebu,2025-10-10 06:28:00,2025-10-10,06:28:00,222.45,0
02/10/2025 13:04,11.22,124.17,7,1.6,029 km N 48° E of City Of Bogo (Cebu), City Of Bogo ,Cebu,2025-10-02 13:04:00,2025-10-02,13:04:00,37.05,1
05/10/2025 23:46,11.2,124.08,33,1.0,020 km N 32° E of City Of Bogo (Cebu), City Of Bogo ,Cebu,2025-10-05 23:46:00,2025-10-05,23:46:00,119.75,3
16/10/2025 23:47,10.99,124.0,32,1.6,006 km S 18° E of City Of Bogo (Cebu), City Of Bogo ,Cebu,2025-10-16 23:47:00,2025-10-16,23:47:00,383.76666666666665,3
01/10/2025 20:46,10.93,123.99,2,1.5,013 km S 07° E of City Of Bogo (Cebu), City Of Bogo ,Cebu,2025-10-01 20:46:00,2025-10-01,20:46:00,20.75,0
02/10/2025 19:15,10.98,124.04,23,1.5,010 km S 44° E of City Of Bogo (Cebu), City Of Bogo ,Cebu,2025-10-02 19:15:00,2025-10-02,19:15:00,43.233333333333334,3
14/10/2025 4:42,11.03,124.01,15,2.0,004 km S 65° E of City Of Bogo (Cebu), City Of Bogo ,Cebu,2025-10-14 04:42:00,2025-10-14,04:42:00,316.68333333333334,2
03/10/2025 4:47,10.98,124.08,18,2.3,013 km S 57° E of City Of Bogo (Cebu), City Of Bogo ,Cebu,2025-10-03 04:47:00,2025-10-03,04:47:00,52.766666666666666,1
02/10/2025 19:46,10.99,124.01,5,3.1,007 km S 26° E of City Of Bogo (Cebu), City Of Bogo ,Cebu,2025-10-02 19:46:00,2025-10-02,19:46:00,43.75,0
09/10/2025 5:04,10.92,123.89,3,1.7,017 km S 36° W of City Of Bogo (Cebu), City Of Bogo ,Cebu,2025-10-09 05:04:00,2025-10-09,05:04:00,197.05,0
02/10/2025 15:18,10.96,123.91,30,2.9,012 km S 38° W of City Of Bogo (Cebu), City Of Bogo ,Cebu,2025-10-02 15:18:00,2025-10-02,15:18:00,39.28333333333333,0
09/10/2025 0:26,11.17,123.98,33,1.6,013 km N 01° E of City Of Bogo (Cebu), City Of Bogo ,Cebu,2025-10-09 00:26:00,2025-10-09,00:26:00,192.41666666666666,3
01/10/2025 7:41,11.11,124.1,6,1.4,015 km N 64° E of City Of Bogo (Cebu), City Of Bogo ,Cebu,2025-10-01 07:41:00,2025-10-01,07:41:00,7.666666666666667,1
02/10/2025 22:48,11.24,124.1,32,2.8,024 km N 31° E of City Of Bogo (Cebu), City Of Bogo ,Cebu,2025-10-02 22:48:00,2025-10-02,22:48:00,46.78333333333333,3
07/10/2025 3:54,11.16,124.03,19,1.5,014 km N 24° E of City Of Bogo (Cebu), City Of Bogo ,Cebu,2025-10-07 03:54:00,2025-10-07,03:54:00,147.88333333333333,3
03/10/2025 22:19,11.05,124.03,15,2.1,006 km N 83° E of City Of Bogo (Cebu), City Of Bogo ,Cebu,2025-10-03 22:19:00,2025-10-03,22:19:00,70.3,1
28/10/2025 21:49,11.09,123.94,25,2.4,007 km N 42° W of City Of Bogo (Cebu), City Of Bogo ,Cebu,2025-10-28 21:49:00,2025-10-28,21:49:00,669.8,2
01/10/2025 8:26,11.01,124.03,31,2.0,006 km S 55° E of City Of Bogo (Cebu), City Of Bogo ,Cebu,2025-10-01 08:26:00,2025-10-01,08:26:00,8.416666666666666,3
12/10/2025 21:42,11.21,124.13,28,2.1,025 km N 42° E of City Of Bogo (Cebu), City Of Bogo ,Cebu,2025-10-12 21:42:00,2025-10-12,21:42:00,285.68333333333334,3
09/10/2025 3:54,10.95,124.02,24,1.0,011 km S 21° E of City Of Bogo (Cebu), City Of Bogo ,Cebu,2025-10-09 03:54:00,2025-10-09,03:54:00,195.88333333333333,3
05/10/2025 5:32,11.1,124.1,31,2.7,014 km N 64° E of City Of Bogo (Cebu), City Of Bogo ,Cebu,2025-10-05 05:32:00,2025-10-05,05:32:00,101.51666666666667,3
01/10/2025 2:25,11.13,124.14,3,2.6,020 km N 63° E of City Of Bogo (Cebu), City Of Bogo ,Cebu,2025-10-01 02:25:00,2025-10-01,02:25:00,2.4,1
02/10/2025 3:01,11.23,124.09,29,1.5,023 km N 30° E of City Of Bogo (Cebu), City Of Bogo ,Cebu,2025-10-02 03:01:00,2025-10-02,03:01:00,27.0,3
05/10/2025 22:57,11.15,123.93,8,2.0,012 km N 27° W of City Of Bogo (Cebu), City Of Bogo ,Cebu,2025-10-05 22:57:00,2025-10-05,22:57:00,118.93333333333334,1
01/10/2025 20:22,11.16,124.07,34,2.3,016 km N 37° E of City Of Bogo (Cebu), City Of Bogo ,Cebu,2025-10-01 20:22:00,2025-10-01,20:22:00,20.35,3
01/10/2025 12:27,11.11,124.01,18,2.6,008 km N 24° E of City Of Bogo (Cebu), City Of Bogo ,Cebu,2025-10-01 12:27:00,2025-10-01,12:27:00,12.433333333333334,1
01/10/2025 12:42,11.09,123.94,10,4.3,006 km N 41° W of City Of Bogo (Cebu), City Of Bogo ,Cebu,2025-10-01 12:42:00,2025-10-01,12:42:00,12.683333333333334,0
05/10/2025 9:02,10.96,123.9,8,2.5,013 km S 36° W of City Of Bogo (Cebu), City Of Bogo ,Cebu,2025-10-05 09:02:00,2025-10-05,09:02:00,105.01666666666667,0
05/10/2025 15:52,10.88,123.88,2,2.4,021 km S 30° W of City Of Bogo (Cebu), City Of Bogo ,Cebu,2025-10-05 15:52:00,2025-10-05,15:52:00,111.85,0
24/10/2025 6:21,11.1,123.9,26,2.3,010 km N 55° W of City Of Bogo (Cebu), City Of Bogo ,Cebu,2025-10-24 06:21:00,2025-10-24,06:21:00,558.3333333333334,2
02/10/2025 14:34,11.14,124.1,33,1.8,017 km N 53° E of City Of Bogo (Cebu), City Of Bogo ,Cebu,2025-10-02 14:34:00,2025-10-02,14:34:00,38.55,3
07/10/2025 4:39,11.12,124.0,32,1.7,009 km N 12° E of City Of Bogo (Cebu), City Of Bogo ,Cebu,2025-10-07 04:39:00,2025-10-07,04:39:00,148.63333333333333,3
02/10/2025 4:01,11.12,124.14,10,3.3,019 km N 65° E of City Of Bogo (Cebu), City Of Bogo ,Cebu,2025-10-02 04:01:00,2025-10-02,04:01:00,28.0,1
08/10/2025 15:25,11.06,123.87,30,2.0,012 km N 84° W of City Of Bogo (Cebu), City Of Bogo ,Cebu,2025-10-08 15:25:00,2025-10-08,15:25:00,183.4,3
04/10/2025 18:06,11.0,124.0,28,1.7,005 km S 22° E of City Of Bogo (Cebu), City Of Bogo ,Cebu,2025-10-04 18:06:00,2025-10-04,18:06:00,90.08333333333333,3
02/10/2025 5:12,10.92,123.96,6,2.6,015 km S 08° W of City Of Bogo (Cebu), City Of Bogo ,Cebu,2025-10-02 05:12:00,2025-10-02,05:12:00,29.183333333333334,0
01/10/2025 20:11,11.01,124.06,4,2.8,009 km S 65° E of City Of Bogo (Cebu), City Of Bogo ,Cebu,2025-10-01 20:11:00,2025-10-01,20:11:00,20.166666666666668,1
02/10/2025 0:43,10.91,123.97,7,3.6,015 km S 05° W of City Of Bogo (Cebu), City Of Bogo ,Cebu,2025-10-02 00:43:00,2025-10-02,00:43:00,24.7,0
03/10/2025 5:15,11.05,124.0,3,1.8,003 km N 76° E of City Of Bogo (Cebu), City Of Bogo ,Cebu,2025-10-03 05:15:00,2025-10-03,05:15:00,53.233333333333334,1
07/10/2025 21:37,11.25,123.97,8,2.7,022 km N 03° W of City Of Bogo (Cebu), City Of Bogo ,Cebu,2025-10-07 21:37:00,2025-10-07,21:37:00,165.6,1
26/10/2025 22:02,11.12,124.03,7,1.6,010 km N 36° E of City Of Bogo (Cebu), City Of Bogo ,Cebu,2025-10-26 22:02:00,2025-10-26,22:02:00,622.0166666666667,2
06/10/2025 11:23,10.97,123.94,4,2.2,010 km S 26° W of City Of Bogo (Cebu), City Of Bogo ,Cebu,2025-10-06 11:23:00,2025-10-06,11:23:00,131.36666666666667,0
01/10/2025 15:35,10.93,123.96,2,1.7,013 km S 10° W of City Of Bogo (Cebu), City Of Bogo ,Cebu,2025-10-01 15:35:00,2025-10-01,15:35:00,15.566666666666666,0
27/10/2025 12:49,10.98,123.98,5,2.9,007 km S 03° E of City Of Bogo (Cebu), City Of Bogo ,Cebu,2025-10-27 12:49:00,2025-10-27,12:49:00,636.8,2
06/10/2025 23:59,11.12,123.9,1,1.2,013 km N 44° W of City Of Bogo (Cebu), City Of Bogo ,Cebu,2025-10-06 23:59:00,2025-10-06,23:59:00,143.96666666666667,1
08/10/2025 2:05,11.16,124.09,7,1.8,022 km N 36° E of City Of Bogo (Cebu), City Of Bogo ,Cebu,2025-10-08 02:05:00,2025-10-08,02:05:00,170.06666666666666,1
02/10/2025 15:39,11.12,124.01,20,1.9,009 km N 21° E of City Of Bogo (Cebu), City Of Bogo ,Cebu,2025-10-02 15:39:00,2025-10-02,15:39:00,39.63333333333333,3
01/10/2025 1:55,10.9,124.02,38,2.5,017 km S 14° E of City Of Bogo (Cebu), City Of Bogo ,Cebu,2025-10-01 01:55:00,2025-10-01,01:55:00,1.9,3
01/10/2025 1:04,11.14,124.1,8,2.1,017 km N 53° E of City Of Bogo (Cebu), City Of Bogo ,Cebu,2025-10-01 01:04:00,2025-10-01,01:04:00,1.05,1
07/10/2025 2:53,11.11,123.99,32,1.4,007 km N 09° E of City Of Bogo (Cebu), City Of Bogo ,Cebu,2025-10-07 02:53:00,2025-10-07,02:53:00,146.86666666666667,3
01/10/2025 21:32,10.98,124.04,7,3.3,010 km S 40° E of City Of Bogo (Cebu), City Of Bogo ,Cebu,2025-10-01 21:32:00,2025-10-01,21:32:00,21.516666666666666,0
01/10/2025 10:36,11.14,124.06,10,1.5,013 km N 40° E of City Of Bogo (Cebu), City Of Bogo ,Cebu,2025-10-01 10:36:00,2025-10-01,10:36:00,10.583333333333334,1
04/10/2025 23:17,10.93,123.95,11,2.5,013 km S 13° W of City Of Bogo (Cebu), City Of Bogo ,Cebu,2025-10-04 23:17:00,2025-10-04,23:17:00,95.26666666666667,0
04/10/2025 12:22,11.09,124.1,32,2.5,014 km N 69° E of City Of Bogo (Cebu), City Of Bogo ,Cebu,2025-10-04 12:22:00,2025-10-04,12:22:00,84.35,3
01/10/2025 9:15,11.16,124.18,4,2.4,026 km N 61° E of City Of Bogo (Cebu), City Of Bogo ,Cebu,2025-10-01 09:15:00,2025-10-01,09:15:00,9.233333333333333,1
18/10/2025 4:35,11.01,124.03,33,1.7,006 km S 54° E of City Of Bogo (Cebu), City Of Bogo ,Cebu,2025-10-18 04:35:00,2025-10-18,04:35:00,412.56666666666666,3
05/10/2025 14:16,11.1,123.94,8,2.9,007 km N 33° W of City Of Bogo (Cebu), City Of Bogo ,Cebu,2025-10-05 14:16:00,2025-10-05,14:16:00,110.25,0
07/10/2025 21:58,11.03,124.02,3,2.5,005 km S 68° E of City Of Bogo (Cebu), City Of Bogo ,Cebu,2025-10-07 21:58:00,2025-10-07,21:58:00,165.95,0
07/10/2025 12:45,11.14,124.07,31,2.0,014 km N 42° E of City Of Bogo (Cebu), City Of Bogo ,Cebu,2025-10-07 12:45:00,2025-10-07,12:45:00,156.73333333333332,3
01/10/2025 2:52,11.2,124.07,25,2.2,020 km N 31° E of City Of Bogo (Cebu), City Of Bogo ,Cebu,2025-10-01 02:52:00,2025-10-01,02:52:00,2.85,3
12/10/2025 22:53,11.16,124.13,33,2.2,021 km N 52° E of City Of Bogo (Cebu), City Of Bogo ,Cebu,2025-10-12 22:53:00,2025-10-12,22:53:00,286.8666666666667,3
01/10/2025 4:56,11.28,124.02,34,2.2,026 km N 10° E of City Of Bogo (Cebu), City Of Bogo ,Cebu,2025-10-01 04:56:00,2025-10-01,04:56:00,4.916666666666667,3
11/10/2025 4:40,11.03,124.01,31,1.9,003 km S 65° E of City Of Bogo (Cebu), City Of Bogo ,Cebu,2025-10-11 04:40:00,2025-10-11,04:40:00,244.65,3
03/10/2025 0:16,10.94,123.92,1,2.0,013 km S 28° W of City Of Bogo (Cebu), City Of Bogo ,Cebu,2025-10-03 00:16:00,2025-10-03,00:16:00,48.25,0
17/10/2025 23:36,10.94,123.94,2,2.1,013 km S 18° W of City Of Bogo (Cebu), City Of Bogo ,Cebu,2025-10-17 23:36:00,2025-10-17,23:36:00,407.5833333333333,0
04/10/2025 21:22,11.17,123.98,24,1.3,013 km N 01° W of City Of Bogo (Cebu), City Of Bogo ,Cebu,2025-10-04 21:22:00,2025-10-04,21:22:00,93.35,3
02/10/2025 16:51,11.0,124.09,13,2.4,013 km S 67° E of City Of Bogo (Cebu), City Of Bogo ,Cebu,2025-10-02 16:51:00,2025-10-02,16:51:00,40.833333333333336,1
11/10/2025 0:36,11.13,124.0,12,2.5,009 km N 15° E of City Of Bogo (Cebu), City Of Bogo ,Cebu,2025-10-11 00:36:00,2025-10-11,00:36:00,240.58333333333334,1
05/10/2025 6:34,10.87,123.93,1,2.0,021 km S 17° W of City Of Bogo (Cebu), City Of Bogo ,Cebu,2025-10-05 06:34:00,2025-10-05,06:34:00,102.55,0
06/10/2025 20:38,11.13,124.02,9,2.0,010 km N 26° E of City Of Bogo (Cebu), City Of Bogo ,Cebu,2025-10-06 20:38:00,2025-10-06,20:38:00,140.61666666666667,1
03/10/2025 19:10,10.96,124.01,22,1.6,010 km S 19° E of City Of Bogo (Cebu), City Of Bogo ,Cebu,2025-10-03 19:10:00,2025-10-03,19:10:00,67.15,3
26/10/2025 22:48,11.08,124.12,32,2.3,016 km N 78° E of City Of Bogo (Cebu), City Of Bogo ,Cebu,2025-10-26 22:48:00,2025-10-26,22:48:00,622.7833333333333,2
03/10/2025 1:24,11.22,123.97,9,2.5,020 km N 02° W of City Of Bogo (Cebu), City Of Bogo ,Cebu,2025-10-03 01:24:00,2025-10-03,01:24:00,49.38333333333333,1
01/10/2025 18:34,11.35,124.12,33,2.0,037 km N 25° E of City Of Bogo (Cebu), City Of Bogo ,Cebu,2025-10-01 18:34:00,2025-10-01,18:34:00,18.55,3
07/10/2025 4:33,10.93,123.91,2,2.3,015 km S 30° W of City Of Bogo (Cebu), City Of Bogo ,Cebu,2025-10-07 04:33:00,2025-10-07,04:33:00,148.53333333333333,0
13/10/2025 22:25,11.0,124.06,2,2.0,010 km S 60° E of City Of Bogo (Cebu), City Of Bogo ,Cebu,2025-10-13 22:25:00,2025-10-13,22:25:00,310.4,1
08/10/2025 6:50,11.04,124.08,2,2.5,011 km S 84° E of City Of Bogo (Cebu), City Of Bogo ,Cebu,2025-10-08 06:50:00,2025-10-08,06:50:00,174.81666666666666,1
08/10/2025 11:28,10.99,123.96,5,3.0,007 km S 16° W of City Of Bogo (Cebu), City Of Bogo ,Cebu,2025-10-08 11:28:00,2025-10-08,11:28:00,179.45,0
02/10/2025 21:26,10.77,124.02,21,2.1,031 km S 08° E of City Of Bogo (Cebu), City Of Bogo ,Cebu,2025-10-02 21:26:00,2025-10-02,21:26:00,45.416666666666664,0
20/10/2025 14:52,11.19,123.95,27,1.5,016 km N 10° W of City Of Bogo (Cebu), City Of Bogo ,Cebu,2025-10-20 14:52:00,2025-10-20,14:52:00,470.85,3
24/10/2025 23:31,11.14,123.93,4,1.7,011 km N 28° W of City Of Bogo (Cebu), City Of Bogo ,Cebu,2025-10-24 23:31:00,2025-10-24,23:31:00,575.5,2
27/10/2025 11:45,11.28,124.02,3,2.7,026 km N 11° E of City Of Bogo (Cebu), City Of Bogo ,Cebu,2025-10-27 11:45:00,2025-10-27,11:45:00,635.7333333333333,2
30/10/2025 8:17,11.17,123.99,28,1.8,013 km N 04° E of City Of Bogo (Cebu), City Of Bogo ,Cebu,2025-10-30 08:17:00,2025-10-30,08:17:00,704.2666666666667,2
30/10/2025 1:18,10.99,123.84,31,1.9,016 km S 68° W of City Of Bogo (Cebu), City Of Bogo ,Cebu,2025-10-30 01:18:00,2025-10-30,01:18:00,697.2833333333333,2
02/10/2025 20:05,10.99,123.75,4,2.9,026 km S 76° W of City Of Bogo (Cebu), City Of Bogo ,Cebu,2025-10-02 20:05:00,2025-10-02,20:05:00,44.06666666666667,0
04/10/2025 20:52,11.14,123.88,5,1.9,015 km N 49° W of City Of Bogo (Cebu), City Of Bogo ,Cebu,2025-10-04 20:52:00,2025-10-04,20:52:00,92.85,0
04/10/2025 15:17,10.87,123.91,5,2.4,021 km S 21° W of City Of Bogo (Cebu), City Of Bogo ,Cebu,2025-10-04 15:17:00,2025-10-04,15:17:00,87.26666666666667,0
01/10/2025 23:40,11.1,123.95,5,3.6,007 km N 29° W of City Of Bogo (Cebu), City Of Bogo ,Cebu,2025-10-01 23:40:00,2025-10-01,23:40:00,23.65,0
09/10/2025 6:23,11.18,124.05,26,1.8,017 km N 26° E of City Of Bogo (Cebu), City Of Bogo ,Cebu,2025-10-09 06:23:00,2025-10-09,06:23:00,198.36666666666667,3
11/10/2025 5:44,11.04,123.97,3,3.1,001 km S 73° W of City Of Bogo (Cebu), City Of Bogo ,Cebu,2025-10-11 05:44:00,2025-10-11,05:44:00,245.71666666666667,0
08/10/2025 16:47,11.25,123.95,30,2.7,023 km N 09° W of City Of Bogo (Cebu), City Of Bogo ,Cebu,2025-10-08 16:47:00,2025-10-08,16:47:00,184.76666666666668,3
02/10/2025 5:11,11.07,124.16,3,1.6,020 km N 82° E of City Of Bogo (Cebu), City Of Bogo ,Cebu,2025-10-02 05:11:00,2025-10-02,05:11:00,29.166666666666668,1
07/10/2025 2:11,11.15,124.01,18,1.6,012 km N 18° E of City Of Bogo (Cebu), City Of Bogo ,Cebu,2025-10-07 02:11:00,2025-10-07,02:11:00,146.16666666666666,3
11/10/2025 13:12,11.09,124.07,23,2.2,012 km N 63° E of City Of Bogo (Cebu), City Of Bogo ,Cebu,2025-10-11 13:12:00,2025-10-11,13:12:00,253.18333333333334,3
08/10/2025 3:00,10.9,123.86,1,2.5,021 km S 39° W of City Of Bogo (Cebu), City Of Bogo ,Cebu,2025-10-08 03:00:00,2025-10-08,03:00:00,170.98333333333332,0
03/10/2025 20:42,11.0,123.93,3,2.5,008 km S 44° W of City Of Bogo (Cebu), City Of Bogo ,Cebu,2025-10-03 20:42:00,2025-10-03,20:42:00,68.68333333333334,0
25/10/2025 0:34,10.99,124.0,5,3.7,006 km S 25° E of City Of Bogo (Cebu), City Of Bogo ,Cebu,2025-10-25 00:34:00,2025-10-25,00:34:00,576.55,2
01/10/2025 7:09,11.21,124.16,10,2.2,027 km N 49° E of City Of Bogo (Cebu), City Of Bogo ,Cebu,2025-10-01 07:09:00,2025-10-01,07:09:00,7.133333333333334,1
06/10/2025 16:51,10.92,123.96,1,1.8,014 km S 10° W of City Of Bogo (Cebu), City Of Bogo ,Cebu,2025-10-06 16:51:00,2025-10-06,16:51:00,136.83333333333334,0
21/10/2025 3:35,10.94,123.91,2,3.0,014 km S 31° W of City Of Bogo (Cebu), City Of Bogo ,Cebu,2025-10-21 03:35:00,2025-10-21,03:35:00,483.56666666666666,0
29/10/2025 22:12,10.92,123.81,5,3.6,023 km S 52° W of City Of Bogo (Cebu), City Of Bogo ,Cebu,2025-10-29 22:12:00,2025-10-29,22:12:00,694.1833333333333,0
08/10/2025 17:09,11.02,124.06,33,2.0,009 km S 73° E of City Of Bogo (Cebu), City Of Bogo ,Cebu,2025-10-08 17:09:00,2025-10-08,17:09:00,185.13333333333333,3
02/10/2025 5:20,10.9,123.92,2,3.1,018 km S 23° W of City Of Bogo (Cebu), City Of Bogo ,Cebu,2025-10-02 05:20:00,2025-10-02,05:20:00,29.316666666666666,0
02/10/2025 11:14,10.91,123.95,7,3.3,015 km S 11° W of City Of Bogo (Cebu), City Of Bogo ,Cebu,2025-10-02 11:14:00,2025-10-02,11:14:00,35.21666666666667,0
04/10/2025 19:46,11.12,123.98,9,1.6,008 km N 02° E of City Of Bogo (Cebu), City Of Bogo ,Cebu,2025-10-04 19:46:00,2025-10-04,19:46:00,91.75,1
15/10/2025 22:41,11.15,124.11,2,2.4,018 km N 53° E of City Of Bogo (Cebu), City Of Bogo ,Cebu,2025-10-15 22:41:00,2025-10-15,22:41:00,358.6666666666667,1
05/10/2025 3:03,11.03,124.01,4,2.3,004 km S 58° E of City Of Bogo (Cebu), City Of Bogo ,Cebu,2025-10-05 03:03:00,2025-10-05,03:03:00,99.03333333333333,0
03/10/2025 5:11,11.15,124.12,5,2.6,019 km N 55° E of City Of Bogo (Cebu), City Of Bogo ,Cebu,2025-10-03 05:11:00,2025-10-03,05:11:00,53.166666666666664,1
02/10/2025 3:32,11.17,124.18,5,2.0,025 km N 58° E of City Of Bogo (Cebu), City Of Bogo ,Cebu,2025-10-02 03:32:00,2025-10-02,03:32:00,27.516666666666666,1
04/10/2025 20:20,11.0,124.0,5,2.5,006 km S 25° E of City Of Bogo (Cebu), City Of Bogo ,Cebu,2025-10-04 20:20:00,2025-10-04,20:20:00,92.31666666666666,0
21/10/2025 15:04,11.27,124.21,17,2.4,035 km N 46° E of City Of Bogo (Cebu), City Of Bogo ,Cebu,2025-10-21 15:04:00,2025-10-21,15:04:00,495.05,1
13/10/2025 3:18,11.03,124.04,7,4.2,006 km S 78° E of City Of Bogo (Cebu), City Of Bogo ,Cebu,2025-10-13 03:18:00,2025-10-13,03:18:00,291.28333333333336,0
30/10/2025 9:46,10.98,123.98,7,2.2,008 km S 02° W of City Of Bogo (Cebu), City Of Bogo ,Cebu,2025-10-30 09:46:00,2025-10-30,09:46:00,705.75,2
12/10/2025 4:39,10.95,123.81,33,1.8,022 km S 62° W of City Of Bogo (Cebu), City Of Bogo ,Cebu,2025-10-12 04:39:00,2025-10-12,04:39:00,268.6333333333333,3
03/10/2025 5:23,11.13,124.16,7,3.7,022 km N 66° E of City Of Bogo (Cebu), City Of Bogo ,Cebu,2025-10-03 05:23:00,2025-10-03,05:23:00,53.36666666666667,1
13/10/2025 0:32,11.15,124.13,6,2.3,020 km N 55° E of City Of Bogo (Cebu), City Of Bogo ,Cebu,2025-10-13 00:32:00,2025-10-13,00:32:00,288.51666666666665,1
30/10/2025 11:40,11.0,124.03,5,2.6,008 km S 50° E of City Of Bogo (Cebu), City Of Bogo ,Cebu,2025-10-30 11:40:00,2025-10-30,11:40:00,707.65,2
26/10/2025 22:33,10.91,123.9,1,2.4,017 km S 31° W of City Of Bogo (Cebu), City Of Bogo ,Cebu,2025-10-26 22:33:00,2025-10-26,22:33:00,622.5333333333333,2
13/10/2025 2:24,10.96,123.92,10,3.4,011 km S 34° W of City Of Bogo (Cebu), City Of Bogo ,Cebu,2025-10-13 02:24:00,2025-10-13,02:24:00,290.3833333333333,0
01/10/2025 22:46,11.15,124.17,7,5.0,023 km N 62° E of City Of Bogo (Cebu), City Of Bogo ,Cebu,2025-10-01 22:46:00,2025-10-01,22:46:00,22.75,1
15/10/2025 12:37,11.08,124.12,36,2.5,015 km N 76° E of City Of Bogo (Cebu), City Of Bogo ,Cebu,2025-10-15 12:37:00,2025-10-15,12:37:00,348.6,3
